url,name,category,price,availability,average_rating,rating_count,imgUrl,description,content,pro/cal,pri/we,html_path,last_upd_time,weight,proteins,fats,carbohydrates,calories,fetchErr
https://www.ozon.ru/product/nabor-dlya-okroshki-luk-ukrop-redis-200-g-555024951/,"Набор для окрошки (лук, укроп, редис), 200 г","Ozon fresh#Овощи, фрукты, зелень#Овощи и зелень#Зелень, пряные травы",180,1,4.9,866,https://cdn1.ozone.ru/s3/multimedia-j/6116952211.jpg,"Набор для окрошки (лук, укроп, редис), 200 г",,0,0,,2025-06-13 10:45:03,,,,,20.65,
https://www.ozon.ru/product/sparzha-po-koreyski-200-g-2039111048/,"Спаржа по-корейски, 200 г","Ozon fresh#Овощи, фрукты, зелень#Овощи и зелень#Соленья и квашенья#Традиции Вкуса",179,1,4.6,100,https://cdn1.ozone.ru/s3/multimedia-1-i/7573601610.jpg,,"соевый продукт ""спаржа"" (соевые бобы, вода), маринад (вода питьевая, 
масло подсолнечное, соль пищевая, чеснок, 
усилитель вкуса и аромата - глутамат натрия 1-замещенный, регулятор кислотности - уксусная кислота ледяная, кориандр молотый, перец красный острый молотый,  консерванты (бензоат натрия, сорбат калия), смесь подсластителей (цикламат натрия, сахаринат натрия). 
Содержит подсластители. 
Продукция производится на предприятии, где используется аллерген - аспартам.",0.05217391304347826,0.895,,2025-06-13 10:45:03,200,6,7.5,5,115,
https://www.ozon.ru/product/limony-otbornye-2-sht-1062698843/,Лимоны отборные  2 шт,"Ozon fresh#Овощи, фрукты, зелень#Фрукты и ягоды#Цитрусовые",87,1,4.9,2238,https://cdn1.ozone.ru/s3/multimedia-1-n/7542327803.jpg,"Ароматный цитрус с ярко выраженным кислым вкусом. Обладают антисептическими, противомикробными, потогонными и очищающими свойствами. Укрепляют здоровье дыхательных путей, сердца и сосудов, желудочно-кишечного тракта и почек.",Лимон,0.026470588235294117,0.435,,2025-06-13 10:45:03,200,0.9,0.1,3,34,
https://www.ozon.ru/product/tomaty-450-g-flamenko-slivovidnye-krasnye-1062699008/,"Томаты 450 г, Фламенко, сливовидные, красные","Ozon fresh#Овощи, фрукты, зелень#Овощи и зелень#Помидоры#РОСТ",149,1,4.8,37,https://cdn1.ozone.ru/s3/multimedia-1-b/7557613139.jpg,"Сливовидные томаты Flamenco насыщенно-красные не только снаружи, но и внутри. 
Содержат на 50% больше полезного ликопина.Плоды отличаются отличным балансом сладости и натуральной кислинки с хорошей интенсивностью. Обладают эталонной комбинацией мякоти и сочности с длительным томатным слевкусием. Бренд Flamenco -  страсть ко вкусу: настоящие томаты с исключительно насыщенным цветом.",,0.05333333333333334,0.33111111111111113,,2025-06-13 10:45:03,450,0.8,0.1,2.8,15,
https://www.ozon.ru/product/yabloki-gala-4-sht-600-g-sobrano-v-sadu-1920214650/,"Яблоки Гала 4 шт, 600 г, Собрано в саду","Ozon fresh#Овощи, фрукты, зелень#Фрукты и ягоды#Яблоки, груши#Собрано в саду",236,1,4.9,112,https://cdn1.ozone.ru/s3/multimedia-1-q/7420896890.jpg,,яблоко,0.00851063829787234,0.3933333333333333,,2025-06-13 10:45:04,600,0.4,0.4,9.8,47,
https://www.ozon.ru/product/fruktovyy-desert-klubnika-mango-4-sht-h-100-g-sila-traditsii-563808183/,"Фруктовый десерт клубника - манго 4 шт х 100 г, Сила Традиции","Ozon fresh#Овощи, фрукты, зелень#Фрукты и ягоды#Наборы фруктов и пюре#Сила Традиции",190,1,4.9,1015,https://cdn1.ozone.ru/s3/multimedia-1-v/7348456831.jpg,Фруктовый десерт Клубника-Манго,"Манго,клубника",0.007884615384615384,0.475,,2025-06-13 10:45:04,400,0.41,0.15,12.57,52,
https://www.ozon.ru/product/grusha-forel-500-g-205093150/,Груша Форел 500 г,"Ozon fresh#Овощи, фрукты, зелень#Фрукты и ягоды#Яблоки, груши",179,1,4.7,3679,https://cdn1.ozone.ru/s3/multimedia-1-q/7348456646.jpg,"Груши форел — одни из самых красивых, сочных и очень сладких. Блестящие плоды, окрашенные в насыщенный желто-зеленый цвет, на котором проявляются ярко-красные крапинки. На пике спелости эти груши буквально тают во рту, оставаясь при этом плотными и невероятно ароматными.

Допустимы незначительные протертости кожицы плода.
Калибр груши зависит от времени года, есть как крупные плоды, так и мелкие.",Груша,0.009523809523809525,0.358,,2025-06-13 10:45:04,500,0.4,0.3,10.9,42,
https://www.ozon.ru/product/granadilla-mangoed-1-sht-672925952/,"Гранадилла, MANGOED, 1 шт","Ozon fresh#Овощи, фрукты, зелень#Фрукты и ягоды#Экзотические фрукты#Mangoed",285,1,4.9,1052,https://cdn1.ozone.ru/s3/multimedia-1-3/7168037859.jpg,"Гранадилла, 1 шт",Гранадилла свежая,0.010869565217391304,3.1666666666666665,,2025-06-13 10:45:04,90,0.5,0.1,8,46,
https://www.ozon.ru/product/klubnika-protertaya-s-saharom-200-g-feg-166823284/,"Клубника протертая с сахаром 200 г, ФЭГ","Ozon fresh#Овощи, фрукты, зелень#Фрукты и ягоды#Протертые ягоды#ФЭГ",157,1,4.8,1945,https://cdn1.ozone.ru/s3/multimedia-1-s/7542220204.jpg,"Протертая ягода — это продукт, в котором мы сохранили вкус, пользу и свежесть ягод! Он прекрасно дополнит любое чаепитие, станет основой для вкуснейших морсов, а также начинкой для открытой выпечки. Протертая ягода — это источник витаминов!","Клубника, сахар",0.0018181818181818182,0.785,,2025-06-13 10:45:04,200,0.4,0.2,53,220,
https://www.ozon.ru/product/mandariny-sladkie-s-kostochkami-nadorkott-500-g-1625318471/,"Мандарины сладкие, с косточками, Надоркотт, 500 г","Ozon fresh#Овощи, фрукты, зелень#Фрукты и ягоды#Цитрусовые",135,1,4.9,38,https://cdn1.ozone.ru/s3/multimedia-1-z/7513324703.jpg,"Мандарины-малыши с ярким сладким вкусом. Сочные, ароматные, покрыты яркой оранжевой шкуркой с небольшой зеленцой. Идеальны для тех, кто любит сладкие мандарины-мини. 

Допустим цвет кожуры с зеленцой, дырки от веточек не являются дефектом. Кислинка во вкусе и калибр зависят от времени года, есть как и крупные плоды, так и мелкие. Допустимы незначительные зарубцевавшиеся механические повреждения, протертости, незначительное и частичное отделение кожуры плода.",,0,0.27,,2025-06-13 10:45:05,500,,,,33,
https://www.ozon.ru/product/vinograd-kish-mish-sladkiy-500-g-327111109/,Виноград Киш-Миш сладкий 500 г,"Ozon fresh#Овощи, фрукты, зелень#Фрукты и ягоды#Ягоды",309,1,4.8,1626,https://cdn1.ozone.ru/s3/multimedia-1-5/7199188337.jpg,"Виноград Киш-Миш, 500 г",Виноград Киш-Миш,0,0,,2025-06-13 10:45:05,,,,,,
https://www.ozon.ru/product/salatnyy-miks-leon-150-g-belaya-dacha-1149627127/,"Салатный микс Леон 150 г, Белая Дача","Ozon fresh#Овощи, фрукты, зелень#Овощи и зелень#Салат#Белая Дача",135,1,4.8,1389,https://cdn1.ozone.ru/s3/multimedia-1-1/7542352261.jpg,,"салат айсберг, морковь, капуста краснокочанная (в изменяемых соотношениях)",0.06018518518518518,0.9,,2025-06-13 10:45:05,150,1.30,0.20,2.90,21.60,
https://www.ozon.ru/product/klubnika-dlya-varenya-200-g-s-bochkami-626547214/,"Клубника для варенья 200 г, с бочками","Ozon fresh#Овощи, фрукты, зелень#Фрукты и ягоды#Ягоды",179,1,4.8,830,https://cdn1.ozone.ru/s3/multimedia-s/6688817944.jpg,"Клубника для варенья, с бочками",,0.01951219512195122,0.895,,2025-06-13 10:45:05,200,0.8,0.4,7.5,41,
https://www.ozon.ru/product/yabloki-fudzhi-4-sht-600-g-sobrano-v-sadu-1920214448/,"Яблоки Фуджи 4 шт, 600 г, Собрано в саду","Ozon fresh#Овощи, фрукты, зелень#Фрукты и ягоды#Яблоки, груши#Собрано в саду",236,1,4.8,192,https://cdn1.ozone.ru/s3/multimedia-1-x/7382137677.jpg,,яблоко,0.00851063829787234,0.3933333333333333,,2025-06-13 10:45:05,600,0.4,0.4,9.8,47,
https://www.ozon.ru/product/ogurets-gladkiy-1-sht-luhovitskie-ovoshchi-2172971158/,"Огурец гладкий 1 шт, Луховицкие овощи","Ozon fresh#Овощи, фрукты, зелень#Овощи и зелень#Огурцы",55,1,4.9,29,https://cdn1.ozone.ru/s3/multimedia-1-6/7349620074.jpg,"Огурец Луховицкий, 1 шт",,0.043333333333333335,0.2619047619047619,,2025-06-13 10:45:06,210,0.65,0.11,3.63,15,
https://www.ozon.ru/product/batat-400-g-2241240327/,"Батат, 400 г","Ozon fresh#Овощи, фрукты, зелень#Овощи и зелень#Картофель",177,1,,,https://cdn1.ozone.ru/s3/multimedia-o/6770183268.jpg,,Картофель батат свежий,0.018255813953488374,0.4425,,2025-06-13 10:45:06,400,1.57,0.05,20,86,
https://www.ozon.ru/product/grusha-pakham-600-g-262583513/,Груша Пакхам 600 г,"Ozon fresh#Овощи, фрукты, зелень#Фрукты и ягоды#Яблоки, груши",133,1,4.7,1151,https://cdn1.ozone.ru/s3/multimedia-3/6481491723.jpg,"Груша Пахкам, 700 г",,0.016666666666666666,0.22166666666666668,,2025-06-13 10:45:06,600,0.7,0.15,10.85,42,
https://www.ozon.ru/product/vinograd-red-glob-500-g-425637863/,Виноград Ред Глоб 500 г,"Ozon fresh#Овощи, фрукты, зелень#Фрукты и ягоды#Ягоды",329,1,4.9,709,https://cdn1.ozone.ru/s3/multimedia-1-r/7337089395.jpg,"Виноград Ред Глоб, 500 г",,0,0,,2025-06-13 10:45:06,,,,,,
https://www.ozon.ru/product/mushmula-garmonichnyy-vkus-s-kislinkoy-150-g-598822967/,"Мушмула, гармоничный вкус с кислинкой, 150 г","Ozon fresh#Овощи, фрукты, зелень#Фрукты и ягоды#Экзотические фрукты",294,1,4.6,818,https://cdn1.ozone.ru/s3/multimedia-n/6354658199.jpg,"Мушмула, гармоничный вкус с кислинкой, Алжир, 250 г",мушмула,0,1.96,,2025-06-13 10:45:06,150,,,,,
https://www.ozon.ru/product/sliva-svezhaya-krasnaya-250-g-1869746915/,"Слива свежая красная, 250 г","Ozon fresh#Овощи, фрукты, зелень#Фрукты и ягоды#Персики, сливы, нектарины и абрикосы#Артфрут",109,1,4.6,130,https://cdn1.ozone.ru/s3/multimedia-1-a/7552180018.jpg,,Слива красная свежая,0.015217391304347825,0.436,,2025-06-13 10:45:07,250,0.7,0.3,11,46,
https://www.ozon.ru/product/tomaty-slivovidnye-zheltye-350-g-rost-358897979/,"Томаты сливовидные желтые 350 г, РОСТ","Ozon fresh#Овощи, фрукты, зелень#Овощи и зелень#Помидоры#РОСТ",202,1,4.9,5672,https://cdn1.ozone.ru/s3/multimedia-1-q/7084666346.jpg,Томаты сливовидные желтые на россыпь Сладкая ягода,,0.06666666666666667,0.5771428571428572,,2025-06-13 10:45:07,350,1,0.3,2.3,15,
https://www.ozon.ru/product/shpinat-50-g-azerbaydzhan-1630283207/,Шпинат 50 г Азербайджан,"Ozon fresh#Овощи, фрукты, зелень#Овощи и зелень#Зелень, пряные травы",47,1,4.8,270,https://cdn1.ozone.ru/s3/multimedia-1-c/7348456488.jpg,"Шпинат из Азербайджана - это высококачественный зеленый листовой овощ, известный своими питательными свойствами.",Шпинат,0.12608695652173912,0.94,,2025-06-13 10:45:07,50,2.9,0.4,3.6,23,
https://www.ozon.ru/product/salat-pak-choy-90-g-1569142136/,"Салат Пак-чой, 90 г","Ozon fresh#Овощи, фрукты, зелень#Овощи и зелень#Салат",113,1,4.8,289,https://cdn1.ozone.ru/s3/multimedia-1-e/7349615402.jpg,"Салат Пак-чой (Бок-чой) - ценится за свежесть вкуса сочных хрустящих листочков, с мягкими пикантными нотками и приятным послевкусием.
",,0,1.2555555555555555,,2025-06-13 10:45:07,90,,,,,
https://www.ozon.ru/product/salatnyy-miks-dizhon-150-g-belaya-dacha-1149627130/,"Салатный микс Дижон 150 г, Белая Дача","Ozon fresh#Овощи, фрукты, зелень#Овощи и зелень#Салат#Белая Дача",169,1,4.9,993,https://cdn1.ozone.ru/s3/multimedia-1-a/7542348886.jpg,,"салат айсберг, редис, морковь (в изменяемых соотношениях), антиокислитель (аскорбиновая кислота), стабилизатор (карбонат кальция)",0.05963302752293578,1.1266666666666667,,2025-06-13 10:45:07,150,1.30,0.20,3.60,21.80,
https://www.ozon.ru/product/perets-miks-600-g-svetofor-hrustyashchiy-421601284/,"Перец Микс 600 г, Светофор, хрустящий","Ozon fresh#Овощи, фрукты, зелень#Овощи и зелень#Перец",190,1,4.9,678,https://cdn1.ozone.ru/s3/multimedia-1-o/7349570412.jpg,,Перец Микс Светофор,0,0,,2025-06-13 10:45:08,,,,,,
https://www.ozon.ru/product/vinograd-red-glob-krupnyy-sladkiy-500-g-1062698033/,Виноград Ред Глоб крупный сладкий 500 г,"Ozon fresh#Овощи, фрукты, зелень#Фрукты и ягоды#Ягоды",277,1,4.8,394,https://cdn1.ozone.ru/s3/multimedia-1-r/7337089395.jpg,"Виноград Ред Глоб, с косточками, 500 г",,0.017391304347826087,0.554,,2025-06-13 10:45:08,500,0.8,0.5,8.3,46,
https://www.ozon.ru/product/mango-svezhee-1-sht-327033488/,Манго свежее 1 шт,"Ozon fresh#Овощи, фрукты, зелень#Фрукты и ягоды#Экзотические фрукты",179,1,4.3,491,https://cdn1.ozone.ru/s3/multimedia-1-3/7349559699.jpg,"Манго, 1 шт",,0,0.716,,2025-06-13 10:45:08,250,,,,,
https://www.ozon.ru/product/tomaty-rozovye-volzhskie-500-g-samara-1651628622/,"Томаты розовые Волжские 500 г, Самара","Ozon fresh#Овощи, фрукты, зелень#Овощи и зелень#Помидоры",199,1,4.8,1491,https://cdn1.ozone.ru/s3/multimedia-1-r/7348456539.jpg,,томат,0,0.398,,2025-06-13 10:45:08,500,,,,,
https://www.ozon.ru/product/malina-lesnaya-yagodka-krym-125-g-1600197262/,"Малина Лесная ягодка, Крым, 125 г","Ozon fresh#Овощи, фрукты, зелень#Фрукты и ягоды#Ягоды",401,1,4.9,270,https://cdn1.ozone.ru/s3/multimedia-1-z/7557651071.jpg,"Малина, помимо прекрасного десертного вкуса обладает благоприятным для человеческого организма сочетанием кислот, сахаров и других полезных веществ.",,0,3.208,,2025-06-13 10:45:08,125,,,,53,
https://www.ozon.ru/product/ogurtsy-solenye-1000-g-region-fresh-1773313880/,"Огурцы соленые 1000 г, Регион Фреш","Ozon fresh#Овощи, фрукты, зелень#Овощи и зелень#Соленья и квашенья#Регион Фреш",124,1,4.5,125,https://cdn1.ozone.ru/s3/multimedia-1-i/7291879098.jpg,Ощутите вкус традиционных соленых огурцов! Идеальный баланс хруста и ароматных специй.,"огурцы, вода очищенная, зелень, лавровый лист, чеснок, куркума,соль, регулятор кислотности уксусная кислота, консерванты: сорбат калия, бензоат натрия.",0.042105263157894736,0.124,,2025-06-13 10:45:09,1000,0.8,0.9,1.8,19,
https://www.ozon.ru/product/ogurtsy-pupyrchatye-lyuks-450-g-489181690/,"Огурцы пупырчатые Люкс, 450 г","Ozon fresh#Овощи, фрукты, зелень#Овощи и зелень#Огурцы",149,1,4.9,971,https://cdn1.ozone.ru/s3/multimedia-2/6084070118.jpg,"Огурцы пупырчатые, 450 г",Огурцы,0,0.33111111111111113,,2025-06-13 10:45:09,450,,,,,
https://www.ozon.ru/product/ogurtsy-solenye-300-g-region-fresh-1773313688/,"Огурцы соленые 300 г, Регион Фреш","Ozon fresh#Овощи, фрукты, зелень#Овощи и зелень#Соленья и квашенья#Регион Фреш",89,1,4.3,101,https://cdn1.ozone.ru/s3/multimedia-1-m/7275676474.jpg,Ощутите вкус традиционных соленых огурцов! Идеальный баланс хруста и ароматных специй.,,0.042105263157894736,0.2966666666666667,,2025-06-13 10:45:09,300,0.8,0.9,1.8,19,
https://www.ozon.ru/product/sliva-chernaya-printsessa-500-g-peru-1739769990/,"Слива Черная принцесса 500 г, Перу","Ozon fresh#Овощи, фрукты, зелень#Фрукты и ягоды#Персики, сливы, нектарины и абрикосы",223,1,4.7,364,https://cdn1.ozone.ru/s3/multimedia-1-0/7557604056.jpg,"Слива ароматная, свежая.",,0,0.446,,2025-06-13 10:45:09,500,,,,,
https://www.ozon.ru/product/miks-iz-mikrozeleni-sezonnyy-75-g-citygreengo-1850091664/,"Микс из микрозелени Сезонный 75 г, CityGreenGo","Ozon fresh#Овощи, фрукты, зелень#Овощи и зелень#Проростки, микрозелень#CityGreenGo",203,1,5.0,69,https://cdn1.ozone.ru/s3/multimedia-1-s/7310750956.jpg,"Микрозелень – отличный вариант для тех, кто придерживается здорового питания. Салатный микс полностью готов к столу, остается только помыть микс и добавить заправку по вкусу.Прекрасно сочетается с креветками. Добавьте маслины без косточки, каперсы и чесночный хлеб, или придумайте свой салат. Микс из молодой свежей зелени вернет бодрость и поднимет настроение, укрепит иммунитет и позаботится о внешности, в любое время года. Кроме того, блюда с таким компонентом выглядят красиво и свежо, их вкус становится еще более выразительным. В создании микса Сезонный принимают участие ведущие специалисты и нутрициологи. Для каждого сезона, соотношение компонентов в миксе подбирается таким образом, чтобы скомпенсировать недостающие витамины и минеральные вещества для организма.","микрозелень ростки  подсолнечника,  редиса, дайкона, брокколи, руколы",0.07352941176470588,2.7066666666666666,,2025-06-13 10:45:09,75,2,0.9,3.1,27.2,
https://www.ozon.ru/product/vinograd-red-glob-500-g-s-kostochkami-143170995/,"Виноград Ред Глоб 500 г, с косточками","Ozon fresh#Овощи, фрукты, зелень#Фрукты и ягоды#Ягоды",346,1,4.8,3964,https://cdn1.ozone.ru/s3/multimedia-1-t/7552180181.jpg,"Виноград Ред Глоб отличается привлекательным видом и превосходным вкусом. Именно яркая, многообразная вкусовая палитра делает этот виноград настолько востребованным. Сочные ягоды придутся по душе взрослым и детям, станут изысканным десертом, и помогут разнообразить меню. Помимо достойных кулинарных возможностей виноград обладает пользой для здоровья, поскольку содержит целую россыпь витаминов, микроэлементов и органических кислот, оказывающих укрепляющее воздействие на весь организм в   целом. Виноград подходит для употребления в самостоятельном виде и приготовления сока.    Уважаемые клиенты! Обратите, пожалуйста, внимание: изображение товара на сайте может отличаться от фактического вида товара. Фото представлено для визуального восприятия товара.",,0.017391304347826087,0.692,,2025-06-13 10:45:10,500,0.8,0.5,8.3,46,
https://www.ozon.ru/product/grusha-koroleva-sada-500-g-nezhnyy-sladkiy-vkus-1062699438/,"Груша Королева Сада 500 г, нежный сладкий вкус","Ozon fresh#Овощи, фрукты, зелень#Фрукты и ягоды#Яблоки, груши",175,1,4.0,3,https://cdn1.ozone.ru/s3/multimedia-1-o/7557609984.jpg,"Груша «Королева Сада» - отличается приятным десертным вкусом с легкой кислинкой. При полном созревании плод приобретает зеленовато-лимонный оттенок с розовым румянцем на боку. 

Допустимы незначительные протертости кожицы плода.
Калибр груши зависит от времени года, есть как крупные плоды, так и мелкие.",Груша сорт Санта Мария,0.006666666666666666,0.35,,2025-06-13 10:45:10,500,0.3,0.1,10.73,45,
https://www.ozon.ru/product/perets-ramiro-400-g-turtsiya-1062698834/,"Перец Рамиро 400 г, Турция","Ozon fresh#Овощи, фрукты, зелень#Овощи и зелень#Перец",295,1,4.9,948,https://cdn1.ozone.ru/s3/multimedia-1-h/7557650621.jpg,"Перец Рамиро - хрустящие, сладкие перцы. Хорошо подходят в качестве быстрой закуски, используются для гриля и в бутербродах.",,0.0475,0.7375,,2025-06-13 10:45:10,400,1.9,0.4,9,40,
https://www.ozon.ru/product/morkov-po-koreyski-1000-g-346822649/,Морковь по-корейски 1000 г,"Ozon fresh#Овощи, фрукты, зелень#Овощи и зелень#Соленья и квашенья",236,1,4.7,965,https://cdn1.ozone.ru/s3/multimedia-1-q/7349613434.jpg,"Морковь по-корейски, 1000 г",,0.015068493150684932,0.236,,2025-06-13 10:45:10,1000,1.1,9.9,6,73,
https://www.ozon.ru/product/fizalis-poleznaya-yagodka-100-g-327033462/,"Физалис, полезная ягодка, 100 г","Ozon fresh#Овощи, фрукты, зелень#Фрукты и ягоды#Ягоды",229,1,4.9,216,https://cdn1.ozone.ru/s3/multimedia-h/6126789461.jpg,"Физалис, 100 г",,0,2.29,,2025-06-13 10:45:10,100,,,,32,
