url,name,category,price,availability,average_rating,rating_count,imgUrl,description,content,pro/cal,pri/we,html_path,last_upd_time,weight,proteins,fats,carbohydrates,calories,fetchErr
https://www.ozon.ru/product/apelsiny-1-kg-362354985/,"Апельсины, 1 кг","Ozon fresh#Овощи, фрукты, зелень#Фрукты и ягоды#Цитрусовые",140,1,4.7,3408,https://cdn1.ozone.ru/s3/multimedia-1-m/7414546198.jpg,"Самый любимый и популярный цитрус в мире! Ценится за огромное количество витаминов, невероятную сочность, сладость вкуса и аромат, приносящий радость и положительное настроение. 

Не стоит забывать, что апельсины – это настоящие спасители от простуды. Употребление апельсинов и прочих цитрусовых помогает повысить уровень витамина C в организме и укрепить его защитные функции. 

Из апельсинов можно приготовить очень вкусный и полезный морс, который буквально насытит организм витаминами. Делимся нашим сочным рецептом: 
•  Очистите от листиков и веточек 300 г облепихи и измельчите блендером в пюре. Добавьте по вкусу пряности - имбирь, корицу, гвоздику. 
•  Залейте водой в 3 литра и доведите до кипения. Затем дайте постоять под крышкой 20 минут. Теплый напиток процедите и добавьте по вкусу сахар.
•  Выжмите сок из 3 апельсинов и влейте его в полученный витаминный морс. Тщательно перемешайте напиток. 
Готово! 
",Апельсин,0.020930232558139535,0.14,,2025-06-13 10:44:08,1000,0.9,0.2,8.1,43,
https://www.ozon.ru/product/limony-otbornye-2-sht-163600543/,Лимоны отборные  2 шт,"Ozon fresh#Овощи, фрукты, зелень#Фрукты и ягоды#Цитрусовые",109,1,4.9,42534,https://cdn1.ozone.ru/s3/multimedia-1-n/7542327803.jpg,"Ароматный цитрус с ярко выраженным кислым вкусом. Обладают антисептическими, противомикробными, потогонными и очищающими свойствами. Укрепляют здоровье дыхательных путей, сердца и сосудов, желудочно-кишечного тракта и почек.",Лимон,0.026470588235294117,0.545,,2025-06-13 10:44:08,200,0.90,0.10,3,34,
https://www.ozon.ru/product/ogurtsy-kornishony-300-g-166793425/,Огурцы корнишоны 300 г,"Ozon fresh#Овощи, фрукты, зелень#Овощи и зелень#Огурцы",112,1,4.9,11535,https://cdn1.ozone.ru/s3/multimedia-1-y/7348456366.jpg,Огурцы корнишоны - это мелкоплодный сорт с тонкой колючей кожурой и сочной хрустящей мякотью.,,0,0.37333333333333335,,2025-06-13 10:44:08,300,,,,15,
https://www.ozon.ru/product/svekla-otvarnaya-500-g-168152610/,"Свекла отварная, 500 г","Ozon fresh#Овощи, фрукты, зелень#Овощи и зелень#Вареные, чищеные, резаные#ФЭГ",119,1,4.7,7420,https://cdn1.ozone.ru/s3/multimedia-1-l/7544680905.jpg,"Свекла полностью готова к употреблению, без ГМО, консервантов и соли.",Свекла.,0.036734693877551024,0.238,,2025-06-13 10:44:08,500,1.8,0.1,10,49,
https://www.ozon.ru/product/kinza-50-g-160571991/,Кинза 50 г,"Ozon fresh#Овощи, фрукты, зелень#Овощи и зелень#Зелень, пряные травы",79,1,4.8,13158,https://cdn1.ozone.ru/s3/multimedia-1-7/7348456699.jpg,"Зелень кинзы бесподобно подходит к мясу, луку и овощам – ко всему, что можно приготовить из свежих продуктов в летний или зимний день. Кстати, и сама кинза должна быть свежей – засушенной она почти не употребляется.",,0,1.58,,2025-06-13 10:44:09,50,2.36,0.59,2.59,0,
https://www.ozon.ru/product/baklazhany-600-g-307996133/,"Баклажаны, 600 г","Ozon fresh#Овощи, фрукты, зелень#Овощи и зелень#Кабачки, баклажаны",136,1,4.9,8175,https://cdn1.ozone.ru/s3/multimedia-1-p/7348456465.jpg,"Баклажаны — это не только вкусный, но и очень полезный продукт. В них содержится большое количество витаминов. Кроме того, баклажаны богаты клетчаткой, которая помогает нормализовать работу кишечника. Благодаря низкому содержанию углеводов этот овощ отлично подходит для диетического питания",,0.049999999999999996,0.22666666666666666,,2025-06-13 10:44:09,600,1.2,0.1,4.5,24,
https://www.ozon.ru/product/kapusta-kvashenaya-po-derevenski-900-g-feg-142555887/,"Капуста квашеная по-деревенски 900 г, ФЭГ","Ozon fresh#Овощи, фрукты, зелень#Овощи и зелень#Соленья и квашенья#ФЭГ",158,1,4.8,7559,https://cdn1.ozone.ru/s3/multimedia-1-h/7348456817.jpg,"Квашеная капуста сохраняет в своем составе почти все количество витамина В9, которое было в сыром овоще. А вот витамин С и Р, наоборот, увеличиваются после квашения в разы. Весь секрет в том, что квасят капусту без использования термической обработки, а витамины и пробиотики образуются за счет естественного брожения капусты.",,0.056666666666666664,0.17555555555555555,,2025-06-13 10:44:09,900,1.7,0.1,5,30,
https://www.ozon.ru/product/yabloki-royal-gala-500-g-160572085/,Яблоки Роял Гала 500 г,"Ozon fresh#Овощи, фрукты, зелень#Фрукты и ягоды#Яблоки, груши",118,1,4.8,12373,https://cdn1.ozone.ru/s3/multimedia-1-d/7348456489.jpg,"Яблоки сорта Гала – умеренно сладкие, с приятным ароматом и тонкой кожурой. Сочные и хрустящие красные плоды правильной круглой формы с золотистыми полосочками.

Допустимы незначительные зарубцевавшиеся механические повреждения, протертости кожицы плода.
Калибр яблок зависит от времени года, есть как крупные плоды, так и более мелкие. Допустим как мелкий, так и крупный калибр",,0.008695652173913044,0.236,,2025-06-13 10:44:09,500,0.4,0.4,11.2,46,
https://www.ozon.ru/product/shchavel-50-g-160572081/,Щавель 50 г,"Ozon fresh#Овощи, фрукты, зелень#Овощи и зелень#Зелень, пряные травы",59,1,4.8,3919,https://cdn1.ozone.ru/s3/multimedia-c/6068344428.jpg,"Польза щавеля заключается в наличии большого количества витаминов и минералов. Он является прекрасным источником аскорбиновой кислоты, которая необходима для увеличения защитных функций организма, а также она способствует целостности кровеносных сосудов, улучшает мозговую деятельность и работу всего организма.",Щавель,0.06818181818181818,1.18,,2025-06-13 10:44:10,50,1.5,0.3,2.9,22,
https://www.ozon.ru/product/svekla-200-g-belaya-dacha-sladkaya-496423021/,"Свёкла 200 г, Белая Дача, сладкая","Ozon fresh#Овощи, фрукты, зелень#Овощи и зелень#Вареные, чищеные, резаные#Белая Дача",109,1,4.9,5194,https://cdn1.ozone.ru/s3/multimedia-1-1/7542351073.jpg,"Сладкая свекла от производителя «Белая Дача» создана для всей семьи! 
Продукт полностью готов к подаче на стол: 

не надо мыть
не надо чистить
не надо резать

Белая Дача – это вкус здоровой жизни! 
Спасибо, что вместе с нами поддерживаете культуру здорового питания. ",,0.03571428571428571,0.545,,2025-06-13 10:44:10,200,1.5,0.1,8.8,42,
https://www.ozon.ru/product/kapusta-200-g-s-morkovyu-belaya-dacha-494765225/,"Капуста 200 г, с морковью Белая Дача","Ozon fresh#Овощи, фрукты, зелень#Овощи и зелень#Вареные, чищеные, резаные#Белая Дача",109,1,4.9,7167,https://cdn1.ozone.ru/s3/multimedia-1-t/7542353225.jpg,"Свежая капуста с морковью - это микс свежей белокочанной капусты и тертой моркови от производителя «Белая Дача».
Продукт полностью готов к подаче на стол:

не надо мыть
не надо чистить
не надо резать

Белая Дача – это вкус здоровой жизни! Спасибо, что вместе с нами поддерживаете культуру здорового питания.","Капуста белокочанная, морковь",0.05955249569707401,0.545,,2025-06-13 10:44:10,200,1.73,0.2,5.03,29.05,
https://www.ozon.ru/product/grusha-lesnaya-krasavitsa-500-g-241611101/,Груша Лесная красавица 500 г,"Ozon fresh#Овощи, фрукты, зелень#Фрукты и ягоды#Яблоки, груши",219,1,4.7,3937,https://cdn1.ozone.ru/s3/multimedia-1-2/7595751062.jpg,"Груша Лесная красавица - сочная, крепкая, обладает нежной мякотью с благородным ароматом. При полном созревании плод приобретает зеленовато-желтый оттенок с ярким румянцем на боку. 

Допустимы незначительные протертости кожицы плода.
Калибр груши зависит от времени года, есть как крупные плоды, так и мелкие.",Груша,0,0.438,,2025-06-13 10:44:10,500,,,,,
https://www.ozon.ru/product/svekla-rossiya-600-g-1595033498/,"Свекла, Россия, 600 г","Ozon fresh#Овощи, фрукты, зелень#Овощи и зелень#Корнеплоды",85,1,4.9,22990,https://cdn1.ozone.ru/s3/multimedia-1-m/7544682814.jpg,,Свекла,0.037209302325581395,0.14166666666666666,,2025-06-13 10:44:10,600,1.60,0.20,9.60,43,
https://www.ozon.ru/product/kvashenaya-kapusta-klassicheskaya-450-g-belaya-dacha-1663011024/,"Квашеная капуста классическая 450 г, Белая Дача","Ozon fresh#Овощи, фрукты, зелень#Овощи и зелень#Соленья и квашенья#Белая Дача",149,1,4.8,2710,https://cdn1.ozone.ru/s3/multimedia-1-9/7542347553.jpg,"Квашеная капуста от бренда ""Белая дача"" приготовлена из собственно выращенной, натуральной капусты по традиционному рецепту, без сахара, что придает ей особый вкус, делая ее еще более хрустящей.

Квашеная капуста - это не только быстрая и вкусная закуска ко столу, но и продукт, который содержит много витаминов, сохранение которых достигается благодаря процессу ферментации, без использования искусственных консервантов, уксуса и сахара.

Квашеная капуста отлично подойдет к постному столу.",,0.08292682926829269,0.3725,,2025-06-13 10:44:11,400,1.70,0.10,3.20,20.50,
https://www.ozon.ru/product/myata-svezhaya-50-g-1587747009/,"Мята свежая, 50 г","Ozon fresh#Овощи, фрукты, зелень#Овощи и зелень#Зелень, пряные травы",109,1,4.9,1717,https://cdn1.ozone.ru/s3/multimedia-r/6108214695.jpg,"Мятный аромат активизирует работу мозга, избавляет от бессоницы и расслабляет после тяжелого дня.",,0,0,,2025-06-13 10:44:11,,,,,,
https://www.ozon.ru/product/apelsiny-sochnye-900-g-389210769/,"Апельсины, сочные 900 г","Ozon fresh#Овощи, фрукты, зелень#Фрукты и ягоды#Цитрусовые",259,1,4.8,16970,https://cdn1.ozone.ru/s3/multimedia-1-y/7348456258.jpg,"Предлагаем вашему вниманию свежие апельсины. Они обладают ярким вкусом и сочным ароматом. Апельсин богат витаминами и микроэлементами, полезен для здоровья. Плоды прекрасно подойдут для приготовления фрешей, десертов и салатов. ",,0.019801980198019802,0.2877777777777778,,2025-06-13 10:44:11,900,0.6,0.1,7.5,30.3,
https://www.ozon.ru/product/petrushka-75-g-165273747/,Петрушка 75 г,"Ozon fresh#Овощи, фрукты, зелень#Овощи и зелень#Зелень, пряные травы",67,1,4.9,15214,https://cdn1.ozone.ru/s3/multimedia-1-q/7348456394.jpg,"Растение необходимо для остроты зрения, восстановления мышечной ткани и нормализации деятельности нервой системы.",Петрушка,0.07551020408163266,0.8933333333333333,,2025-06-13 10:44:11,75,3.7,0.4,7.6,49,
https://www.ozon.ru/product/selderey-steblevoy-1-sht-143170402/,"Сельдерей стеблевой, 1 шт","Ozon fresh#Овощи, фрукты, зелень#Овощи и зелень#Зелень, пряные травы",93,1,4.8,12644,https://cdn1.ozone.ru/s3/multimedia-1-o/7573601616.jpg,"Сельдерей содержит большое количество эфирных масел, фолиевую и   аскорбиновую кислоты, витамины А и Е, кальций, калий и натрий. Мощные   антиоксидантные свойства способствуют замедлению процессов старения.   Употребляют в пищу в сыром виде, используют для салатов и закусок или   добавляют в супы, овощные и мясные рагу.   ",,0.075,0.465,,2025-06-13 10:44:11,200,0.9,0.1,2.1,12,
https://www.ozon.ru/product/pekinskaya-kapusta-1-sht-166793963/,Пекинская капуста 1 шт,"Ozon fresh#Овощи, фрукты, зелень#Овощи и зелень#Капуста",159,1,4.7,11046,https://cdn1.ozone.ru/s3/multimedia-1-u/7348456254.jpg,"Вкусные и нежные листочки пекинской капусты напоминают по вкусу салат и капусту - мякоть сочная, без твердых жилок. Листья отлично подходит для салатов или овощных супов, тушеных или жаренных блюд, где требуется зелень. ",,0.09375,0.318,,2025-06-13 10:44:12,500,1.5,0.2,2,16,
https://www.ozon.ru/product/chereshnya-rozovaya-250-g-273571266/,"Черешня розовая, 250 г","Ozon fresh#Овощи, фрукты, зелень#Фрукты и ягоды#Ягоды",341,1,4.6,475,https://cdn1.ozone.ru/s3/multimedia-b/6684780203.jpg,"Черешня розовая, 250 г",,0,1.364,,2025-06-13 10:44:12,250,,,,,
https://www.ozon.ru/product/kartofel-krasnyy-1-5-kg-azerbaydzhan-240077043/,"Картофель красный 1,5 кг, Азербайджан","Ozon fresh#Овощи, фрукты, зелень#Овощи и зелень#Картофель",197,1,4.7,11413,https://cdn1.ozone.ru/s3/multimedia-1-1/7558406101.jpg,"Картофель красный, Азербайджан, 1,5 кг",,0.024637681159420288,0.13133333333333333,,2025-06-13 10:44:12,1500,1.7,0.1,13.3,69,
https://www.ozon.ru/product/yabloki-zelenye-500-g-kislo-sladkie-292581298/,"Яблоки зеленые 500 г, кисло-сладкие","Ozon fresh#Овощи, фрукты, зелень#Фрукты и ягоды#Яблоки, груши",118,1,4.9,6768,https://cdn1.ozone.ru/s3/multimedia-1-7/7348457023.jpg,"Допустим как мелкий, так и крупный калибр",,0.005769230769230769,0.236,,2025-06-13 10:44:12,500,0.3,0.2,14,52,
https://www.ozon.ru/product/griby-shampinony-500-g-170158049/,Грибы Шампиньоны 500 г,"Ozon fresh#Овощи, фрукты, зелень#Овощи и зелень#Грибы",224,1,5.0,21018,https://cdn1.ozone.ru/s3/multimedia-1-i/7202914494.jpg,"Шампиньон – самый распространённый гриб в мире. Он используется в кухнях многих народов и в авторских блюдах знаменитых кулинаров разных стран. Шампиньоны прекрасно сочетаются с мясом, овощами и выпечкой. Шампиньоны можно использовать в самых разнообразных блюдах. Этим грибам подходят все способы обработки: их можно варить, тушить, жарить, мариновать, сушить.Страна-изготовитель: Россия.",,0.09964285714285714,0.448,,2025-06-13 10:44:13,500,2.79,0.24,3,28,
https://www.ozon.ru/product/petrushka-75-g-1587747174/,"Петрушка, 75 г","Ozon fresh#Овощи, фрукты, зелень#Овощи и зелень#Зелень, пряные травы",67,1,4.9,4461,https://cdn1.ozone.ru/s3/multimedia-3/6108216327.jpg,"Растение необходимо для остроты зрения, восстановления мышечной ткани и нормализации деятельности нервой системы.",Петрушка,0,0,,2025-06-13 10:44:13,,,,,,
https://www.ozon.ru/product/tomaty-cherri-sladkie-250-g-197559285/,"Томаты черри, сладкие 250 г","Ozon fresh#Овощи, фрукты, зелень#Овощи и зелень#Помидоры",139,1,4.8,10427,https://cdn1.ozone.ru/s3/multimedia-1-y/7348456690.jpg,"Концентрация полезных веществ и витаминов в маленьких помидорах гораздо выше, чем у их крупных собратьев. Больше всего малыши содержат витамина С.Уважаемые клиенты! Обратите, пожалуйста, внимание: изображение товара на сайте может отличаться от фактического вида товара. Фото представлено для визуального восприятия товара.",Помидоры,0,0.556,,2025-06-13 10:44:13,250,,,,20,
https://www.ozon.ru/product/yabloki-medovyy-hrust-400-g-sochnaya-myakot-azerbaydzhan-292581304/,"Яблоки ""Медовый хруст"" 400 г, сочная мякоть, Азербайджан","Ozon fresh#Овощи, фрукты, зелень#Фрукты и ягоды#Яблоки, груши",151,1,4.8,10365,https://cdn1.ozone.ru/s3/multimedia-1-m/7573601614.jpg,"Яблоки Медовый хруст, 
Допустим как мелкий, так и крупный калибр",,0.00851063829787234,0.3775,,2025-06-13 10:44:13,400,0.4,0.4,9.8,47,
https://www.ozon.ru/product/tsvetnaya-kapusta-i-brokkoli-300-g-miks-448155531/,"Цветная капуста и брокколи 300 г, микс","Ozon fresh#Овощи, фрукты, зелень#Овощи и зелень#Капуста",149,1,4.9,2022,https://cdn1.ozone.ru/s3/multimedia-1-n/7348456499.jpg,,"Цветная капуста, капуста брокколи",0,0.49666666666666665,,2025-06-13 10:44:13,300,,,,,
https://www.ozon.ru/product/ogurtsy-solenye-1-kg-feg-142555890/,"Огурцы соленые 1 кг, ФЭГ","Ozon fresh#Овощи, фрукты, зелень#Овощи и зелень#Соленья и квашенья#ФЭГ",155,1,4.7,7749,https://cdn1.ozone.ru/s3/multimedia-1-e/7348456490.jpg,"Блюдо, которое готовят из огурцов посредством соления с добавлением разнообразных специй. Солёные огурцы — одно из традиционных блюд славянской, а также немецкой кухонь (Salzgurken). Они помогают выводить из организма вредные вещества и шлаки, также  помогают избавиться от ""плохого"" холестерина и способствуют быстрому  усвоению белков. Вес основного продукта: 500 г. ",,0.1,0.155,,2025-06-13 10:44:13,1000,1,0,1.6,10,
https://www.ozon.ru/product/nektarin-sochnyy-uzbekistan-500-g-1636136702/,"Нектарин сочный, Узбекистан, 500 г","Ozon fresh#Овощи, фрукты, зелень#Фрукты и ягоды#Персики, сливы, нектарины и абрикосы",199,1,4.6,783,https://cdn1.ozone.ru/s3/multimedia-p/6342077101.jpg,,Нектарин,0,0.398,,2025-06-13 10:44:14,500,,,,,
https://www.ozon.ru/product/avokado-hass-2-sht-artfrut-144650933/,"Авокадо Хасс 2 шт, Артфрут","Ozon fresh#Овощи, фрукты, зелень#Фрукты и ягоды#Экзотические фрукты#Артфрут",199,1,4.8,11131,https://cdn1.ozone.ru/s3/multimedia-1-m/7542330682.jpg,"Авокадо Artfruit славится тонкими ореховыми нотками, которые пикантно приправляют его сливочный вкус.
В меру мягкий, идеальный по текстуре. Лёгок в нарезке и пюрировании.",,0.0125,0,,2025-06-13 10:44:14,,2,14.7,1.8,160,
https://www.ozon.ru/product/kukuruza-svezhaya-2-sht-1629457346/,"Кукуруза свежая, 2 шт","Ozon fresh#Овощи, фрукты, зелень#Овощи и зелень#Сельдерей, спаржа, кукуруза",161,1,4.6,681,https://cdn1.ozone.ru/s3/multimedia-1-p/7538727409.jpg,,Кукуруза свежая,0,0.644,,2025-06-13 10:44:14,250,,,,,
https://www.ozon.ru/product/tomaty-rozovye-500-g-azerbaydzhan-238193468/,"Томаты розовые 500 г, Азербайджан","Ozon fresh#Овощи, фрукты, зелень#Овощи и зелень#Помидоры",140,1,4.8,11135,https://cdn1.ozone.ru/s3/multimedia-1-w/7348456400.jpg,"Томаты Азербайджан, 600 г",помидоры,0.016172506738544472,0.28,,2025-06-13 10:44:14,500,0.6,0.2,4.2,37.1,
https://www.ozon.ru/product/ogurtsy-kurazh-svezhie-i-hrustyashchie-400-g-rossiya-1062698652/,"Огурцы ""Кураж"", свежие и хрустящие 400 г, Россия","Ozon fresh#Овощи, фрукты, зелень#Овощи и зелень#Огурцы",117,1,4.9,2469,https://cdn1.ozone.ru/s3/multimedia-1-m/7557595654.jpg,"Огурцы ""Кураж"" - это свежие и хрустящие огурчики, которые идеально подходят для приготовления салатов, бутербродов и других блюд.",Огурцы,0.07142857142857142,0.2925,,2025-06-13 10:44:15,400,1,3,0,14,
https://www.ozon.ru/product/repchatyy-luk-1-kg-327102656/,Репчатый лук 1 кг,"Ozon fresh#Овощи, фрукты, зелень#Овощи и зелень#Лук, чеснок",79,1,4.9,25272,https://cdn1.ozone.ru/s3/multimedia-t/6728552837.jpg,"Лук репчатый, 1 кг",,0,0.079,,2025-06-13 10:44:15,1000,,,,,
