url,name,pri/we,pro/cal,weight,price,calories,proteins,fats,carbohydrates,content,description,availability,last_upd_time,category,average_rating,rating_count,imgUrl,html_path
https://vkusvill.ru/goods/krupa-perlovaya-paketiki-74034.html,Крупа перловая (пакетики),0.17,0.03015873015873016,400.0,68.0,315.0,9.5,1.0,67.0,"Крупа перловая.Товар от производителейАктуальные данные указаны на этикетке. Цена может отличаться в зависимости от региона или формата точки продажи (вендинг, микромаркет).Информация на этикетке может незначительно отличаться","Шесть порций перловой крупы в удобных пакетиках. Готовится за 40 минут и отлично подходит на роль гарнира, для сытных салатов, полезных боулов и даже для фаршировки перцев!",0,2025-06-13 11:20:30,"Крупы, макароны, мука#Крупы",4.9,708,https://img.vkusvill.ru/pim/images/site_LargeWebP/b44caf63-9317-4220-8229-57d8a060b057.webp?1704579195.9359,krupa-perlovaya-paketiki-74034.html
https://vkusvill.ru/goods/otrubi-sibirskie-sila-trav-ochishchayushchie-18778.html,Отруби сибирские «Сила трав очищающие»,0.65,0.03007307476110174,100.0,65.0,355.8,10.7,1.0,73.0,"отруби пшеничные пищевые, мука ржаная обдирная, травяной сбор сушеный (ромашка цветы, календула цветы, володушка трава, тысячелистник трава, таволга трава, клевер трава, мята трава, курильский чай побеги, крушина кора, тыква плоды, шиповник плоды, укроп пахучий плоды)Товар от производителейАктуальные данные указаны на этикетке. Цена может отличаться в зависимости от региона или формата точки продажи (вендинг, микромаркет).Информация на этикетке может незначительно отличаться","Отруби — тот самый продукт, о пользе которого спорить не приходится. Будучи одним из лучших источников клетчатки, они отлично насыщают и помогают работе ЖКТ. Хрустящие, с лёгким ароматом трав и без добавленного сахара и соли, отруби идеально дополнят здоровый рацион. Их можно добавить в йогурт, кефир, салат и основные блюда или взять с собой в качестве снека. Рекомендации по употреблению: по 30-50 г в день.",0,2025-06-13 11:20:28,"Крупы, макароны, мука#Сухие завтраки, хлопья и мюсли",4.9,5194,https://img.vkusvill.ru/pim/images/site_LargeWebP/ed64f595-1e59-4023-ab4f-d2aa9e8aac50.webp?1708070106.6653,otrubi-sibirskie-sila-trav-ochishchayushchie-18778.html
https://vkusvill.ru/goods/bulgur-tselnozernovoy-66488.html,Булгур цельнозерновой,0.33714285714285713,0.030054644808743168,350.0,118.0,366.0,11.0,4.0,59.0,"булгур цельнозерновой Продукция производится на предприятии, где используются аллергены: арахис, горчица, кунжут, молоко (лактоза), орехи, сельдерей, соя, яйца.Товар от производителейАктуальные данные указаны на этикетке. Цена может отличаться в зависимости от региона или формата точки продажи (вендинг, микромаркет).Информация на этикетке может незначительно отличаться","Сытная и полезная крупа из термически обработанной пшеницы. Из такого цельнозернового булгура получаются универсальные гарниры и рассыпчатые каши. Булгур замечательно сочетается с овощами, мясом и молочными продуктами. Готовить его быстро и очень просто!",0,2025-06-13 11:20:15,"Особое питание#Можно при диабете#Мука, крупы, макароны",4.9,3058,https://img.vkusvill.ru/pim/images/site_LargeWebP/da1009d9-2b09-4eb3-ae51-576621a03265.webp?1707731540.8465,bulgur-tselnozernovoy-66488.html
https://vkusvill.ru/goods/makaronnye-izdeliya-perya-gruppa-b-400-gr-66491.html,"Макаронные изделия «Перья» группа B, 400 гр",0.105,0.03003003003003003,400.0,42.0,333.0,10.0,1.0,71.0,"мука пшеничная хлебопекарная высшего сорта, вода питьевая Продукция производится на предприятии, где используются аллергены: яйца.Товар от производителейАктуальные данные указаны на этикетке. Цена может отличаться в зависимости от региона или формата точки продажи (вендинг, микромаркет).Информация на этикетке может незначительно отличаться","Макароны оригинальной формы «Перья» заботливо изготовлены из пшеничной муки группы В. Готовятся просто и быстро. Идеально сочетаются с овощами и мясом, и хорошо держат даже сложные соусы.",0,2025-06-13 11:20:22,"Крупы, макароны, мука#Макароны",4.9,1718,https://img.vkusvill.ru/pim/images/site_LargeWebP/84f93162-a524-4b92-aec2-3204fd25aca0.webp?1715602537.7827,makaronnye-izdeliya-perya-gruppa-b-400-gr-66491.html
https://vkusvill.ru/goods/krupa-iz-sorgo-bez-glyutena-91724.html,Крупа из сорго без глютена,0.254,0.02977467811158798,500.0,127.0,372.8,11.1,2.8,75.8,крупа из сорго,"Крупа сорго — безглютеновая крупа с высоким содержанием клетчатки и протеина, которая отлично подходит для диетического питания. У сорго мягкий, почти нейтральный вкус, напоминающий одновременно рис и пшено. Её можно отварить как обычную кашу для полезного завтрака, подать на гарнир или добавить в суп или в салат.",0,2025-06-13 11:20:23,"Крупы, макароны, мука#Крупы",4.9,1412,https://img.vkusvill.ru/pim/images/site_LargeWebP/e31636e5-8ba9-4101-b7fc-4ccc46d1d751.webp?1731107974.6302,krupa-iz-sorgo-bez-glyutena-91724.html
https://vkusvill.ru/goods/khlopya-nordic-pshennye-500-g-43013.html,"Хлопья Nordic пшенные, 500 г",0.35,0.02972972972972973,500.0,175.0,370.0,11.0,2.5,75.0,"Пшенные хлопья.Товар от производителейАктуальные данные указаны на этикетке. Цена может отличаться в зависимости от региона или формата точки продажи (вендинг, микромаркет).Информация на этикетке может незначительно отличаться","Пшенные хлопья, которые варятся за три минуты. Подойдут для приготовления каш и гарниров. Один из классических рецептов — пшённая каша с тыквой, которая наверняка понравится даже тем, кто не очень любит эту крупу.",0,2025-06-13 11:20:27,"Крупы, макароны, мука#Каши",5,2161,https://img.vkusvill.ru/pim/images/site_LargeWebP/ab965a3f-7a00-473d-b434-5c8c558ea49e.webp?1708072376.2015,khlopya-nordic-pshennye-500-g-43013.html
https://vkusvill.ru/goods/makarony-vermishel-782.html,Макароны «Вермишель»,0.17333333333333334,0.02967359050445104,450.0,78.0,337.0,10.0,1.0,70.0,"мука из твердой пшеницы (дурум), водаТовар от производителейДанный товар поставляют несколько производителей, внешний вид и характеристики могут незначительно отличаться. Актуальные данные указаны на этикетке. Цена может отличаться в зависимости от региона или формата точки продажи (вендинг, микромаркет).Информация на этикетке может незначительно отличаться","Тонкие макароны из твёрдых сортов пшеницы, которые не слипаются и не теряют форму при варке. Лучше всего они подходят для приготовления наваристых супчиков, но их также можно подавать на гарнир. Время варки 8 минут.",0,2025-06-13 11:20:26,"Крупы, макароны, мука#Макароны",4.8,7383,https://img.vkusvill.ru/pim/images/site_LargeWebP/dde18d08-843b-4c35-8ff4-cb79d6734282.webp?1708067241.7774,makarony-vermishel-782.html
https://vkusvill.ru/goods/muka-ovsyanaya-28614.html,Мука овсяная,0.236,0.029658792650918638,500.0,118.0,381.0,11.3,5.4,71.8,"мука овсяная. Продукция производится на предприятии, где используется соя и продукты её переработки.Товар от производителейАктуальные данные указаны на этикетке. Цена может отличаться в зависимости от региона или формата точки продажи (вендинг, микромаркет).Информация на этикетке может незначительно отличаться","Полезная и ароматная мука из молотых зёрен овса. Из неё получаются превосходные блины и пышные оладьи, маффины с клюквой и орехами, сырники и душистый домашний хлеб с румяной корочкой.",0,2025-06-13 11:20:19,"Крупы, макароны, мука#Мука и ингредиенты для выпечки",4.9,2300,https://img.vkusvill.ru/pim/images/site_LargeWebP/f2b99bc5-c387-4a13-9ea3-f3ae003134d2.webp?1710154294.1567,muka-ovsyanaya-28614.html
https://vkusvill.ru/goods/lapsha-yaichnaya-lagmannaya-74795.html,Лапша яичная «Лагманная»,0.3,0.02916998143728454,250.0,75.0,377.1,11.0,1.5,78.7,"Мука из твердой пшеницы для макаронных изделий высшего сорта, вода питьевая, меланж яичный сухой.Товар от производителейАктуальные данные указаны на этикетке. Цена может отличаться в зависимости от региона или формата точки продажи (вендинг, микромаркет).Информация на этикетке может незначительно отличаться","Традиционная лапша для приготовления восточных блюд. Она быстро варится, и потому замечательно подходит для готовки на скорую руку. Эта лапша подойдёт как для лагмана, так и для добавления в суп, подачи на гарнир и в качестве самостоятельного блюда.",0,2025-06-13 11:20:24,"Крупы, макароны, мука#Макароны",4.8,840,https://img.vkusvill.ru/pim/images/site_LargeWebP/0a14bd1b-5e1b-48ec-abde-25e872a28ff3.webp?1730276296.8255,lapsha-yaichnaya-lagmannaya-74795.html
https://vkusvill.ru/goods/khlopya-iz-golozernogo-ovsa-bez-glyutena-solenaya-karamel-98118.html,Хлопья из голозерного овса без глютена «Соленая карамель»,2.6666666666666665,0.029156010230179028,45.0,120.0,391.0,11.4,7.0,70.6,"овсяные хлопья 86%, солёная карамель 14% (сахар, глюкозный сироп, масло сливочное, сливки молочные, соль (3%), бикарбонат натрия, эмульгатор (подсолнечный лецитин)).","Идеальный микс для вкусного, полезного и к тому же быстрого завтрака. В основе — безглютеновые овсяные хлопья, не требующие варки, и солёная карамель, приготовленная из сливочного масла и сливок. «Готовка» займёт всего пару минут: просто добавьте в баночку кипяток, накройте её крышкой и подождите, пока хлопья увеличатся в размере. Каша получится нежной, умеренно сладкой, с контрастными карамельно-солоноватыми оттенками — от такой не откажутся даже маленькие гурманы!",0,2025-06-13 11:20:31,"Крупы, макароны, мука#Сухие завтраки, хлопья и мюсли",4.7,20,https://img.vkusvill.ru/pim/images/site_LargeWebP/5243ba52-a0c3-452c-999a-23a791f6db6b.webp?1725396740.3286,khlopya-iz-golozernogo-ovsa-bez-glyutena-solenaya-karamel-98118.html
https://vkusvill.ru/goods/sukhari-dlya-panirovki-pshenichnye-s-otrubyami-38004.html,Сухари для панировки пшеничные с отрубями,0.38,0.029134532990574117,150.0,57.0,350.1,10.2,2.1,72.6,"мука пшеничная хлебопекарная первого сорта , отруби пшеничные, соль пищевая.Товар от производителейАктуальные данные указаны на этикетке. Цена может отличаться в зависимости от региона или формата точки продажи (вендинг, микромаркет).Информация на этикетке может незначительно отличаться","Золотистая панировка с пряностями сделает блюдо ещё аппетитнее, ведь кто не любит хрустящую корочку! А чтобы еда получилась не только вксуной, но и полезной, мы смешали панировочные сухарики с отрубями — источником клетчатки. Панировка отлично дополнит любой продукт:  мясо, рыбу, овощи и даже сыр, например, халумис и моцареллу. Кроме того, её можно добавить в котлетный фарш вместо хлеба.",0,2025-06-13 11:20:25,"Масла, соусы, специи, сахар и соль#Специи",4.9,5591,https://img.vkusvill.ru/pim/images/site/site_LargeWebP/f73aaa47-f3cb-41fc-a989-086cf5ae0fa7.webp,sukhari-dlya-panirovki-pshenichnye-s-otrubyami-38004.html
https://vkusvill.ru/goods/khlopya-4-vida-zlakovykh-400-g-64318.html,"Хлопья 4 вида злаковых, 400 г",0.1725,0.029023746701846966,400.0,69.0,379.0,11.0,3.0,72.0,"Хлопья 4 злака (овсяные, пшеничные, ячменные, ржаные)Товар от производителейАктуальные данные указаны на этикетке. Цена может отличаться в зависимости от региона или формата точки продажи (вендинг, микромаркет).Информация на этикетке может незначительно отличаться","Нехватка времени по утрам — не повод отказывать себе в питательном завтраке! Эти хлопья не требуют варки: нужно лишь залить их горячим молоком или водой, перемешать, накрыть крышкой — и через 5 минут полезная каша готова! В составе — ничего лишнего: только овсяные, пшеничные, ячменные и ржаные хлопья, изготовленные из цельных зёрен.",0,2025-06-13 11:20:24,"Крупы, макароны, мука#Сухие завтраки, хлопья и мюсли",4.9,1180,https://img.vkusvill.ru/pim/images/site_LargeWebP/eab3f4d9-8450-437f-bfd6-90ce21c561bd.webp?1706528013.4013,khlopya-4-vida-zlakovykh-400-g-64318.html
https://vkusvill.ru/goods/muka-iz-sorgo-tselnozernovaya-bez-glyutena-91725.html,Мука из сорго цельнозерновая без глютена,0.25,0.028816846771958993,500.0,125.0,360.9,10.4,1.3,76.9,Мука из сорго цельнозерновая.,"Cорго — безглютеновая крупа с высоким содержанием клетчатки и протеина, которая отлично подходит для диетического питания. У сорго мягкий, почти нейтральный вкус, напоминающий одновременно рис и пшено. Мука из такой крупы превосходно подойдёт почти для любой выпечки: хлеба, маффинов, вафель, теста для пиццы, тортов и печенья. С ней текстура изделий получится воздушной и достаточной упругой. При готовке необходимо учитывать, что эта крупа более клейкая, чем привычная пшеничная. Поэтому, скорее всего, будет нужно использовать в рецепте больше жидкости, чем обычно.",0,2025-06-13 11:20:14,"Крупы, макароны, мука#Мука и ингредиенты для выпечки",4.8,728,https://img.vkusvill.ru/pim/images/site_LargeWebP/d83e5019-46a6-4db6-a04f-406d55caa517.webp?1732916498.1188,muka-iz-sorgo-tselnozernovaya-bez-glyutena-91725.html
https://vkusvill.ru/goods/muka-iz-sorgo-tselnozernovaya-bez-glyutena-500-g-79738.html,"Мука из сорго цельнозерновая без глютена, 500 г",0.214,0.028804076884728302,500.0,107.0,361.06,10.4,1.34,76.85,"мука из сорго цельнозерновая. Продукция производится на предприятии, где используются аллергены: арахис, кунжут, орехи.Товар от производителейАктуальные данные указаны на этикетке. Цена может отличаться в зависимости от региона или формата точки продажи (вендинг, микромаркет).Информация на этикетке может незначительно отличаться","Мука из зерна сорго — безглютеновая альтернатива привычной муке. Она не только отличается  высоким содержанием клетчатки и протеина, но и отлично подходит для диетического питания и спортивного рациона. У такой муки мягкий, практически нейтральный вкус со сладковатыми нотами. Её можно использовать для приготовления блинчиков, выпечки, домашнего хлеба, вареников и даже панировки.",0,2025-06-13 11:20:29,"Крупы, макароны, мука#Мука и ингредиенты для выпечки",Ждёт оценку,3,https://img.vkusvill.ru/pim/images/site_LargeWebP/2590fd61-2e89-4af7-aefb-7a87b58e99b6.webp?1708068025.0451,muka-iz-sorgo-tselnozernovaya-bez-glyutena-500-g-79738.html
https://vkusvill.ru/goods/kasha-amarantovaya-momentalnogo-prigotovleniya-s-izyumom-mindalyem-i-koritsey-na-tselnom-moloke-92039.html,"Каша амарантовая моментального приготовления с изюмом, миндалём и корицей на цельном молоке",0.9090909090909091,0.028455284552845527,44.0,40.0,369.0,10.5,6.0,66.5,"Крупа амарантовая не требующая варки, хлопья овсяные, фруктоза, молоко цельное сухое, изюм, миндаль, корица, соль, ароматизатор натуральный - ""Миндаль"". Продукт содержит злаки, содержащие глютен, и продукты их переработки, молочные продукты (лактоза), орехи, может содержать следы сельдерея, кунжута, арахиса. Продукция производится на предприятии, где используются аллергены: арахис, кунжут, сельдерей.","Самый быстрый из полезных завтраков и самый полезный из вкусных. Каша не требует варки и уже дополнена всем необходимым: сладким изюмом, миндалём и пряной корицей. А в её основе амарантовые и овсяные хлопья, не требующие варки — то, что нужно, чтобы  утолить голод и зарядиться энергией до самого обеда. Просто залейте хлопьяи кипятком в подходящей посуде, накройте стаканчик крышкой, подождите 5-7 минут и наслаждайтесь полноценным завтраком.",0,2025-06-13 11:20:13,"Крупы, макароны, мука#Каши",Ждёт оценку,4,https://img.vkusvill.ru/pim/images/site_LargeWebP/09a7c07e-8b18-4dd4-86c7-2ec804635e79.webp?1715892201.6643,kasha-amarantovaya-momentalnogo-prigotovleniya-s-izyumom-mindalyem-i-koritsey-na-tselnom-moloke-92039.html
https://vkusvill.ru/goods/khlopya-iz-golozernogo-ovsa-bez-glyutena-malina-s-belym-shokoladom-98117.html,Хлопья из голозерного овса без глютена «Малина с белым шоколадом»,2.6666666666666665,0.028007793472966388,45.0,120.0,410.6,11.5,10.2,68.2,"Овсяные хлопья 80%, белый шоколад 15,5% (сахар, какао масло, цельное сухое молоко, сухая молочная сыворотка, лактоза, эмульгатор (подсолнечный лецитин)), сублимированная малина 4,5%.","Идеальный микс для вкусного, полезного и к тому же быстрого завтрака. В основе — безглютеновые овсяные хлопья, не требующие варки, кусочки настоящего белого шоколада и ароматная сублимированная малина. «Готовка» займёт всего пару минут: просто добавьте в баночку кипяток, накройте её крышкой и подождите, пока хлопья увеличатся в размере. Каша получится нежной, умеренно сладкой, с приятной ягодной кислинкой — от такой не откажутся даже маленькие гурманы!",0,2025-06-13 11:20:22,"Крупы, макароны, мука#Сухие завтраки, хлопья и мюсли",4.6,94,https://img.vkusvill.ru/pim/images/site_LargeWebP/5583ab8b-6f6b-4822-af20-337e5cb8eb1a.webp?1725396684.6003,khlopya-iz-golozernogo-ovsa-bez-glyutena-malina-s-belym-shokoladom-98117.html
