url,name,pri/we,pro/cal,weight,price,calories,proteins,fats,carbohydrates,content,description,availability,last_upd_time,category,average_rating,rating_count,imgUrl,html_path
https://vkusvill.ru/goods/granola-tropicheskaya-37405.html,Гранола «Тропическая»,0.9107142857142857,0.017812285910025122,280.0,255.0,437.9,7.8,16.3,58.8,"гранола (цельнозерновые овсяные и пшеничные хлопья, сахар, мука рисовая, мука пшеничная хлебопекарная высшего сорта, солод светлый ячменный, масло рапсовое рафинированное дезодорированное, глюкозный сироп, мед натуральный цветочный, корица молотая, сахар карамелизованный, соль пищевая), кокос сушеный резаный, банановые чипсы (банан сушеный, масло кокосовое, сахар), кусочки ананаса сублимационной сушки Продукция производится на предприятии, где используются аллергены: арахис, молоко (лактоза), орехи, соя.Товар от производителейАктуальные данные указаны на этикетке. Цена может отличаться в зависимости от региона или формата точки продажи (вендинг, микромаркет).Информация на этикетке может незначительно отличаться","Мультиполезная смесь для здорового, питательного завтрака. Основа гранолы — цельнозерновые хлопья из овса и пшеницы. Для сладкой пряности добавлен натуральный мед, корица и карамелизированный сахар. Кусочки ананаса, кокоса и банановые чипсы делают гранолу аппетитно тропической и еще более сытной. Гранола уже готова к употреблению. Остается добавить в нее молоко, йогурт или ряженку и начать день с настоящего лакомства.",0,2025-06-13 11:20:13,"Крупы, макароны, мука#Сухие завтраки, хлопья и мюсли",4.9,2332,https://img.vkusvill.ru/pim/images/site_LargeWebP/7694838a-e512-47cd-93cf-cd386fea17b4.webp?1711437221.5306,granola-tropicheskaya-37405.html
https://vkusvill.ru/goods/kolechki-amarantovye-kakao-150-g-84162.html,"Колечки амарантовые «Какао», 150 г",1.3333333333333333,0.01751549447588251,150.0,200.0,371.1,6.5,1.9,82.0,"мука рисовая грубого помола, подсластитель - изомальтоолигосахарид, мука амарантовая грубого помола, мука кукурузная крупного помола, патока крахмальная карамельная, вода питьевая, какао-порошок, топинамбур сушёный, соль, подсластитель - экстракт стевии (стевиолгликозиды). Продукция производится на предприятии, где используются аллергены: арахис, молоко (лактоза), орехи, яйца. Содержит подсластители (сахарозаменители). При чрезмерном употреблении могут оказывать слабительное действие.","Безглютеновые колечки из рисовой, амарантовой и кукурузной муки. Изготовлены с добавлением альтернативных подсластителей и ароматного какао-порошка. Питательность, приятный сладковато-шоколадный вкус и хрустящая текстура делает их подходящим выбором для быстрого завтрака. Одинаково прекрасны в сочетании с молоком, кефиром и питьевыми йогуртами. А истинные сладкоежки могут полакомиться колечками просто так, на перерыве.",0,2025-06-13 11:20:25,"Крупы, макароны, мука#Сухие завтраки, хлопья и мюсли",4.9,412,https://img.vkusvill.ru/pim/images/site_LargeWebP/f9174f19-d945-4b58-9bfb-938cd0c85785.webp?1703107765.2638,kolechki-amarantovye-kakao-150-g-84162.html
https://vkusvill.ru/goods/lapsha-risovaya-bezglyutenovaya-83450.html,Лапша рисовая безглютеновая,0.5933333333333334,0.01730496453900709,300.0,178.0,352.5,6.1,0.5,80.9,"мука рисовая (98%), вода питьевая (2%).","Безглютеновая альтернатива для пшеничных лингвини. Из этой рисовой лапши можно приготовить классическую пасту, пряный вок или оригинальную азиатскую закуску на манер фунчозы. Лапша не слипается, не рвётся и быстро готовится: для варки понадобится всего лишь 6 минут.",0,2025-06-13 11:20:29,"Крупы, макароны, мука#Макароны",4.8,2115,https://img.vkusvill.ru/pim/images/site_LargeWebP/d7ed2f1e-4285-4f50-985a-d447643ade59.webp?1707338724.8146,lapsha-risovaya-bezglyutenovaya-83450.html
https://vkusvill.ru/goods/myusli-shokoladnye-15616.html,Мюсли «Шоколадные»,0.7366666666666667,0.017160367722165476,300.0,221.0,489.5,8.4,23.1,62.0,"хлопья овсяные, хлопья ячменные, хлопья пшеничные, сахар, масло оливковое нерафинированное высшего качества (Extra virgin olive oil), виноград сушёный (изюм), шоколад (сахар, масло какао, какао тёртое, эмульгатор - лецитин, ароматизатор – ваниль), мука пшеничная в/с, кокосовая стружка, ядро фундука цельное обжаренное, какао порошок натуральный, хлопья из пророщенной пшеницы, соль пищевая.Товар от производителейАктуальные данные указаны на этикетке. Цена может отличаться в зависимости от региона или формата точки продажи (вендинг, микромаркет).Информация на этикетке может незначительно отличаться","Мультизлаковые мюсли с изюмом, кусочками натурального шоколада и цельным фундуком, запечённые с добавлением оливкового масла. Питательные, аппетитно хрустящие, со сбалансированным шоколадно-ореховым вкусом — эти мюсли смогли бы стать настоящим полезным десертом. Лучше всего они сочетаются с густыми йогуртами без добавок, молоком и кефиром. Если вам хочется сделать мюсли чуть мягче, их можно разогреть в микроволновке вместе с молоком или другой заправкой в течение нескольких секунд.",0,2025-06-13 11:20:27,"Крупы, макароны, мука#Сухие завтраки, хлопья и мюсли",4.9,2548,https://img.vkusvill.ru/pim/images/site_LargeWebP/12ca77cb-aa40-41fa-861c-882f739080c0.webp?1711438006.1452,myusli-shokoladnye-15616.html
https://vkusvill.ru/goods/granola-tykvennye-semechki-i-yagody-godzhi-93403.html,Гранола «Тыквенные семечки и ягоды годжи»,2.125,0.01700318809776833,160.0,340.0,470.5,8.0,6.9,82.8,"хлопья овсяные, сироп топинамбура (клубни топинамбура, вода питьевая), хлопья пшеничные, семена тыквы очищенные, клюква сушеная, кленовый сироп, взорванное зерно риса, кокосовая мука, семена кунжута, масло кокосовое нерафинированное холодного отжима, кукуруза воздушная (мука кукурузная, сахар, соль пищевая), рис воздушный (крупа рисовая, мука пшеничная хлебопекарная высшего сорта, сахар, соль пищевая), ягоды годжи, взорванное зерно ячменя, соль пищевая гималайская розовая, антиокислитель - токоферолы, концентрат смеси. Продукция производится на предприятии, где используются аллергены: арахис, орехи.","Хрустящая гранола на основе овсяных и пшеничных хлопьев, дополненных воздушными зёрнами кукурузы, риса и ячменя. Семена тыквы и кунжута делают её ещё питательнее, кленовый сироп придаёт утончённую сладость, а ягоды годжи — контрастную кислинку. Гранола не только вкусная, но и полезная, ведь благодаря злаковому ассорти она богата пищевыми волокнами, необходимыми для комфортной работы ЖКТ. Просто добавьте к ней молоко, йогурт или ряженку и наслаждайтесь быстрым завтраком.",0,2025-06-13 11:20:25,"Крупы, макароны, мука#Сухие завтраки, хлопья и мюсли",4.9,589,https://img.vkusvill.ru/pim/images/site_LargeWebP/1b52106c-baef-418f-b35a-09824672d4ac.webp?1729799159.8753,granola-tykvennye-semechki-i-yagody-godzhi-93403.html
https://vkusvill.ru/goods/gotovyy-zavtrak-s-karamelnym-siropom-kolechki-53432.html,Готовый завтрак с карамельным сиропом «Колечки»,0.51,0.016796988126267013,200.0,102.0,345.3,5.8,2.1,75.8,"зерновые продукты (крупа кукурузная, крупа рисовая, мука пшеничная хлебопекарная высшего сорта, крупа манная), сахар, сироп глюкозно-фруктозный, какао-порошок, масло подсолнечное рафинированное дезодорированное, молоко сгущённое с сахаром варёное массовая доля жира 8,5 % (молоко нормализованное, сахар (сахароза)), крахмал кукурузный, соль пищевая, эмульгатор – лецитины (соевый), пищевые пшеничные волокна. Продукция производится на предприятии, где используется арахис.Товар от производителейАктуальные данные указаны на этикетке. Цена может отличаться в зависимости от региона или формата точки продажи (вендинг, микромаркет).Информация на этикетке может незначительно отличаться","Хрустящие колечки из смеси круп, покрытые тонкой карамельной корочкой. Подходят для завтраков и перекусов. Вкусно, как в детстве!",0,2025-06-13 11:20:15,"Крупы, макароны, мука#Сухие завтраки, хлопья и мюсли",4.8,6185,https://img.vkusvill.ru/pim/images/site_LargeWebP/ab44966e-4249-44cf-a016-5cb286f93e97.webp?1711436543.961,gotovyy-zavtrak-s-karamelnym-siropom-kolechki-53432.html
https://vkusvill.ru/goods/granola-amarant-i-kerob-92983.html,Гранола «Амарант и кэроб»,1.75,0.01633275261324042,160.0,280.0,459.2,7.5,7.4,83.1,"хлопья овсяные, сироп топинамбура (клубни топинамбура, вода питьевая), патока крахмальная карамельная, семена подсолнечника очищенные, кукуруза обжаренная соленая дробленая (зерно кукурузы, масло подсолнечное рафинированное дезодорированное, соль пищевая), ядра ореха миндаля нарезанные, масло кокосовое нерафинированное холодного отжима, кукуруза воздушная (мука кукурузная, сахар, соль пищевая), мука кокосовая, взорванное зерно гречихи, взорванное зерно полбы, рис воздушный (крупа рисовая, мука пшеничная хлебопекарная высшего сорта, сахар, соль пищевая), семена чиа, земляника сушеная, кэроб (порошок из плодов перуанского рожкового дерева), крупа амарантовая, соль пищевая гималайская розовая, антиокислитель - токоферолы, концентрат смеси. Продукция производится на предприятии, где используются аллергены: арахис, кунжут.","Хрустящая гранола на основе цельных овсяных хлопьев, сдобренных сиропом топинамбура и ароматной карамельной патокой. Микс семян в сочетании с кусочками миндаля делает её ещё питательнее. Кэроб придаёт вкусу утончённые какао-ноты, а сушёная земляника — приятную ягодную кислинку. Гранола не только вкусная, но и полезная, ведь благодаря ассорти злаков она богата пищевыми волокнами, необходимым для комфортной работы ЖКТ. Просто добавьте к граноле молоко, йогурт или ряженку и наслаждайтесь быстрым завтраком.",0,2025-06-13 11:20:23,"Крупы, макароны, мука#Сухие завтраки, хлопья и мюсли",4.8,715,https://img.vkusvill.ru/pim/images/site_LargeWebP/cb9c896e-a2de-44f9-8f9a-05f2a8257089.webp?1726779683.0481,granola-amarant-i-kerob-92983.html
https://vkusvill.ru/goods/kolechki-kukuruznye-so-vkusom-banana-105159.html,Колечки кукурузные со вкусом банана,0.512,0.015915119363395226,250.0,128.0,377.0,6.0,1.0,86.0,"крупа кукурузная, сахар, мука пшеничная, соль пищевая йодированная (соль пищевая, йодат калия), стабилизатор - карбонат кальция, ароматизатор натуральный «Банан».","Кукурузные колечки с банановым вкусом подходят как для завтрака, так и для перекуса на ходу. Отлично сочетаются с молоком, йогуртом или просто как самостоятельное лакомство.Хрустящие, но не жёсткие, с лёгкой сладостью и фруктовым ароматом. Понравятся и детям, и взрослым, особенно тем, кто ищет быстрый, но приятный перекус.",0,2025-06-13 11:20:19,"Товары для детей#Детские кашки, макароны, супы и завтраки",4.8,654,https://img.vkusvill.ru/pim/images/site_LargeWebP/86a2d559-cf33-441b-a37d-c5058341ec87.webp?1743461458.989,kolechki-kukuruznye-so-vkusom-banana-105159.html
https://vkusvill.ru/goods/shariki-kukuruznye-sladkie-88648.html,Шарики кукурузные сладкие,0.5,0.015915119363395226,150.0,75.0,377.0,6.0,1.0,86.0,"Крупа кукурузная, сахар, соль пищевая йодированная (соль пищевая, йодат калия).  Продукция производится на предприятии, где используются аллергены: злаки, содержащие глютен.","Хрустящие шарики для быстрых и вкусных завтраков, изготовленные всего из трёх ингредиентов: кукурузной крупы, небольшого количества сахара и соли. Их можно дополнить молоком, ряженкой или кефиром, а можно — добавить в йогурт.",0,2025-06-13 11:20:26,"Крупы, макароны, мука#Сухие завтраки, хлопья и мюсли",4.9,761,https://img.vkusvill.ru/pim/images/site_LargeWebP/4daa9d7a-46bd-4443-9104-e44f52de3bae.webp?1717642893.9981,shariki-kukuruznye-sladkie-88648.html
https://vkusvill.ru/goods/podushechki-s-molochnoy-nachinkoy-26168.html,Подушечки с молочной начинкой,0.63,0.01543859649122807,200.0,126.0,427.5,6.6,15.1,66.3,"зерновые продукты (крупа кукурузная, крупа рисовая, мука пшеничная хлебопекарная высшего сорта, крупа манная), сахар, масло подсолнечное рафинированное дезодорированное, крахмал кукурузный, молоко сухое обезжиренное, сыворотка молочная сухая, какао-порошок, эмульгатор – лецитин соевый, соль пищевая. Продукция производится на предприятии, где используется арахис.Товар от производителейАктуальные данные указаны на этикетке. Цена может отличаться в зависимости от региона или формата точки продажи (вендинг, микромаркет).Информация на этикетке может незначительно отличаться","Хрустящие мультизлаковые подушечки с нежной, умеренно сладкой молочной начинкой. Одинаково прекрасны в сочетании с молоком, кефиром и питьевыми йогуртами. А сладкоежки могут полакомиться подушечками во время чаепития или взять их собой для перекуса.",0,2025-06-13 11:20:20,"Крупы, макароны, мука#Сухие завтраки, хлопья и мюсли",5,12211,https://img.vkusvill.ru/pim/images/site_LargeWebP/089261c8-f529-46e4-9f1f-6db7f6518246.webp?1711442114.5452,podushechki-s-molochnoy-nachinkoy-26168.html
https://vkusvill.ru/goods/podushechki-s-kokosovoy-nachinkoy-160-g-81195.html,"Подушечки с кокосовой начинкой, 160 г",1.20625,0.015310402684563757,160.0,193.0,476.8,7.3,24.4,57.0,"зерновые продукты (мука пшеничная хлебопекарная первого сорта, крупа рисовая дробленая), сахар тростниковый нерафинированный, масло кокосовое рафинированное дезодорированное, мякоть кокоса тертая, масло подсолнечное рафинированное дезодорированное, полидекстроза, кукурузные волокна, изолят соевого белка, какао-порошок, соль пищевая, эмульгатор - лецитины (подсолнечный). Продукция производится на предприятии, где используются аллергены: молоко (лактоза), орехи.","Хрустящие мультизлаковые подушечки со сладковато-сливочной начинкой, изготовленные с добавлением кокосового масла и стружки спелого кокоса. Одинаково прекрасны в сочетании с молоком, кефиром и питьевыми йогуртами. А истинные сладкоежки могут взять подушечки с собой для перекуса.",0,2025-06-13 11:20:24,"Крупы, макароны, мука#Сухие завтраки, хлопья и мюсли",4.6,698,https://img.vkusvill.ru/pim/images/site_LargeWebP/834d380f-1cc2-4545-95ae-775b7df3415e.webp?1703968611.3923,podushechki-s-kokosovoy-nachinkoy-160-g-81195.html
https://vkusvill.ru/goods/khlopya-ovsyanye-khrustyashchie-s-medom-bez-glyutena-106948.html,Хлопья овсяные хрустящие с медом без глютена,0.792,0.01368184602818052,250.0,198.0,489.7,6.7,16.1,75.7,"Хлопья овсяные цельнозерновые безглютеновые, мед натуральный цветочный, масло кокосовое рафинированное.","Хрустящие овсяные хлопья без глютена, запечённые с натуральным мёдом и кокосовым маслом. Вкус получается мягким, с приятным ореховым оттенком. Хлопья можно есть отдельно, использовать как основу для гранолы или добавлять в йогурт, чтобы сделать его более сытным и текстурным. Благодаря лёгкой сладости они подходят как для самостоятельного перекуса, так и для дополнения к фруктам или орехам.",0,2025-06-13 11:20:28,"Крупы, макароны, мука#Сухие завтраки, хлопья и мюсли",4.9,623,https://img.vkusvill.ru/pim/images/site/site_LargeWebP/17fe9fc0-08b0-4bb9-9fe9-14dad2b00fab.webp,khlopya-ovsyanye-khrustyashchie-s-medom-bez-glyutena-106948.html
https://vkusvill.ru/goods/makarony-trubochka-iz-kukuruznoy-muki-36534.html,Макароны «Трубочка» из кукурузной муки,0.5,0.01316872427983539,300.0,150.0,364.5,4.8,0.5,85.2,"кукурузная мука тонкого помола , кукурузный крахмал, вода питьевая.Товар от производителейАктуальные данные указаны на этикетке. Цена может отличаться в зависимости от региона или формата точки продажи (вендинг, микромаркет).Информация на этикетке может незначительно отличаться","Оригинальные макароны в форме трубочек заботливо приготовлены из ароматной кукурузной муки. При варке отлично держат форму, оставаясь упругими и в меру плотными. Подходят для безглютеновой диеты. Кукурузные макароны хороши с любимыми соусами, из них можно приготовить запеканку или густой молочный суп. Способ приготовления: в кипящую воду или бульон добавить 5 г соли (1/2 столовой ложки); засыпать макароны в солёную воду (1 л воды на 100 г макарон); варить 10–13 минут до готовности, помешивая.",0,2025-06-13 11:20:24,Особое питание#Продукты без глютена#Продукты без глютена (возможны следы)#Бакалея без глютена#Макароны,4.8,245,https://img.vkusvill.ru/pim/images/site_LargeWebP/dbe83b4c-6c4b-4922-ac5b-a19979d3a02c.webp?1705337013.45,makarony-trubochka-iz-kukuruznoy-muki-36534.html
