url,name,pri/we,pro/cal,weight,price,calories,proteins,fats,carbohydrates,content,description,availability,last_upd_time,category,average_rating,rating_count,imgUrl,html_path
https://vkusvill.ru/goods/izdeliya-makaronnye-makkeroni-di-kaza-grandi-64830.html,Изделия макаронные: Маккерони ди Каза Гранди,0.27,0.036923076923076927,400.0,108.0,325.0,12.0,1.0,67.0,"мука из твердых сортов пшеницы, вода питьеваяТовар от производителейАктуальные данные указаны на этикетке. Цена может отличаться в зависимости от региона или формата точки продажи (вендинг, микромаркет).Информация на этикетке может незначительно отличаться","Маккерони из твёрдых сортов пшеницы идеально подходят для приготовления итальянских паст по классическим рецептам. Плотная текстура макарон позволяет отварить их до состояния «al dente», а необычная форма создана специально, чтобы лучше удерживать даже тяжёлые соусы.",0,2025-06-13 11:20:18,"Крупы, макароны, мука#Макароны",4.9,2400,https://img.vkusvill.ru/pim/images/site/site_LargeWebP/d402c3d4-e365-4ac2-8a8e-cd2d0841a37a.webp,izdeliya-makaronnye-makkeroni-di-kaza-grandi-64830.html
https://vkusvill.ru/goods/makaronnye-izdeliya-talyatella-dzhirata-gruppa-a-400-g-72749.html,"Макаронные изделия Тальятелла Джирата, группа А, 400 г",0.2675,0.036923076923076927,400.0,107.0,325.0,12.0,1.0,67.0,"мука из твердой пшеницы высшего сорта, вода питьеваяТовар от производителейАктуальные данные указаны на этикетке. Цена может отличаться в зависимости от региона или формата точки продажи (вендинг, микромаркет).Информация на этикетке может незначительно отличаться","Как сказала бы любая итальянская хозяйка: главное в пасте — её текстура. Более шершавая, чем у других сортов пасты, она помогает тальятелле удерживать самые тяжелые и густые соусы: например, знаменитый болоньезе.",0,2025-06-13 11:20:19,"Крупы, макароны, мука#Макароны",4.9,5490,https://img.vkusvill.ru/pim/images/site_LargeWebP/b094ea33-7728-4f97-97fb-0ac8123e581f.webp?1730188051.3159,makaronnye-izdeliya-talyatella-dzhirata-gruppa-a-400-g-72749.html
https://vkusvill.ru/goods/makaronnye-izdeliya-igrushki-19903.html,Макаронные изделия «Игрушки»,0.254,0.036923076923076927,500.0,127.0,325.0,12.0,1.0,67.0,"мука из твердой пшеницы для макаронных изделий высшего сорта, вода питьеваяТовар от производителейАктуальные данные указаны на этикетке. Цена может отличаться в зависимости от региона или формата точки продажи (вендинг, микромаркет).Информация на этикетке может незначительно отличаться","Эти макароны, изготовленные из пшеницы твёрдых сортов, отлично подойдут и для первых, и для вторых блюд. Они не склеиваются и не развариваются, а их необычную форму особенно оценят дети! Советуем готовить макароны на слабом огне в течение 11 минут.",0,2025-06-13 11:20:21,"Товары для детей#Детские кашки, макароны, супы и завтраки",5,4431,https://img.vkusvill.ru/pim/images/site_LargeWebP/23849844-ef79-4fe5-a9a0-ea5d0a3fbce0.webp?1731879377.132,makaronnye-izdeliya-igrushki-19903.html
https://vkusvill.ru/goods/makarony-gnezda-fetuchini-27370.html,Макароны «Гнезда Фетучини»,0.28,0.036923076923076927,400.0,112.0,325.0,12.0,1.0,67.0,"мука из твердых сортов пшеницы, вода питьевая.Товар от производителейАктуальные данные указаны на этикетке. Цена может отличаться в зависимости от региона или формата точки продажи (вендинг, микромаркет).Информация на этикетке может незначительно отличаться","Мука из твердых сортов пшеницы и вода — вот всё, что входит в состав этих макаронных изделий. Готовятся фетучини легко и быстро — вам потребуется лишь 10-12 минут, чтобы сварить пасту до состояния аль денте. Благодаря упругой текстуре эти макароны отлично удерживают даже тяжёлые соусы, поэтому в качестве топпинга к ним можно выбрать любые ингредиенты, будь то мясо, морепродукты или овощной микс — для веганского варианта блюда.",0,2025-06-13 11:20:23,"Крупы, макароны, мука#Макароны",4.9,4962,https://img.vkusvill.ru/pim/images/site_LargeWebP/d3eda805-e471-4c03-aa78-804cfd1ab62d.webp?1738359091.0707,makarony-gnezda-fetuchini-27370.html
https://vkusvill.ru/goods/makaronnye-izdeliya-bantiki-20990.html,Макаронные изделия Бантики,0.254,0.036923076923076927,500.0,127.0,325.0,12.0,1.0,67.0,"мука из твердой пшеницы для макаронных изделий высшего сорта, вода питьевая.Товар от производителейАктуальные данные указаны на этикетке. Цена может отличаться в зависимости от региона или формата точки продажи (вендинг, микромаркет).Информация на этикетке может незначительно отличаться","Изготовленные исключительно из твёрдых сортов пшеницы, эти симпатичные бантики не развариваются, не склеиваются и отлично держат легкий соус. Благодаря своей необычной форме такие макароны понравятся как взрослым, так и детям.",0,2025-06-13 11:20:24,"Товары для детей#Детские кашки, макароны, супы и завтраки",4.9,5182,https://img.vkusvill.ru/pim/images/site_LargeWebP/de4e6158-4476-487f-b664-ecd3bbfd52cf.webp?1707840203.4414,makaronnye-izdeliya-bantiki-20990.html
https://vkusvill.ru/goods/makaronnye-izdeliya-ptitim-64837.html,Макаронные изделия «Птитим»,0.255,0.036923076923076927,400.0,102.0,325.0,12.0,1.0,67.0,"мука из твердой пшеницы высшего сорта, вода питьеваяТовар от производителейАктуальные данные указаны на этикетке. Цена может отличаться в зависимости от региона или формата точки продажи (вендинг, микромаркет).Информация на этикетке может незначительно отличаться","Оригинальная паста, изготовленная из твёрдых сортов пшеницы. Из-за необычной формы её можно принять за рис, но пускай глаза вас не обманывают. Птитим как нельзя лучше подходит для приготовления пасты, ведь маленькие «зёрнышки» хорошо пропитываются соусом, а значит, и вкус блюда получается более выразительным.",0,2025-06-13 11:20:24,"Крупы, макароны, мука#Макароны",5,9081,https://img.vkusvill.ru/pim/images/site_LargeWebP/f05ca285-5661-4445-ada1-ad2622e84a29.webp?1730187267.6954,makaronnye-izdeliya-ptitim-64837.html
https://vkusvill.ru/goods/makaronnye-izdeliya-fiori-festonati-rigati-104914.html,Макаронные изделия «Фиори Фестонати Ригати»,0.27,0.036923076923076927,400.0,108.0,325.0,12.0,1.0,67.0,"Мука из твердой пшеницы для макаронных изделий высшего сорта, вода питьевая.","Необычные макароны из твёрдых сортов пшеницы в форме полураскрытых цветочных бутонов. Их рельефная поверхность и полая структура удерживают любой соус: от нежного сливочного до насыщенного томатного. При варке остаются упругими и не слипаются. Хорошо сочетаются как с простыми, так и со сложными многокомпонентными заправками. Подойдут для приготовления блюд итальянской кухни.",0,2025-06-13 11:20:25,"Крупы, макароны, мука#Макароны",4.9,320,https://img.vkusvill.ru/pim/images/site_LargeWebP/e07242cb-d989-458c-9f04-8a69d219e005.webp?1748385446.3353,makaronnye-izdeliya-fiori-festonati-rigati-104914.html
https://vkusvill.ru/goods/makaronnye-izdeliya-pruzhina-durum-20268.html,"Макаронные изделия «Пружина», дурум",0.2,0.036923076923076927,450.0,90.0,325.0,12.0,1.0,67.0,"мука из твердой пшеницы для макаронных изделий высшего сорта, вода питьеваяТовар от производителейАктуальные данные указаны на этикетке. Цена может отличаться в зависимости от региона или формата точки продажи (вендинг, микромаркет).Информация на этикетке может незначительно отличаться","Макароны из пшеницы твёрдых сортов (дурума) отлично подходят людям, следящим за фигурой и здоровьем. При варке они не слипаются, не теряют форму и сохраняют свой аппетитный цвет. Рекомендуем готовить макароны на слабом огне в течение 13–14 минут.",0,2025-06-13 11:20:28,"Крупы, макароны, мука#Макароны",4.9,8325,https://img.vkusvill.ru/pim/images/site_LargeWebP/d630c6d6-ce26-4692-920c-63aebaaa2217.webp?1731947464.8724,makaronnye-izdeliya-pruzhina-durum-20268.html
https://vkusvill.ru/goods/makaronnye-izdeliya-pasta-orzo-400-g-79309.html,"Макаронные изделия паста «Орзо», 400 г",0.3,0.036923076923076927,400.0,120.0,325.0,12.0,1.0,67.0,"мука из твердой пшеницы высшего сорта, вода питьевая.Товар от производителейАктуальные данные указаны на этикетке. Цена может отличаться в зависимости от региона или формата точки продажи (вендинг, микромаркет).Информация на этикетке может незначительно отличаться","Орзо — одна из разновидностей итальянской пасты, внешне напоминающая рисовые зёрна. Изготавливается из муки твёрдых сортов пшеницы высшего качества. Такая паста не разваривается и не слипается. Кроме того, из неё проще приготовить блюдо  «‎аль денте».",0,2025-06-13 11:20:29,"Крупы, макароны, мука#Макароны",4.9,3706,https://img.vkusvill.ru/pim/images/site_LargeWebP/05e98929-5f42-4af6-b2ad-c84edcc07b53.webp?1730187986.8441,makaronnye-izdeliya-pasta-orzo-400-g-79309.html
https://vkusvill.ru/goods/krupa-mannaya-iz-tverdoy-pshenitsy-51897.html,Крупа манная из твердой пшеницы,0.186,0.03653902367728734,500.0,93.0,342.1,12.5,1.3,70.1,"крупа манная из твёрдой пшеницы (марка Т).Товар от производителейДанный товар поставляют несколько производителей, внешний вид и характеристики могут незначительно отличаться. Актуальные данные указаны на этикетке. Цена может отличаться в зависимости от региона или формата точки продажи (вендинг, микромаркет).Информация на этикетке может незначительно отличаться","В манке из твёрдых сортов пшеницы содержание клетчатки и белков выше, а крахмала — ниже, по сравнению с крупой из мягких сортов. Кроме того, крупинки такой манки отличаются большей плотностью, поэтому варить её нужно на 1-2 минуты дольше. А ещё эта манная крупа лучше подходит для добавления в десерты и выпечку: она помогает кулинарному изделию сохранить свою форму.",0,2025-06-13 11:20:26,"Крупы, макароны, мука#Крупы",5,6984,https://img.vkusvill.ru/pim/images/site_LargeWebP/29f10293-330a-4cf4-ad71-5357348709cf.webp?1707838529.0216,krupa-mannaya-iz-tverdoy-pshenitsy-51897.html
https://vkusvill.ru/goods/pasta-svezhaya-pappardelle-s-dobavleniem-yaytsa-88953.html,Паста свежая «Паппарделле» с добавлением яйца,0.82,0.036458333333333336,250.0,205.0,288.0,10.5,2.8,55.2,"мука из твердой пшеницы для макаронных изделий высшего сорта (крупка), меланж яичный жидкий, вода питьевая, куркума.","Свежая паста из твёрдых сортов пшеницы с аппетитным золотистым цветом, который мы получили, добавив к тесту щепотку пряной куркумы. Вкус пасты из таких макарон получается особенно насыщенным и сбалансированным, ведь они хорошо пропитываются соусом, но при этом держат форму и сохраняют текстуру «аль денте».",0,2025-06-13 11:20:17,"Крупы, макароны, мука#Макароны",4.9,1399,https://img.vkusvill.ru/pim/images/site_LargeWebP/070636b4-6739-4676-9738-4a22afb07238.webp?1709757080.9037,pasta-svezhaya-pappardelle-s-dobavleniem-yaytsa-88953.html
https://vkusvill.ru/goods/krupa-grechnevaya-yadritsa-900-g-105168.html,"Крупа гречневая ядрица, 900 г",0.09,0.03643724696356275,900.0,81.0,345.8,12.6,2.6,68.0,"крупа гречневая ядрица быстроразваривающаяся. Продукция производится на предприятии, где используются аллергены: злаки, содержащие глютен.","Гречка отличается высоким содержанием белка и трудноусваиваемых углеводов, поэтому она идеально подходит для здоровых рационов. Из неё можно сварить питательную молочную кашу или сытный гарнир. А если добавить в гречку морковно-луковую зажарку и мясо или фарш, получится полноценный обед или ужин.",0,2025-06-13 11:20:19,"Крупы, макароны, мука#Крупы",5,191,https://img.vkusvill.ru/pim/images/site_LargeWebP/13c73879-0af6-4f63-ba55-06eacbb01376.webp?1741638453.9353,krupa-grechnevaya-yadritsa-900-g-105168.html
https://vkusvill.ru/goods/krupa-zelyenaya-grechka-paketiki-42818.html,"Крупа «Зелёная гречка», пакетики",0.5514285714285714,0.03643724696356275,350.0,193.0,345.8,12.6,2.6,68.0,"гречка зеленая Продукция производится на предприятии, где используются аллергены: злаки, содержащие глютен, кунжут, соя.Товар от производителейАктуальные данные указаны на этикетке. Цена может отличаться в зависимости от региона или формата точки продажи (вендинг, микромаркет).Информация на этикетке может незначительно отличаться","Знаменитый супер-фуд, расфасованный в удобные пакетики для варки. У зелёной гречки нежный, слегка ореховый вкус и тонкий аромат. Готовить такую гречку очень просто. Для сытных полезных гарниров, рассыпчатых каш и аппетитных блюд русской кухни.",0,2025-06-13 11:20:23,"Крупы, макароны, мука#Крупы",4.9,450,https://img.vkusvill.ru/pim/images/site_LargeWebP/ff25aa65-736c-41c6-95ed-1d57990ac42b.webp?1704576976.478,krupa-zelyenaya-grechka-paketiki-42818.html
https://vkusvill.ru/goods/bulgur-paketiki-400-g-85404.html,"Булгур (пакетики), 400 г",0.27,0.036390101892285295,400.0,108.0,343.5,12.5,1.5,70.0,крупа пшеничная булгур.,"Сытная и полезная крупа из термически обработанной пшеницы, которая станет питательным гарниром, подойдёт для приготовления необычного плова и вкусной каши. Необычный вкус булгура с ореховыми нотками замечательно сочетается с овощами, мясом и молочными продуктами. А пакетики сделают готовку ещё проще, ведь булгур не придётся постоянно помешивать.",0,2025-06-13 11:20:23,"Крупы, макароны, мука#Крупы",5,3238,https://img.vkusvill.ru/pim/images/site_LargeWebP/d00e80f1-1c86-405b-b078-aa178e7c4e62.webp?1714333423.5677,bulgur-paketiki-400-g-85404.html
https://vkusvill.ru/goods/vermishel-tonkaya-73867.html,Вермишель тонкая,0.17333333333333334,0.036101083032490974,450.0,78.0,332.4,12.0,1.0,67.0,"мука из твердых сортов пшеницы (дурум), вода питьевая.Товар от производителейДанный товар поставляют несколько производителей, внешний вид и характеристики могут незначительно отличаться. Актуальные данные указаны на этикетке. Цена может отличаться в зависимости от региона или формата точки продажи (вендинг, микромаркет).Информация на этикетке может незначительно отличаться","Тонкая лапша из твёрдых сортов пшеницы, которая не слипается при варке. Лучше всего она подойдёт для приготовления наваристых супчиков, но её также можно подать на гарнир или обжарить с овощами и пряным соусом, чтобы получилось полноценное основное блюдо.",0,2025-06-13 11:20:18,"Крупы, макароны, мука#Макароны",4.9,13554,https://img.vkusvill.ru/pim/images/site_LargeWebP/c008b26c-ffec-42d0-8c40-4f96301359a1.webp?1707731618.8837,vermishel-tonkaya-73867.html
https://vkusvill.ru/goods/krupa-grechnevaya-yadritsa-900-g-17699.html,"Крупа гречневая ядрица, 900 г",0.08555555555555555,0.03577817531305904,900.0,77.0,335.4,12.0,3.4,64.2,"крупа гречневая ядрица быстроразваривающаяся (пропаренная) высший сорт. Возможно содержание остаточного количества глютена.Товар от производителейДанный товар поставляют несколько производителей, внешний вид и характеристики могут незначительно отличаться. Актуальные данные указаны на этикетке. Цена может отличаться в зависимости от региона или формата точки продажи (вендинг, микромаркет).Информация на этикетке может незначительно отличаться","Гречка отличается высоким содержанием белка и трудноусваиваемых углеводов, поэтому она идеально подходит для здоровых рационов. Из неё можно сварить питательную молочную кашу или сытный гарнир. А если добавить в гречку морковно-луковую зажарку и мясо или фарш, получится полноценный обед или ужин. Эта крупа быстро разваривается: для доведения её до готовности достаточно всего 10 минут. Выращена на Алтае.",0,2025-06-13 11:20:31,"Крупы, макароны, мука#Крупы",4.9,41271,https://img.vkusvill.ru/pim/images/site_LargeWebP/3c1c0559-befb-49b7-87a5-80edf083c7d8.webp?1731893398.2875,krupa-grechnevaya-yadritsa-900-g-17699.html
https://vkusvill.ru/goods/lapsha-lagmannaya-270gr-38859.html,Лапша лагманная 270гр,0.5555555555555556,0.0356638418079096,270.0,150.0,283.2,10.1,3.2,52.6,"мука пшеничная хлебопекарная высший сорт, яйца куриные пищевые, соль поваренная пищевая, краситель пищевой бета-каротин 0,3 % в растительном масле (масло рапсовое рафинированное дезодорированное в/с, краситель (Е160а).Товар от производителейАктуальные данные указаны на этикетке. Цена может отличаться в зависимости от региона или формата точки продажи (вендинг, микромаркет).Информация на этикетке может незначительно отличаться","Традиционная яичная лапша, созданная для приготовления восточных блюд. Она быстро варится, и потому замечательно подходит для приготовления блюд на скорую руку. Эта лапша подойдёт как для лагмана, так и для добавления в суп, подачи на гарнир и в качестве самостоятельного блюда. Время варки: 11 минут.",0,2025-06-13 11:20:14,"Крупы, макароны, мука#Макароны",4.8,174,https://img.vkusvill.ru/pim/images/site_LargeWebP/ed58516a-6679-4a6b-aaba-9e43cd0ea048.webp?1737283041.9353,lapsha-lagmannaya-270gr-38859.html
