url,name,pri/we,pro/cal,weight,price,calories,proteins,fats,carbohydrates,content,description,availability,last_upd_time,category,average_rating,rating_count,imgUrl,html_path
https://vkusvill.ru/goods/sukhariki-pshenichnye-15697.html,Сухарики пшеничные,0.85,0.03194444444444444,100.0,85.0,360.0,11.5,2.0,74.0,"хлеб пшеничный (мука пшеничная хлебопекарная высшего сорта, вода питьевая, сахар, дрожжи хлебопекарные прессованные, молоко сухое цельное, масло подсолнечное рафинированное дезодорированное, соль пищевая) Продукция производится на предприятии, где используются аллергены: арахис, горчица, кунжут, ракообразные, рыба, орехи, сельдерей, соя, яйца.Товар от производителейАктуальные данные указаны на этикетке. Цена может отличаться в зависимости от региона или формата точки продажи (вендинг, микромаркет).Информация на этикетке может незначительно отличаться","Классические сухарики без добавок, которыми приятно похрустеть на перерыве. А ещё они идеально дополнят любимые блюда: салаты и крем-супы.",0,2025-06-13 10:50:39,Хлеб и выпечка#Сухарики и гренки,4.9,7797,https://img.vkusvill.ru/pim/images/site_LargeWebP/59b0f437-709d-414b-88fa-0755a0378a79.webp?1732089282.5628,sukhariki-pshenichnye-15697.html
https://vkusvill.ru/goods/sushka-tselnozernovaya-s-konoplyanoy-mukoy-21710.html,Сушка цельнозерновая с конопляной мукой,0.44,0.031865284974093265,150.0,66.0,386.0,12.3,7.1,68.3,"мука пшеничная цельнозерновая, мука конопляная, закваска пшеничная (мука пшеничная 1 сорта, вода питьевая), масло кукурузное рафинированное дезодорированное, соль морская пищевая.Товар от производителейАктуальные данные указаны на этикетке. Цена может отличаться в зависимости от региона или формата точки продажи (вендинг, микромаркет).Информация на этикетке может незначительно отличаться","Эти сушки станут прекрасной альтернативой классическим, особенно для тех, кто стремится получить от рациона максимум пользы. Вместо обычной пшеничной муки здесь мы используем цельнозерновую, комбинируя её с конопляной. Получаются хрустящие сушки с воздушной текстурой и нейтрально-солоноватым вкусом — идеальный снек и дополнение к уютному чаепитию.",0,2025-06-13 10:51:02,"Хлеб и выпечка#Сушки, баранки и сухари",4.9,3500,https://img.vkusvill.ru/pim/images/site_LargeWebP/9767af45-2f93-46e3-b8e2-623f169fe79d.webp?1742279372.7114,sushka-tselnozernovaya-s-konoplyanoy-mukoy-21710.html
https://vkusvill.ru/goods/khleb-domashniy-spb-47296.html,"Хлеб «Домашний», СПБ",0.25666666666666665,0.031746031746031744,300.0,77.0,189.0,6.0,1.0,39.0,"мука пшеничная хлебопекарная второго сорта, мука ржаная хлебопекарная обдирная, вода питьевая, густая ржаная закваска (лактобактерии (lactobacillus brevis), ржаная мука обдирная, вода питьевая), солод ржаной ферментированный, патока крахмальная высокоосахаренная, картофельные хлопья (картофель свежий), соль пищевая, кориандр молотый, хмель гранулированный. Продукция производится на предприятии, где используются аллергены: арахис, горчица, кунжут, молоко (лактоза), яйца.Товар от производителейАктуальные данные указаны на этикетке. Цена может отличаться в зависимости от региона или формата точки продажи (вендинг, микромаркет).Информация на этикетке может незначительно отличаться","Нарезанный хлеб на ржаной закваске, испечённый из пшеничной и ржаной муки. Обладает насыщенным вкусом с нотами терпкого солода, сладковатой патоки и пряного кориандра. Такой хлеб прекрасно подойдёт для приготовления лёгких закусок, например, канапе со слабосолёным лососем и творожным сыром.",0,2025-06-13 10:51:06,Хлеб и выпечка#Хлеб на закваске,4.8,178,https://img.vkusvill.ru/pim/images/site_LargeWebP/3ab493d3-e56a-4a00-9abc-af8d0789fc5d.webp?1717512729.1404,khleb-domashniy-spb-47296.html
https://vkusvill.ru/goods/khleb-zernovoy-podovyy-narezka-80646.html,"Хлеб зерновой подовый, нарезка",0.2866666666666667,0.03172504957038995,300.0,86.0,302.6,9.6,5.0,54.8,"мука пшеничная хлебопекарная высшего сорта, вода питьевая, семена льна, семена кунжута, ядро подсолнечника, хлопья овсяные, крупа манная, мед натуральный цветочный, соль пищевая. Продукция производится на предприятии, где используются аллергены: арахис, молоко (лактоза), орехи, яйца.Товар от производителейАктуальные данные указаны на этикетке. Цена может отличаться в зависимости от региона или формата точки продажи (вендинг, микромаркет).Информация на этикетке может незначительно отличаться","Пышный бездрожжевой хлеб из печи, заботливо выпеченный из пшенично муки с добавлением семян льна, кунжута и подсолнечника. Обладает плотным мякишем и ярким вкусом с едва уловимой медовой сладостью и тонкими ореховыми нотками. Замечательно подходит для приготовления сытных бутербродов, а также подачи с супами и основными блюдами. Местный товар - продукт от местного производителя, доступный только в вашем регионе.",0,2025-06-13 10:50:57,Хлеб и выпечка#Хлеб на закваске,4.9,173,https://img.vkusvill.ru/pim/images/site_LargeWebP/7acac82c-edf4-4ab0-803f-685d453a7ff7.webp?1711749260.6276,khleb-zernovoy-podovyy-narezka-80646.html
https://vkusvill.ru/goods/khleb-tselnozernovoy-s-otrubyami-58728.html,Хлеб цельнозерновой с отрубями,0.301,0.031618887015177066,1000.0,301.0,237.2,7.5,1.0,47.8,"мука пшеничная хлебопекарная первого сорта, закваска (мука пшеничная цельнозерновая, вода питьевая), мука ржаная цельнозерновая, вода питьевая, отруби овсяные, хлопья овсяные, отруби пшеничные, соль пищеваяТовар от производителейАктуальные данные указаны на этикетке. Цена может отличаться в зависимости от региона или формата точки продажи (вендинг, микромаркет).Информация на этикетке может незначительно отличаться","Этот ароматный хлеб приготовлен из двух видов муки: пшеничной первого сорта и ржаной цельнозерновой, которая считается особенно полезной. Для большей пользы и вкуса хлеб дополнен овсяными и пшеничными отрубями, а также овсяными хлопьями. А за правильную структуру выпечки отвечает закваска. В составе нет добавленного сахара, дрожжей и разрыхлителей. Выпекается в пекарне Толгского монастыря.",0,2025-06-13 10:50:58,Хлеб и выпечка#Хлеб на закваске,4.9,26935,https://img.vkusvill.ru/pim/images/site_LargeWebP/0fbe470f-2699-48a5-b805-7a574b667e6d.webp?1714726031.5738,khleb-tselnozernovoy-s-otrubyami-58728.html
https://vkusvill.ru/goods/khleb-borodinskiy-350g-95849.html,Хлеб «Бородинский» 350г,0.26285714285714284,0.03160493827160494,350.0,92.0,202.5,6.4,0.9,42.2,"мука ржаная хлебопекарная обдирная, вода питьевая, мука хлебопекарная пшеничная первого сорта, солод ржаной ферментированный, сахар белый, соль пищевая, масло подсолнечное рафинированное дезодорированное, дрожжи хлебопекарные прессованные, семена кориандра. Продукция производится на предприятии, где используются аллергены: арахис, кунжут, молоко (лактоза), яйца.","Традиционный хлеб, выпеченный на основе ржаной обдирной муки с добавлением душистого кориандра. Ароматный и терпкий, он прекрасно подчеркнёт вкус наваристого борща и домашних солений. А если натереть ломтик хлеба чесночком и подать с салом, эта быстрая закуска разлетится в считанные минуты!",0,2025-06-13 10:50:59,Хлеб и выпечка#Хлеб чёрный и серый,4.8,1377,https://img.vkusvill.ru/pim/images/site_LargeWebP/e5ab797d-9970-449a-8f35-c7c1724f1c60.webp?1735251316.993,khleb-borodinskiy-350g-95849.html
https://vkusvill.ru/goods/tartin-pshenichno-rzhanoy-pekarnya-25509.html,Тартин пшенично-ржаной. Пекарня,0.2647058823529412,0.0315994166261546,510.0,135.0,205.7,6.5,2.1,40.2,"Вода питьевая, мука пшеничная хлебопекарная высшего сорта, мука пшеничная хлебопекарная первого сорта, мука ржаная хлебопекарная обдирная, мука пшеничная цельнозерновая, соль пищевая, масло подсолнечное рафинированное дезодорированное, дрожжи хлебопекарные прессованные. Продукция производится на предприятии, где используются кунжут, арахис, миндаль, молоко(лактоза), яйца.Товар от производителейДанный товар поставляют несколько производителей, внешний вид и характеристики могут незначительно отличаться. Актуальные данные указаны на этикетке. Цена может отличаться в зависимости от региона или формата точки продажи (вендинг, микромаркет).Информация на этикетке может незначительно отличаться","Пышный дрожжевой хлеб, выпеченный из шугуровской, цельнозерновой и обдирной ржаной муки. Отличается плотным, но воздушным мякишем, румяной корочкой и насыщенным вкусом с едва уловимой кислинкой. Превосходно сочетается с первыми блюдами, мясом и разнообразными паштетами.",0,2025-06-13 10:50:42,Хлеб и выпечка#Хлеб и выпечка из нашей пекарни#Хлеб,4.9,3340,https://img.vkusvill.ru/pim/images/site_LargeWebP/484156c0-c734-4593-a0eb-7defffe75e1d.webp?1719090309.6512,tartin-pshenichno-rzhanoy-pekarnya-25509.html
https://vkusvill.ru/goods/khleb-tostovyy-zernovoy-280-gr-80642.html,"Хлеб тостовый зерновой, 280 гр",0.3142857142857143,0.031578947368421054,280.0,88.0,294.5,9.3,5.3,52.4,"мука пшеничная хлебопекарная высшего сорта, вода питьевая, ядро подсолнечника, семена кунжута, семена льна, хлопья овсяные, патока крахмальная карамельная, соль пищевая, дрожжи прессованные хлебопекарные, солод ржаной сухой неферментированный. Продукция производится на предприятии, где используются аллергены: арахис, молоко (лактоза), орехи, яйца.Товар от производителейАктуальные данные указаны на этикетке. Цена может отличаться в зависимости от региона или формата точки продажи (вендинг, микромаркет).Информация на этикетке может незначительно отличаться","Пшеничный дрожжевой хлеб с семенами льна, подсолнечника и кунжута. Выпечен с добавлением крахмальной патоки и терпкого ржаного солода. Этот хлеб обладает сбалансированным вкусом с тонкими ореховыми нотами и воздушным мякишем. Готовая нарезка сделает процесс приготовления бутербродов быстрее, а ещё её удобно взять с собой на пикник или на дачу. Местный товар - продукт от местного производителя, доступный только в вашем регионе.",0,2025-06-13 10:50:52,Хлеб и выпечка#Хлеб на закваске,4.9,532,https://img.vkusvill.ru/pim/images/site_LargeWebP/5621ea1b-b927-438a-9df6-286c87d06102.webp?1711749141.6936,khleb-tostovyy-zernovoy-280-gr-80642.html
https://vkusvill.ru/goods/pirozhnoe-proteinovoe-molochnoe-61662.html,Пирожное протеиновое молочное,3.28,0.03155339805825243,50.0,164.0,412.0,13.0,26.0,17.0,"протеиновый комплекс (белок яичный, концентрат молочного белка); стружка кокосовая; подсластители: изомальт, эритрит; масло кокосовое; изомальтоолигосахариды (пребиотик); масло растительное; вода питьевая; мука пшеничная; молоко сухое обезжиренное; желток яичный; мука миндальная; загустители: полидекстроза, крахмал модифицированный, каррагинан; влагоудерживающий агент глицерин; эмульгатор лецитин соевый; разрыхлитель гидрокарбонат натрия (сода пищевая); соль; ароматизаторы натуральные; консервант сорбат калия Продукция производится на предприятии, где используются аллергены: арахис. Содержит подсластители (сахарозаменители). При чрезмерном употреблении могут оказывать слабительное действие.Товар от производителейАктуальные данные указаны на этикетке. Цена может отличаться в зависимости от региона или формата точки продажи (вендинг, микромаркет).Информация на этикетке может незначительно отличаться","Вкусное пирожное-энергетик с протеиновым комплексом. Испечено из миндальной муки и кокосового масла, с добавлением яичного белка и сытного концентрата молочного белка. Нежное лакомство без добавленного сахара. Дарит бодрость и приятное чувство сытости. Отличный компаньон в занятиях спортом, походах, путешествиях и просто прогулках. Такое пирожное можно съесть как здоровый перекус, или как десерт, с чаем или кофе.",0,2025-06-13 10:51:00,Сладости и десерты#Пирожные и десерты,4.9,533,https://img.vkusvill.ru/pim/images/site_LargeWebP/eca8b758-6d40-46ef-8b96-75777723a599.webp?1707860244.4815,pirozhnoe-proteinovoe-molochnoe-61662.html
https://vkusvill.ru/goods/pita-arabskaya-150-g-83295.html,"Пита «Арабская», 150 г",0.3933333333333333,0.03145478374836173,150.0,59.0,228.9,7.2,0.9,48.0,"мука пшеничная хлебопекарная высшего сорта, вода питьевая, сахар, соль пищевая, дрожжи хлебопекарные сухие.","Традиционный ближневосточный плоский хлеб. выпеченный на дрожжах из пшеничной муки. Пита выпекается так, чтобы она расслоилась и внутри образовался «кармашек». Эти тонкие ароматные лепёшки можно начинить сыром, овощами, митболами или куриным филе. Запечь в духовке, на гриле или углях. Подавать с хумусом и самыми разными соусами. А ещё из питы можно приготовить чесночные чипсы с пряными травами и подавать к супам.",0,2025-06-13 10:50:38,"Хлеб и выпечка#Лаваши, питы и хлеб для сэндвичей",4.9,179,https://img.vkusvill.ru/pim/images/site_LargeWebP/29b78de3-cb8c-4a6c-a81d-7f9fab0c5fea.webp?1703871554.5742,pita-arabskaya-150-g-83295.html
https://vkusvill.ru/goods/pita-arabskaya-300-g-83296.html,Пита «Арабская» 300 г,0.31666666666666665,0.03145478374836173,300.0,95.0,228.9,7.2,0.9,48.0,"мука пшеничная хлебопекарная высшего сорта, вода питьевая, сахар, соль пищевая, дрожжи хлебопекарные сухие.","Традиционный ближневосточный плоский хлеб. выпеченный на дрожжах из пшеничной муки. Пита выпекается так, чтобы она расслоилась и внутри образовался «кармашек». Эти тонкие ароматные лепёшки можно начинить сыром, овощами, митболами или куриным филе. Запечь в духовке, на гриле или углях. Подавать с хумусом и самыми разными соусами. А ещё из питы можно приготовить чесночные чипсы с пряными травами и подавать к супам.",0,2025-06-13 10:50:46,"Хлеб и выпечка#Лаваши, питы и хлеб для сэндвичей",4.9,311,https://img.vkusvill.ru/pim/images/site_LargeWebP/a5faa07b-0f00-4e85-9503-0b13edd246c9.webp?1703871619.0999,pita-arabskaya-300-g-83296.html
https://vkusvill.ru/goods/keksy-madlen-s-limonom-100g-95392.html,"Кексы «Мадлен» с лимоном, 100г",1.7,0.03140293637846656,100.0,170.0,245.2,7.7,3.2,46.4,"Сахар, яйцо куриное пищевое, мука пшеничная хлебопекарная высшего сорта, масло сливочное м.д.ж. 82,5% (сливки пастеризованные), мёд натуральный цветочный, разрыхлитель - гидрокарбонат натрия (сода пищевая), цедра лимона.",Нежные кексы с лёгким ароматом лимонной цедры и золотистой корочкой. Воздушная текстура сочетается с едва заметной хрустящей кромкой по краям. Сливочное масло и цветочный мёд придают выпечке деликатную сладость без приторности. Лимонная нотка звучит свежо и ненавязчиво. Вкус напоминает простую и уютную домашнюю выпечку.,0,2025-06-13 10:50:51,Хлеб и выпечка#Кексы,4.8,791,https://img.vkusvill.ru/pim/images/site/site_LargeWebP/c55e024c-a8ca-47a6-8651-95a0deb9bd2c.webp,keksy-madlen-s-limonom-100g-95392.html
https://vkusvill.ru/goods/khleb-polbyanoy-s-semenami-lna-97567.html,Хлеб «Полбяной» с семенами льна,0.408,0.03132197144173192,250.0,102.0,217.1,6.8,2.3,42.3,"мука пшеничная хлебопекарная первого сорта, закваска пшеничная (мука пшеничная хлебопекарная первого сорта, вода питьевая), мука ржаная хлебопекарная обдирная, вода питьевая, семена льна, мука пшеничная цельнозерновая, мука полбяная, патока крахмальная карамельная, соль пищевая. Продукция производится на предприятии, где используются аллергены: кунжут, молоко (лактоза), орехи, яйца.","Бездрожжевой хлеб из пшеничной, ржаной и полбяной муки, выпеченный на закваске с добавлением семян льна. Он обладает сбалансированным вкусом с ненавязчивыми злаковыми и сладковатыми нотками. Прекрасно подходит для подачи с основными блюдами и приготовления тёплых закусок, например, сытных тостов.",0,2025-06-13 10:50:56,Хлеб и выпечка#Хлеб на закваске,4.9,233,https://img.vkusvill.ru/pim/images/site_LargeWebP/14cbcc53-db29-4e42-8495-fe92ad765a1a.webp?1730930592.6065,khleb-polbyanoy-s-semenami-lna-97567.html
