url,name,pri/we,pro/cal,weight,price,calories,proteins,fats,carbohydrates,content,description,availability,last_upd_time,category,average_rating,rating_count,imgUrl,html_path
https://vkusvill.ru/goods/ulitka-mindalnaya-s-vishney-pekarnya-57962.html,Улитка миндальная с вишней. Пекарня,1.4461538461538461,0.017651052274270197,130.0,188.0,294.6,5.2,18.6,26.6,"Мука пшеничная хлебопекарная в/с, масло сладко-сливочное несоленое м.д.ж.82,5% (сливки пастеризованные), вода питьевая, молоко питьевое  м.д.ж.3,2 %, сахар, миндальная мука, миндальные лепестки, яйцо куриное пищевое, вишня  замороженная , дрожжи прессованные хлебопекарные, соль пищевая.Товар от производителейАктуальные данные указаны на этикетке. Цена может отличаться в зависимости от региона или формата точки продажи (вендинг, микромаркет).Информация на этикетке может незначительно отличаться","Изысканное сочетание слоёного теста, ягод вишни и миндальных лепестков. Улитка отлично подойдёт для лёгкого завтрака и сладкого перекуса. А если подержать её несколько секунд в микроволновке перед употреблением, вкус станет ещё насыщеннее.",0,2025-06-13 10:50:46,Хлеб и выпечка#Хлеб и выпечка из нашей пекарни#Сладкая выпечка,4.9,2449,https://img.vkusvill.ru/pim/images/site_LargeWebP/adf44b09-b941-4a63-9e7f-4ca63bd3c253.webp?1719090793.93,ulitka-mindalnaya-s-vishney-pekarnya-57962.html
https://vkusvill.ru/goods/kruassan-chernyy-s-zavarnym-kremom-106770.html,Круассан черный с заварным кремом,2.0842105263157893,0.01747311827956989,95.0,198.0,372.0,6.5,22.0,37.0,"Мука пшеничная хлебопекарная высший сорт, масло сладко-сливочное несоленое м.д.ж. 82,5%, молоко питьевое ультрапастеризованное м.д.ж. 3,2%, вода питьевая, сливки питьевые ультрапастеризованные м.д.ж. 33%, сахар, белая шоколадная масса (сахар, масло какао, сухое цельное молоко, сухое обезжиренное молоко, молочный жир, эмульгатор - лецитины (соевый), натуральный ароматизатор - ваниль), молоко цельное сгущенное с сахаром м.д.ж. 8,5% (молоко нормализованное, сахар (сахароза), сахар молочный пищевой (лактоза)), сливки питьевые ультрапастеризованные м.д.ж. 20%, дрожжи хлебопекарные прессованные, патока крахмальная карамельная кислотная, тримолин (кристаллизованный инвертный сахарный сироп), желток яичный пастеризованный жидкий, масло сладко-сливочное несоленое м.д.ж. 72,5%, соль пищевая, молоко сухое цельное м.д.ж. 26%, желатин пищевой (говяжий), краситель - растительный уголь.  Продукция производится на предприятии, где используются аллергены: арахис, кунжут, орехи.","Круассан с заварным кремом — фантазия на тему классики, только в неожиданном исполнении. Тесто нежное, с тонкими золотистыми слоями, а внутри — мягкий заварной крем с белым шоколадом и лёгкой сливочной ноткой. Сладость сбалансированная, вкус — деликатный и запоминающийся. Это не просто десерт, а кулинарный эксперимент, в котором всё получилось. Глубокий чёрный цвет теста достигается за счёт растительного угля — он не влияет на вкус, но придаёт эффектности.",0,2025-06-13 10:50:46,Хлеб и выпечка#Круассаны,4.7,331,https://img.vkusvill.ru/pim/images/site/site_LargeWebP/e8124b8a-cf47-4cd5-8776-866bf50b8c99.webp,kruassan-chernyy-s-zavarnym-kremom-106770.html
https://vkusvill.ru/goods/vertuta-s-kartofelem-i-gribami-postnaya-108520.html,Вертута с картофелем и грибами (постная),0.88,0.01743745261561789,200.0,176.0,263.8,4.6,13.8,30.3,"Тесто (мука пшеничная хлебопекарная высшего сорта, вода питьевая, масло подсолнечное рафинированное дезодорированное, сахар, соль пищевая, дрожжи хлебопекарные сухие), начинка (картофель отварной, грибы шампиньоны жареные (грибы шампиньоны свежие, масло подсолнечное рафинированное дезодорированное), лук репчатый жареный (лук репчатый свежий, масло подсолнечное рафинированное дезодорированное), соль пищевая, перец чёрный молотый), семена кунжута светлого.  Продукция производится на предприятии, где используются аллергены: молоко (лактоза), яйца.","Постная молдавская выпечка из тонкого вытяжного теста с молодым картофелем и обжаренными шампиньонами. Нежная, со сбалансированным вкусом и большим количеством начинки, она идеально подойдёт для плотных завтраков и перекусов.",0,2025-06-13 10:50:51,"Готовая еда#Пироги, пирожки и лепёшки",4.7,4365,https://img.vkusvill.ru/pim/images/site_LargeWebP/1e1d0c19-98ee-4c5d-8c0c-173e4077fe68.webp?1741702327.0751,vertuta-s-kartofelem-i-gribami-postnaya-108520.html
https://vkusvill.ru/goods/shokoladnyy-kruassan-pekarnya-101567.html,Шоколадный круассан. Пекарня,2.953846153846154,0.017435897435897435,65.0,192.0,390.0,6.8,20.8,43.9,"тесто (мука пшеничная хлебопекарная высшего сорта, вода питьевая, молоко питьевое м.д.ж. 3.2%, масло сладко-сливочное несоленое м.д.ж. 82%), начинка (сливки питьевые м.д.ж. 33%, шоколад темный  (сахар, масло какао, сухое цельное молоко, какао тертое, эмульгатор-лецитины (соевый), натуральный ароматизатор - ваниль), шоколад молочный (сахар, масло какао, сухое цельное молоко, какао тертое, эмульгатор - лецитины (соевый), натуральный ароматизатор - ваниль), масло какао, масло сладко-сливочное несолёное  «Крестьянское» м.д.ж. 72,5% ), сахар, какао-порошок, меланж яичный пастеризованный, дрожжи прессованные хлебопекарные, соль пищевая).  Продукция производится на предприятии, где используются аллергены: арахис, кунжут, орехи.","Как и все наши круассаны, этот приготовлен на сливочном масле. Поэтому он такой воздушный, пористый и нежный по вкусу. А ещё он вдвойне шоколадный: мы добавили в тесто ароматное какао, а в начинку — лёгкий и текучий шоколадный крем.",0,2025-06-13 10:51:05,Хлеб и выпечка#Хлеб и выпечка из нашей пекарни#Сладкая выпечка,4.8,880,https://img.vkusvill.ru/pim/images/site_LargeWebP/7d07b3f9-694e-4a37-aa8d-30286e6333dc.webp?1727295958.0588,shokoladnyy-kruassan-pekarnya-101567.html
https://vkusvill.ru/goods/batard-chesnochnyy-pekarnya-71676.html,"Батард чесночный, пекарня",0.89,0.017432208079690096,200.0,178.0,361.4,6.3,16.6,46.7,"Мука пшеничная хлебопекарная высшего сорта, вода питьевая, закваска пшеничная (вода питьевая, мука пшеничная хлебопекарная высшего сорта), молоко питьевое ультрапастеризованное м.д.ж. 3,2%, мука пшеничная цельнозерновая, масло сладко-сливочное несоленое м.д.ж. 82,5%, чеснок свежий, патока крахмальная карамельная кислотная, петрушка свежая (зелень), укроп свежий (зелень), дрожжи прессованные хлебопекарные, соль пищеваяТовар от производителейАктуальные данные указаны на этикетке. Цена может отличаться в зависимости от региона или формата точки продажи (вендинг, микромаркет).Информация на этикетке может незначительно отличаться","Воздушный пшеничный хлеб, начинённый сливочным маслом с чесноком и свежей зеленью. Батард отличается насыщенной пикантностью — она выражена сильнее, чем у чесночного багета из нашей пекарни. Идеально дополнит первые блюда и станет аппетитной основой для сытных бутербродов.",0,2025-06-13 10:50:58,Хлеб и выпечка#Хлеб и выпечка из нашей пекарни#Хлеб,4.7,1321,https://img.vkusvill.ru/pim/images/site_LargeWebP/f4f93c8d-5540-41c8-9ca1-1dcf837df496.webp?1716798448.1394,batard-chesnochnyy-pekarnya-71676.html
https://vkusvill.ru/goods/keks-apelsinovyy-s-morkovyu-86656.html,Кекс «Апельсиновый» с морковью,0.78,0.017014270032930847,250.0,195.0,364.4,6.2,19.2,41.7,"меланж яичный сухой, сахар, мука пшеничная хлебопекарная высшего сорта, масло подсолнечное рафинированное дезодорированное, вода питьевая, морковь столовая сушеная, молоко сухое цельное, соль пищевая, разрыхлитель - гидрокарбонат натрия (сода пищевая), цедра апельсина сушеная молотая. Продукция производится на предприятии, где используются аллергены: арахис, кунжут, орехи.","Аппетитно румяный кекс, выпеченный с добавлением моркови и апельсиновой цедры. У него нежный, словно тающий во рту бисквит и выразительный вкус, в котором деликатная сладость переплетается с пряными цитрусовыми нотами. Такое лакомство станет идеальным дополнением уютного чаепития и особенно понравится ценителям домашней выпечки.",0,2025-06-13 10:51:06,Хлеб и выпечка#Кексы,4.8,2227,https://img.vkusvill.ru/pim/images/site_LargeWebP/97917e05-e670-432e-ad71-391ef822e69f.webp?1723493797.6047,keks-apelsinovyy-s-morkovyu-86656.html
https://vkusvill.ru/goods/kruassan-s-vishney-vegan-90852.html,"Круассан с вишней, веган",1.7625,0.017012063099288585,80.0,141.0,323.3,5.5,5.7,62.5,"Мука пшеничная хлебопекарная в/с, масло подсолнечное рафинированное дезодорированное, вода питьевая, дрожжи сухие хлебопекарные, сахар, соль пищевая; начинка: вишня быстрозамороженная, вода питьевая, сахар, кукурузный крахмал. Продукция производится на предприятии, где используются аллергены: диоксид серы (сульфиты).","ВкусВилл очень любит своих покупателей! А ещё — удивлять. И в этом десерте нам удалось соединить две своих страсти. Круассан имеет упругую многослойную текстуру, совсем как классический. И не имеет в составе ингредиентов животного происхождения — идеальное веганское комбо. Проверено: нежный, ароматный, с густой начинкой из спелой вишни, он станет прекрасным началом дня.",0,2025-06-13 10:51:04,"Вегетарианское и постное#Растительное и с содержанием рыбы, яиц и молока#Хлеб и мучное",4.8,1218,https://img.vkusvill.ru/pim/images/site_LargeWebP/5dc904cf-08c2-4e23-837c-7c5442708f37.webp?1716761908.1875,kruassan-s-vishney-vegan-90852.html
https://vkusvill.ru/goods/kruassan-chernyy-s-malinoy-i-zavarnym-kremom-106784.html,Круассан черный с малиной и заварным кремом,2.294736842105263,0.016901408450704224,95.0,218.0,355.0,6.0,19.0,40.0,"мука пшеничная хлебопекарная высший сорт, масло сладко-сливочное несоленое м.д.ж. 82,5%, молоко питьевое ультрапастеризованное м.д.ж. 3,2%, пюре малины замороженное (малина, сахар), вода питьевая, сахар, сливки питьевые ультрапастеризованные м.д.ж. 33%, дрожжи хлебопекарные прессованные, молоко цельное сгущенное с сахаром м.д.ж. 8,5% (молоко нормализованное, сахар (сахароза), сахар молочный пищевой (лактоза)), патока крахмальная карамельная кислотная, сливки питьевые ультрапастеризованные м.д.ж. 20%, тримолин кристаллизованный инвертный сахарный сироп), малина сублимационной сушки, соль пищевая, желток яичный пастеризованный жидкий, масло сладко-сливочное несоленое м.д.ж. 72,5%, комплексная пищевая добавка (желирующий агент - пектины (яблочный), глюкоза), молоко сухое цельное м.д.ж. 26%,краситель - растительный уголь, желатин пищевой (говяжий) Продукция производится на предприятии, где используются аллергены: арахис, кунжут, орехи, соя.","Изысканный чёрный круассан с нежной малиновой начинкой и воздушным заварным кремом. Кусочки сублимированных ягод в декоре добавляют интересную текстуру тёмному слоёному тесту, а малиновое пюре даёт насыщенный фруктовый вкус. Круассан особенно хорош слегка подогретым — так крем становится ещё более нежным, а малина раскрывает свой аромат.",0,2025-06-13 10:50:57,Хлеб и выпечка#Круассаны,4.7,1070,https://img.vkusvill.ru/pim/images/site_LargeWebP/7c3d269e-1119-461e-8353-e604eb5d152f.webp?1748385024.9391,kruassan-chernyy-s-malinoy-i-zavarnym-kremom-106784.html
https://vkusvill.ru/goods/kovrizhka-yablochnaya-postnaya-kafe-29461.html,"Коврижка яблочная постная, кафе",1.6363636363636365,0.01661631419939577,110.0,180.0,264.8,4.4,4.0,52.8,"мука пшеничная высшего сорта, яблоки свежие, сахар, сок апельсиновый, абрикос сушеный (курага), масло подсолнечное рафинированное дезодорированное, виноград сушеный (изюм), ядра грецкого ореха, клюква быстрозамороженная, смородина черная быстрозамороженная, смородина красная быстрозамороженная, уксус яблочный, разрыхлитель гидрокарбонат натрия (сода пищевая), цедра свежего лимона, корица молотая. Продукция производится на предприятии, где используются кунжут, сельдерей, горчица, орехи, рыба, соя.Товар от производителейАктуальные данные указаны на этикетке. Цена может отличаться в зависимости от региона или формата точки продажи (вендинг, микромаркет).Информация на этикетке может незначительно отличаться","Ароматная коврижка с аппетитным орехово-фруктовым вкусом. Испечена из пшеничной муки и спелых сладких яблок. Сдобрена грецкими орешками, курагой, изюмом и апельсиновым соком. Терпкая клюква и черная смородина добавляют во вкус приятную кислинку. Сытный десерт и полезный перекус. К чаю, кофе или тёплому молоку. Такая коврижка особенно вкусна с творожным сыром, взбитыми сливками или шариком пломбира.Товар доступен с доставкой и в магазинах с зоной кафе.",3,2025-06-13 10:50:39,Особое питание#Продукты без лактозы#Готовая еда без лактозы#Сэндвичи и пирожки,4.7,7958,https://img.vkusvill.ru/pim/images/site_for_feed/263c1ba2-c59e-4b77-955c-45938002830f.jpg?1728731500.201,kovrizhka-yablochnaya-postnaya-kafe-29461.html
https://vkusvill.ru/goods/kruassan-tselnozernovoy-pekarnya-68348.html,Круассан цельнозерновой. Пекарня,2.3636363636363638,0.016397642838841917,55.0,130.0,390.3,6.4,24.7,35.6,"Мука пшеничная хлебопекарная высшего сорта, мука пшеничная цельнозерновая, молоко ультрапастеризованное м.д.ж. 3,2%, масло сливочное м.д.ж. 82,5%, семена подсолнечника, семена льна, семена кунжута, мак пищевой, солодовый экстракт (ячменный солод, вода питьевая), сахар, дрожжи прессованные хлебопекарные, соль пищевая, меланж яичный пастеризованный.  Продукция производится на предприятии, где используются кунжут, арахис, миндаль, молоко(лактоза), яйца. Продукт готов к употреблению.Товар от производителейДанный товар поставляют несколько производителей, внешний вид и характеристики могут незначительно отличаться. Актуальные данные указаны на этикетке. Цена может отличаться в зависимости от региона или формата точки продажи (вендинг, микромаркет).Информация на этикетке может незначительно отличаться","Пышный франццузский рогалик с тонкой хрустящей корочкой, выпеченный с добавлением пшеничных отрубей и ферментированного ржаного солода. Круассан хорош как сам по себе, так и в сочетании с различными начинками: омлетом, авокадо, слабосолёным лососем и сливочной моцареллой.",0,2025-06-13 10:50:43,Хлеб и выпечка#Хлеб и выпечка из нашей пекарни#Сладкая выпечка,4.9,3690,https://img.vkusvill.ru/pim/images/site_LargeWebP/26509f62-ef99-464c-86dd-81d1ff79fd64.webp?1713541525.6224,kruassan-tselnozernovoy-pekarnya-68348.html
https://vkusvill.ru/goods/bulochka-s-kardamonom-i-koritsey-kafe-106066.html,"Булочка с кардамоном и корицей, кафе",1.7333333333333334,0.01628864173745512,90.0,156.0,342.57,5.58,14.17,48.18,"мука пшеничная хлебопекарная высшего сорта, молоко ультрапастеризованное м.д.ж. 3,2 %, начинка (масло сладко-сливочное  несоленое м.д.ж 82,5%, сахар, кардамон молотый, корица молотая), масло сладко-сливочное несоленое м.д.ж 82,5%, вода питьевая, сахар, меланж яичный пастеризованный, дрожжи хлебопекарные прессованные, соль пищевая, жемчужный сахар (белый сахар-рафинад). Продукция производится на предприятии, где используются аллергены: кунжут, орехи, соя.","Мягкая сдобная булочка-гребешок из нежного молочного теста, сдобренная щепоткой душистой корицы и кардамона. Она обладает глубоким сливочным вкусом с тонкой сладостью и изысканными пряными нотками. Такая выпечка станет органичным дополнением к чашке чая и стакану тёплого молока и непременно понравится всей семье.",0,2025-06-13 10:50:59,Кафе#Выпечка кафе,4.9,6948,https://img.vkusvill.ru/pim/images/site_LargeWebP/a0446016-d0cc-4786-8e67-19ce61467a90.webp?1734823830.9892,bulochka-s-kardamonom-i-koritsey-kafe-106066.html
