url,name,pri/we,pro/cal,weight,price,calories,proteins,fats,carbohydrates,content,description,availability,last_upd_time,category,average_rating,rating_count,imgUrl,html_path
https://vkusvill.ru/goods/keta-file-portsionnoe-zam-650-g-84403.html,"Кета филе порционное зам., 650 г",1.1046153846153846,0.16279069767441862,650.0,718.0,129.0,21.0,5.0,0,"Кета Продукция производится на предприятии, где используются аллергены: моллюски, ракообразные.","Филе дикой кеты. Рыбу замораживают в районе промысла, сразу после вылова, — это позволяет максимально сохранить её вкусовые качества. Порционные кусочки оптимально готовить без предварительной разморозки. Отлично подходят для жарки и запекания. Природный оттенок красной рыбы — характеристика непостоянная. Его насыщенность зависит от места обитания, питания и даже времени года. Поэтому кета может быть чуть ярче или бледнее, чем на фото.",0,2025-06-13 10:53:26,"Рыба, икра и морепродукты#Рыба замороженная",4.9,31,https://img.vkusvill.ru/pim/images/site_LargeWebP/1d32967e-5e31-4fa9-a142-872354199595.webp?1707006202.312,keta-file-portsionnoe-zam-650-g-84403.html
https://vkusvill.ru/goods/forel-slabosolenaya-opalennaya-file-okhl-ves-92322.html,"Форель слабосоленая «опаленная» филе охл., вес",3.095,0.16224648985959442,1000.0,3095.0,128.2,20.8,5.0,0,"Филе форели радужной, соль морская пищевая. Продукт готов к употреблению. Охлажденный продукт. Будьте осторожны: возможно наличие косточек","Яркая внутри, нежно-розовая сверху, с красивыми «подпалинами» — выглядит по-настоящему празднично. Но обжарка на открытом огне нужна не просто для эстетики. За счёт такого приготовления появляется тонкий контраст текстур и вкусов, с которым деликатесная рыба становится ещё интереснее.",0,2025-06-13 10:53:00,"Рыба, икра и морепродукты#Рыба и икра на развес",4.8,212,https://img.vkusvill.ru/pim/images/site_LargeWebP/e88f4e42-519b-42b2-aefa-b349066c05cf.webp?1729897319.0405,forel-slabosolenaya-opalennaya-file-okhl-ves-92322.html
https://vkusvill.ru/goods/forel-malosolenaya-opalennaya-file-kusok-150-g-83788.html,"Форель малосоленая «опаленная» филе-кусок, 150 г",3.433333333333333,0.16224648985959442,150.0,515.0,128.2,20.8,5.0,0,"Филе форели радужной, соль морская пищеваяТовар от производителейАктуальные данные указаны на этикетке. Цена может отличаться в зависимости от региона или формата точки продажи (вендинг, микромаркет).Информация на этикетке может незначительно отличаться","Яркая внутри, нежно-розовая сверху, с красивыми «подпалинами» — выглядит по-настоящему празднично. Но обжарка на открытом огне нужна не просто для эстетики. За счёт такого приготовления появляется тонкий контраст текстур и вкусов, с которым деликатесная рыба становится ещё интереснее.",0,2025-06-13 10:53:05,Идеи для подарков#Деликатесы,4.9,2663,https://img.vkusvill.ru/pim/images/site/site_LargeWebP/2cd97432-2032-4be4-9d49-182e6a89a889.webp,forel-malosolenaya-opalennaya-file-kusok-150-g-83788.html
https://vkusvill.ru/goods/forel-malosolenaya-kusochki-dlya-zakusok-150-g-63924.html,"Форель малосоленая кусочки для закусок, 150 г",1.7866666666666666,0.16224648985959442,150.0,268.0,128.2,20.8,5.0,0,"Форель радужная, соль пищевая.Товар от производителейДанный товар поставляют несколько производителей, внешний вид и характеристики могут незначительно отличаться. Актуальные данные указаны на этикетке. Цена может отличаться в зависимости от региона или формата точки продажи (вендинг, микромаркет).Информация на этикетке может незначительно отличаться","Нежная и ароматная малосолёная форель с чистым составом без консервантов. Кусочки разной формы и размера, однако внешняя неидеальность не отражается на вкусе. Отличный ингредиент для бутербродов на завтрак, Мимозы и других сытных салатов или закуска к несладким напиткам. Оттенок лосося может незначительно варьировать. Ведь его природный цвет зависит от многих факторов, даже от времени года, а мы не используем красителей.",0,2025-06-13 10:53:31,"Вегетарианское и постное#Растительное и с содержанием рыбы, яиц и молока#Рыба соленая и деликатесы",4.3,719,https://img.vkusvill.ru/pim/images/site/site_LargeWebP/418bfcde-abdd-4e30-a8aa-78f4cf0ac3aa.webp,forel-malosolenaya-kusochki-dlya-zakusok-150-g-63924.html
https://vkusvill.ru/goods/chekhon-nerazdelannaya-vyalenaya-ves-76404.html,"Чехонь неразделанная вяленая, вес",1.195,0.16,1000.0,1195.0,100.0,16.0,4.0,0,"чехонь (Pelecus cultratus), соль поваренная пищевая. Продукция произведена на предприятии, где используются: рыба, ракообразные, моллюски, злаки, содержащие глютен, яйца и продукты их переработки.  Продукт готов к употреблению. Продукция производится на предприятии, где используются аллергены: злаки, содержащие глютен, моллюски, ракообразные, яйца.","Мастерски завяленная чехонь: мягкая, ароматная, в меру солёная. Рыба легко чистится и составит отличную компанию холодному несладкому квасу или безалкогольному пиву.",0,2025-06-13 10:53:11,"Рыба, икра и морепродукты#Рыба вяленая, снеки",4.6,66,https://img.vkusvill.ru/pim/images/site_LargeWebP/dc77c180-bd5f-40e4-9108-638f5e05a8ba.webp?1710453688.8938,chekhon-nerazdelannaya-vyalenaya-ves-76404.html
https://vkusvill.ru/goods/okun-morskoy-zolotistyy-zharenyy-ves-97721.html,"Окунь морской золотистый жареный, вес",1.155,0.15966386554621848,1000.0,1155.0,119.0,19.0,3.0,4.0,"окунь морской золотистый (Sebastes marinus), смесь панировочная (мука пшеничная хлебопекарная высший сорт , соль пищевая), масло подсолнечное рафинированное дезодорированное высший сорт.  Продукция произведена на предприятии, где используются ракообразные, моллюски, злаки, содержащие глютен, яйца и продукты их переработки. Продукт готов к употреблению. Охлажденный продукт. Произведено из мороженого сырья.  Продукция производится на предприятии, где используются аллергены: злаки, содержащие глютен, моллюски, ракообразные, яйца.","Нежный морской окунь по домашнему рецепту: деликатно приправили солью, присыпали мукой и обжарили до золотистой корочки. Отлично сочетается с рассыпчатым рисом, печёным картофелем, цветной капустой, да и вообще с любыми овощами. Продаётся на вес: удобно взять немного на пробу или, наоборот, сразу побольше для семейного обеда.",0,2025-06-13 10:53:11,Готовая еда#Вторые блюда#Вторые блюда с рыбой и морепродуктами,4.7,270,https://img.vkusvill.ru/pim/images/site_LargeWebP/3c363285-01de-43ae-9c86-12a1120c7aa6.webp?1724094565.5328,okun-morskoy-zolotistyy-zharenyy-ves-97721.html
https://vkusvill.ru/goods/forel-raduzhnaya-lomtiki-slabosolenye-ves-30277.html,"Форель радужная ломтики слабосоленые, вес",2.895,0.158974358974359,1000.0,2895.0,117.0,18.6,11.4,0,"форель радужная,соль.Товар от производителейДанный товар поставляют несколько производителей, внешний вид и характеристики могут незначительно отличаться. Актуальные данные указаны на этикетке. Цена может отличаться в зависимости от региона или формата точки продажи (вендинг, микромаркет).Информация на этикетке может незначительно отличаться","Без филе форели невозможно представить рацион рыбного гурмана! Её нежная солоноватая мякоть прекрасно дополнит любую закуску. Форель можно дополнить ломтиками сливочного авокадо и превратить в тост, а можно подавать в сопровождении яйца-пашот — то, что нужно для питательного завтрака.",0,2025-06-13 10:53:27,"Вегетарианское и постное#Растительное и с содержанием рыбы, яиц и молока#Рыба соленая и деликатесы",4.7,1043,https://img.vkusvill.ru/pim/images/site_LargeWebP/aa1161c8-82df-495e-8186-8a89d5ac891f.webp?1715777901.4152,forel-raduzhnaya-lomtiki-slabosolenye-ves-30277.html
https://vkusvill.ru/goods/koryushka-aziatskaya-kholodnogo-kopcheniya-250-g-56986.html,"Корюшка азиатская холодного копчения, 250 г",2.2,0.1583397386625673,250.0,550.0,130.1,20.6,5.3,0,"Корюшка азиатская неразделанная, соль пищеваяТовар от производителейАктуальные данные указаны на этикетке. Цена может отличаться в зависимости от региона или формата точки продажи (вендинг, микромаркет).Информация на этикетке может незначительно отличаться","Благодаря копчению на древесной щепе, корюшка приобрела приятные дымные нотки и стала особенно вкусной. Нежная, нежирная, ароматная, она отлично подойдёт на роль закуски. А для сытного обеда копчёную рыбу можно дополнить картофелем или просто овощным салатом.  Мы не потрошим корюшку из-за небольших размеров, нежной структуры и наличия икры в некоторых рыбках. Чистить её необязательно, однако непотрошёная корюшка может слегка горчить.",0,2025-06-13 10:52:59,"Вегетарианское и постное#Растительное и с содержанием рыбы, яиц и молока#Рыба соленая и деликатесы",4.7,1126,https://img.vkusvill.ru/pim/images/site/site_for_feed/0e41d359-1447-4d84-8090-a6128ebdf860.jpg,koryushka-aziatskaya-kholodnogo-kopcheniya-250-g-56986.html
https://vkusvill.ru/goods/nerka-lomtiki-kholodnogo-kopcheniya-ves-102128.html,"Нерка ломтики холодного копчения, вес",3.59,0.15789473684210525,1000.0,3590.0,171.0,27.0,7.0,0,"Нерка, соль пищевая. Продукт производится на предприятии, где используются моллюски, ракообразные. Продукт готов к употреблению. Произведено из мороженого сырья. Охлажденный продукт. Возможно попадание костей, будьте осторожны! Продукция производится на предприятии, где используются аллергены: моллюски, ракообразные.","Дикая нерка, подкопчённая на древесной щепе. Используем только натуральное мягкое копчение, поэтому дымные ноты деликатно подчёркивают вкус. Нежная, в меру солёная и уже нарезанная на аккуратные ломтики, она отлично дополнит сытные бутерброды со сливочным сыром, салаты с листовыми овощами и эстетичные закуски. Продаётся на вес: удобно заказать немного на пробу или, наоборот, сразу побольше для семейного застолья. Не содержит консервантов.",0,2025-06-13 10:53:10,"Рыба, икра и морепродукты#Рыба и икра на развес",4.9,164,https://img.vkusvill.ru/pim/images/site_LargeWebP/363df9b3-d6a1-45ae-93cd-2fc2c4f037a2.webp?1731483673.0354,nerka-lomtiki-kholodnogo-kopcheniya-ves-102128.html
https://vkusvill.ru/goods/nerka-podkopchennaya-lomtiki-100-g-61242.html,"Нерка подкопченная ломтики, 100 г",3.75,0.15789473684210525,100.0,375.0,171.0,27.0,7.0,0,"Нерка тихоокеанская, соль поваренная пищевая. Возможно наличие мелких костей, будьте осторожны!","Дикая тихоокеанская нерка, подкопчённая на древесной щепе. Используем только натуральное мягкое копчение, поэтому дымные ноты деликатно подчёркивают вкус. Нежная, в меру солёная и уже нарезанная на аккуратные ломтики, она отлично дополнит сытные бутерброды со сливочным сыром, салаты с листовыми овощами и эстетичные закуски. А также порадует чистым составом без консервантов.",0,2025-06-13 10:53:15,"Рыба, икра и морепродукты#Рыба солёная и копчёная",4.7,583,https://img.vkusvill.ru/pim/images/site/site_LargeWebP/7e5a012c-9f15-48fa-a285-1eaab45a50ba.webp,nerka-podkopchennaya-lomtiki-100-g-61242.html
https://vkusvill.ru/goods/forel-raduzhnaya-steyk-okhl-450-g-63121.html,"Форель радужная стейк охл., 450 г",2.7511111111111113,0.15702479338842976,450.0,1238.0,121.0,19.0,5.0,0,"форель радужная  (Salmo irideus) Продукция производится на предприятии, где используются аллергены: злаки, содержащие глютен, моллюски, ракообразные, соя. Продукт аквакультуры.Товар от производителейДанный товар поставляют несколько производителей, внешний вид и характеристики могут незначительно отличаться. Актуальные данные указаны на этикетке. Цена может отличаться в зависимости от региона или формата точки продажи (вендинг, микромаркет).Информация на этикетке может незначительно отличаться","Оттенок рыбы может незначительно варьироваться. Ведь её природный цвет зависит от многих факторов, даже от времени года, а мы не используем красителей. Форель — признанный деликатес. Её мясо нежное, умеренно жирное, с приятным ароматом. Вкус раскроется особенно ярко, если рыбу приготовить на гриле. Она настолько нежная и вкусная сама по себе, что не нуждается в мариновании. При желании можно подержать форель 15 минут в коньяке для дополнительного аромата — этого будет достаточно.",0,2025-06-13 10:52:57,"Рыба, икра и морепродукты#Рыба и морепродукты охлажденные",4.8,4604,https://img.vkusvill.ru/pim/images/site_LargeWebP/90ec0a4d-3484-4df7-b788-b637b0d628f9.webp?1716108916.8309,forel-raduzhnaya-steyk-okhl-450-g-63121.html
https://vkusvill.ru/goods/forel-file-kusok-na-kozhe-okhl-350-g-63575.html,"Форель филе-кусок на коже охл., 350 г",2.822857142857143,0.15702479338842976,350.0,988.0,121.0,19.0,5.0,0,"Форель радужная. Возможно наличие косточек, будьте осторожны!Товар от производителейДанный товар поставляют несколько производителей, внешний вид и характеристики могут незначительно отличаться. Актуальные данные указаны на этикетке. Цена может отличаться в зависимости от региона или формата точки продажи (вендинг, микромаркет).Информация на этикетке может незначительно отличаться","Оттенок рыбы может незначительно варьировать. Ведь её природный цвет зависит от многих факторов, даже от времени года, а мы не используем красителей. Форель — признанный деликатес. Её мясо умеренно жирное, нежное, с приятным ароматом. Запечённая или обжаренная на гриле рыба отлично подойдёт как для повседневного, так и для праздничного стола. А ещё форель быстро готовится и не требует маринования, ведь её вкус богатый сам по себе. Рыба не подвергалась заморозке, так что её вкусовые качества и ценные свойства сохранены в полной мере.",0,2025-06-13 10:52:59,"Рыба, икра и морепродукты#Рыба и морепродукты охлажденные",4.8,5878,https://img.vkusvill.ru/pim/images/site_LargeWebP/8ded3a2b-7a20-4ed7-85ed-19d7a629ef93.webp?1722504635.3848,forel-file-kusok-na-kozhe-okhl-350-g-63575.html
https://vkusvill.ru/goods/steyk-foreli-zam-ves-104833.html,"Стейк Форели, зам, ВЕС",2.95,0.15702479338842976,1000.0,2950.0,121.0,19.0,5.0,0,"Филе форели радужной, вода питьевая (защитная глазурь - до 5 %). Продукция аквакультуры. Подлежит термической обработке","Бережно замороженные стейки с массой защитной глазури до 5%. Чтобы вкусно приготовить форель, не нужно быть опытным кулинаром. Мясо у неё очень нежное, ароматное и самодостаточное. Так что дольки лимона и щепотки перца вполне хватит, чтобы подчеркнуть вкус. А если хочется чего-то особенного, стейки можно запечь в сливках, в клюквенном или апельсиновом соусе. Размораживать рыбу лучше на полке холодильника: резкий перепад температур нежелателен для нежной структуры форели.",0,2025-06-13 10:53:06,"Рыба, икра и морепродукты#Рыба замороженная",4.9,270,https://img.vkusvill.ru/pim/images/site_LargeWebP/13881eaa-4f35-4239-9381-389217093502.webp?1734637655.9226,steyk-foreli-zam-ves-104833.html
https://vkusvill.ru/goods/forel-khvostovaya-chast-zam-500-g-94224.html,"Форель хвостовая часть зам., 500 г",1.236,0.15702479338842976,500.0,618.0,121.0,19.0,5.0,0,"форель радужная Продукция производится на предприятии, где используются аллергены: моллюски, ракообразные.","Мясо в хвостовой части форели чуть плотнее и насыщеннее по вкусу — потому что мышечные волокна активно задействованы в движении рыбы. И к тому же отличается средним количеством жиров. Отлично подходит для гриля, запекания, ухи и копчения. Советуем размораживать в холодильнике в закрытой упаковке. Продукт аквакультуры. Рыба растёт в контролируемых условиях: живёт в экологически чистых акваториях и питается сбалансированным кормом без антибиотиков. Качество продукции проверяется и производителем, и в наших лабораториях. Природный оттенок красной рыбы — характеристика непостоянная. Его насыщенность зависит от места обитания, питания и даже времени года. Поэтому сёмга может быть чуть ярче или бледнее, чем на фото.",0,2025-06-13 10:53:13,"Рыба, икра и морепродукты#Рыба замороженная",4.9,244,https://img.vkusvill.ru/pim/images/site_for_feed/99c62ce2-1af1-418e-83f5-1e0a028bd8dd.jpg?1720333525.4342,forel-khvostovaya-chast-zam-500-g-94224.html
