url,name,pri/we,pro/cal,weight,price,calories,proteins,fats,carbohydrates,content,description,availability,last_upd_time,category,average_rating,rating_count,imgUrl,html_path
https://vkusvill.ru/goods/sardina-tushki-blanshirovannye-v-tomate-175-g-91932.html,"Сардина тушки бланшированные в томате, 175 г",1.1142857142857143,0.1,175.0,195.0,170.0,17.0,9.5,4.0,"Сардина (sardina pilchardus) тушки, томатный соус (томатная паста, сахар, масло растительное, лук, соль, уксусная кислота, пряности )","Ароматные сардины в густом томатном соусе с щепоткой пряностей. Уже очищены от голов и хвостиков. Сочную рыбку можно подать с картофелем, положить на ломтик ржаного хлеба, добавить в салат, суп или пирог. К тому же консервы удобно захватить с собой в поход или на дачу.",0,2025-06-13 10:53:03,"Вегетарианское и постное#Растительное и с содержанием рыбы, яиц и молока#Консервы#Рыбные консервы",4.9,635,https://img.vkusvill.ru/pim/images/site_LargeWebP/e19ef0bc-cc9a-4b8e-be8f-26076198702d.webp?1714334369.5814,sardina-tushki-blanshirovannye-v-tomate-175-g-91932.html
https://vkusvill.ru/goods/ikra-mintaya-125-g-46875.html,"Икра минтая, 125 г",1.0,0.1,125.0,125.0,120.0,12.0,7.0,0,"икра минтая, отвар пряностей (вода, лавровый лист, перец душистый), масло подсолнечное рафинированное, соль ""Экстра"", крахмал картофельный, загуститель (камедь рожкового дерева). Произведено из мороженого сырьяТовар от производителейАктуальные данные указаны на этикетке. Цена может отличаться в зависимости от региона или формата точки продажи (вендинг, микромаркет).Информация на этикетке может незначительно отличаться","Натуральная пробойная, стерилизованная икра минтая, в меру солёная, чуть сладковатая, с нежной текстурой паштета. Для большей сытности и мягкости вкуса в икру добавлен картофельный крахмал и подсолнечное масло. Икра приправлена лавровым листом и душистым перцем. Не содержит добавленного сахара, искусственных красителей и ароматизаторов. Превосходно подходит для сытного завтрака, обеда или полезного перекуса. Такая икра может стать основой для лёгких пикантных закусок и начинок.",0,2025-06-13 10:53:27,"Рыба, икра и морепродукты#Икра",4.6,1724,https://img.vkusvill.ru/pim/images/site_LargeWebP/df31c997-7e2c-474e-b97a-a22aec2e2436.webp?1742931638.3235,ikra-mintaya-125-g-46875.html
https://vkusvill.ru/goods/kotlety-iz-kalmara-s-mintaem-zam-300-g-108199.html,"Котлеты из кальмара с минтаем зам., 300 г",0.96,0.09984152139461172,300.0,288.0,126.2,12.6,1.4,15.8,"фарш из кальмара (кальмар командорский), фарш из минтая (минтай), сухари панировочные (мука пшеничная хлебопекарная высшего сорта, вода питьевая, соль пищевая), вода питьевая, молоко сухое обезжиренное, клетчатка пшеничная, меланж яичный сухой, крупа манная, чеснок сушеный, лук репчатый сушеный, экстракты специй (перец черный), соль пищевая. Продукция производится на предприятии, где используются аллергены: ракообразные, соя.",,0,2025-06-13 10:53:05,"Рыба, икра и морепродукты#Котлеты, медальоны",Ждёт оценку,1,https://img.vkusvill.ru/pim/images/site/site_LargeWebP/811eee3a-e04a-428b-8c29-11c4ca966a3a.webp,kotlety-iz-kalmara-s-mintaem-zam-300-g-108199.html
https://vkusvill.ru/goods/kotlety-iz-kalmara-s-mintaem-okhl-300-g-108209.html,"Котлеты из кальмара с минтаем охл., 300 г",0.9933333333333333,0.09984152139461172,300.0,298.0,126.2,12.6,1.4,15.8,"Фарш из кальмара (кальмар командорский), фарш из минтая (минтай), сухари панировочные (мука пшеничная хлебопекарная высшего сорта, вода питьевая, соль пищевая), вода питьевая, молоко сухое обезжиренное, клетчатка пшеничная, меланж яичный сухой, крупа манная, чеснок сушеный, лук репчатый сушеный, экстракты специй (перец черный), соль пищевая.  Продукция производится на предприятии, где используются аллергены: ракообразные, соя.","Нежное сочетание фарша из кальмара и минтая в хрустящей панировке. Командорский кальмар придаёт текстуре котлет упругость, а минтай — нежность. Готовятся быстро: достаточно обжарить с каждой стороны в течение 5 минут. Панировка из сухарей создаёт аппетитную корочку при обжарке, а сушёный чеснок и лук добавляют аромат. Хороши с салатом из овощей или с питательным гарниром. Отличный вариант для тех, кто любит морепродукты, но не хочет долго возиться с приготовлением.",0,2025-06-13 10:53:25,"Рыба, икра и морепродукты#Котлеты, медальоны",4.8,554,https://img.vkusvill.ru/pim/images/site_LargeWebP/b7adc4d1-64b4-41d9-a0e8-0e04c04a1a4e.webp?1743461414.7767,kotlety-iz-kalmara-s-mintaem-okhl-300-g-108209.html
https://vkusvill.ru/goods/keta-zharenaya-file-200-g-70274.html,"Кета жареная филе, 200 г",2.12,0.09909090909090909,200.0,424.0,220.0,21.8,9.6,11.6,"рыба кета филе без шкуры (произведено из мороженого сырья), мука пшеничная хлебопекарная высший сорт, соль пищевая, масло подсолнечное рафинированное дезодорированное вымороженное первый сорт Продукция производится на предприятии, где используются аллергены: моллюски, ракообразные.Товар от производителейАктуальные данные указаны на этикетке. Цена может отличаться в зависимости от региона или формата точки продажи (вендинг, микромаркет).Информация на этикетке может незначительно отличаться","Нежное филе кеты в лёгкой румяной панировке. Можно подать с любимым гарниром, овощным салатом или есть просто так, без дополнений!",0,2025-06-13 10:53:15,Готовая еда#Вторые блюда#Вторые блюда с рыбой и морепродуктами,4.7,1279,https://img.vkusvill.ru/pim/images/site_LargeWebP/6434b14b-b77f-4aff-a6e5-1762ff9892ba.webp?1731533347.8156,keta-zharenaya-file-200-g-70274.html
https://vkusvill.ru/goods/tunets-konserv-v-masle-s-pertsem-chili-120-g-69438.html,"Тунец консерв. в масле с перцем чили, 120 г",2.0416666666666665,0.09801762114537446,120.0,245.0,181.6,17.8,10.4,4.2,"тунец, масло растительное, перец чили, соль.Товар от производителейАктуальные данные указаны на этикетке. Цена может отличаться в зависимости от региона или формата точки продажи (вендинг, микромаркет).Информация на этикетке может незначительно отличаться","«Секретный» ингредиент этих консервов — цельный перчик чили! Благодаря ему нежное мясо тунца приобрело яркую остроту и стало более ароматным. Пикантной рыбке найдётся множество вариантов применения: её можно подать с холодным или горячим гарниром, добавить в салат, использовать для приготовления закусок или просто съесть вприкуску с хрустящим хлебом. Страна производитель - Китай.",0,2025-06-13 10:53:08,"Рыба, икра и морепродукты#Рыбные консервы",4.9,1625,https://img.vkusvill.ru/pim/images/site_LargeWebP/8655fc78-3e3f-414a-b39d-23e8760b769a.webp?1715004875.2157,tunets-konserv-v-masle-s-pertsem-chili-120-g-69438.html
https://vkusvill.ru/goods/mintay-zharenyy-file-200-g-63774.html,"Минтай жареный филе, 200 г",1.75,0.09702970297029702,200.0,350.0,151.5,14.7,8.7,3.6,"Минтай филе без шкуры (произведено из мороженого сырья), мука пшеничная хлебопекарная высший сорт, соль пищевая, масло подсолнечное рафинированное дезодорированное вымороженное первый сорт.  Продукция производится на предприятии, где используются аллергены: моллюски, яйца. Возможно наличие костей и их фрагментов, будьте осторожны! Продукт готов к употреблению.Товар от производителейАктуальные данные указаны на этикетке. Цена может отличаться в зависимости от региона или формата точки продажи (вендинг, микромаркет).Информация на этикетке может незначительно отличаться","Нежное филе минтая, приготовленное в кляре, получается особенно вкусным. «Жидкая панировка» сохраняет сочность рыбы и образует аппетитную золотистую корочку. Блюдо можно дополнить гарниром или подать с любимым соусом как закуску. Минтай выловлен в зоне FAO61: В Тихом океане, Камчатская подзона.",0,2025-06-13 10:53:12,Готовая еда#Вторые блюда#Вторые блюда с рыбой и морепродуктами,4.8,10299,https://img.vkusvill.ru/pim/images/site_LargeWebP/def405d3-323f-46e8-b705-64fee3e2052a.webp?1731458277.8223,mintay-zharenyy-file-200-g-63774.html
https://vkusvill.ru/goods/navaga-zharenaya-ves-54399.html,"Навага жареная, вес",0.755,0.09664429530201342,1000.0,755.0,149.0,14.4,9.0,2.5,"рыба навага, мука, соль, растительное маслоТовар от производителейАктуальные данные указаны на этикетке. Цена может отличаться в зависимости от региона или формата точки продажи (вендинг, микромаркет).Информация на этикетке может незначительно отличаться","Жареная навага в золотистом кляре отлично подойдёт для сытного обеда и ужина. У неё плотное мясо, в котором практически не попадаются мелкие косточки. Лучше всего подавать рыбу в разогретом виде, сопровождая классическими гарнирами.",0,2025-06-13 10:52:56,Готовая еда#Вторые блюда#Вторые блюда с рыбой и морепродуктами,4.5,432,https://img.vkusvill.ru/pim/images/site_LargeWebP/bccc1d34-28e2-4601-8cd7-8959e6fd1e73.webp?1712611091.8957,navaga-zharenaya-ves-54399.html
https://vkusvill.ru/goods/maslyanaya-ryba-kholodnogo-kopcheniya-ves-35938.html,"Масляная рыба холодного копчения, вес",1.995,0.09659090909090909,1000.0,1995.0,176.0,17.0,12.0,0,"рыба масляная кусок, соль пищеваяТовар от производителейДанный товар поставляют несколько производителей, внешний вид и характеристики могут незначительно отличаться. Актуальные данные указаны на этикетке. Цена может отличаться в зависимости от региона или формата точки продажи (вендинг, микромаркет).Информация на этикетке может незначительно отличаться","Масляная рыба с жирным белым мясом коптилась над ароматным дымом тлеющих древесных опилок. Такой способ холодного копчения придаёт рыбе особенный, пикантный вкус и соблазнительный аромат.",0,2025-06-13 10:53:07,"Рыба, икра и морепродукты#Рыба и икра на развес",4.8,380,https://img.vkusvill.ru/pim/images/site_LargeWebP/fff837c8-3b60-4651-8bc8-36a458cffefa.webp?1730728436.4688,maslyanaya-ryba-kholodnogo-kopcheniya-ves-35938.html
https://vkusvill.ru/goods/skumbriya-atlantich-file-s-kozhey-zam-500-g-81427.html,"Скумбрия атлантич. филе с кожей зам., 500 г",1.34,0.09523809523809523,500.0,670.0,189.0,18.0,13.0,0,"Скумбрия филе с кожей, вода питьевая (защитная ледяная глазурь) Продукция производится на предприятии, где используются аллергены: моллюски.Товар от производителейАктуальные данные указаны на этикетке. Цена может отличаться в зависимости от региона или формата точки продажи (вендинг, микромаркет).Информация на этикетке может незначительно отличаться","Замороженное филе атлантической скумбрии. Рыба не зачищается от костей: филе очень нежное, и зачистка может излишне повлиять на структуру. Это одна из самых вкусных рыб для приготовления в духовке — просто добавьте дольки лимона и пряные травы, заверните в фольгу и запеките. У скумбрии «сильный» вкус, поэтому и ярких приправ она не боится, смело используйте орегано или розмарин, можно добавить немного чеснока. Советуем размораживать рыбу медленно: так она максимально сохранит вкус, текстуру и аромат. Положите закрытую упаковку в ёмкость и оставьте на нижней полке холодильника до полной разморозки.",0,2025-06-13 10:52:57,"Рыба, икра и морепродукты#Рыба замороженная",4.7,460,https://img.vkusvill.ru/pim/images/site_LargeWebP/ac4058de-363a-45fa-bac2-ad9dabc7431a.webp?1730238492.3785,skumbriya-atlantich-file-s-kozhey-zam-500-g-81427.html
https://vkusvill.ru/goods/skumbriya-kholodnogo-kopcheniya-ves-35929.html,"Скумбрия холодного копчения, вес",1.14,0.09523809523809523,1000.0,1140.0,189.0,18.0,13.0,0,"скумбрия тушка (Атлантическая), соль пищевая.Товар от производителейДанный товар поставляют несколько производителей, внешний вид и характеристики могут незначительно отличаться. Актуальные данные указаны на этикетке. Цена может отличаться в зависимости от региона или формата точки продажи (вендинг, микромаркет).Информация на этикетке может незначительно отличаться","Ароматная, в меру жирная скумбрия холодного копчения. Нежное, деликатной текстуры мясо вкусно и просто так, с ржаным хлебом и луком, и в салатах, паштетах, начинки для выпечки, густых соусов и супов.",0,2025-06-13 10:53:04,"Рыба, икра и морепродукты#Рыба и икра на развес",4.6,328,https://img.vkusvill.ru/pim/images/site_LargeWebP/8a80e74b-f3a0-484a-aee9-5399733160e4.webp?1715777495.9969,skumbriya-kholodnogo-kopcheniya-ves-35929.html
https://vkusvill.ru/goods/korn-dog-s-krevetkoy-zam-200-g-107711.html,"«Корн-дог» с креветкой зам., 200 г",3.74,0.09339887640449439,200.0,748.0,142.4,13.3,5.2,10.6,"Тесто (филе минтая (44%), креветка ваннамей (40%), мука кукурузная (16%), соль морская пищевая, смесь пряностей «лимонный перец» молотая (перец черный, лук, сахар, имбирь, регулятор кислотности - лимонная кислота, ароматизатор лимон), паприка молотая, чеснок сушеный молотый, кориандр молотый); начинка (цельная креветка ваннамей, сыр моцарелла м.ж.д. в сухом веществе 45% (молоко пастеризованное, соль пищевая, термофильная бактериальная закваска, молокосвертывающий ферментный препарат микробного происхождения)); масло подсолнечное рафинированное дезодорированное вымороженное ""Первый сорт"". Продукция производится на предприятии, где используются аллергены: диоксид серы (сульфиты), злаки, содержащие глютен, моллюски, рыба, соя.","Корн-дог с креветкой и сыром — азиатская закуска с насыщенным морским вкусом. Снаружи — плотное тесто с хрустящей золотистой корочкой, приготовленное из филе минтая с добавлением креветки ваннамей, ароматных специй и небольшого количества кукурузной муки. Внутри — целая креветка и моцарелла, которая расплавляется и тянется при правильном доведении до готовности. Лучше всего подавать с вашим любимым соусом для креветок.",0,2025-06-13 10:53:31,"Рыба, икра и морепродукты#Котлеты, медальоны",4.1,69,https://img.vkusvill.ru/pim/images/site_LargeWebP/61900c8a-0213-48f2-abe0-92186a16646b.webp?1743111304.8988,korn-dog-s-krevetkoy-zam-200-g-107711.html
https://vkusvill.ru/goods/bychki-obzharennye-v-tomatnom-souse-240-g-22743.html,"Бычки обжаренные в томатном соусе, 240 г",1.0166666666666666,0.09285714285714286,240.0,244.0,140.0,13.0,8.0,3.7,"рыба, вода питьевая, томатная паста, сахар-песок, масло подсолнечное, мука пшеничная, лук сушеный, соль поваренная, регулятор кислотности - кислота уксусная, паприка сушеная, пряности молотые: перец душистый, перец черный, кориандр, гвоздика; лавровый листТовар от производителейДанный товар поставляют несколько производителей, внешний вид и характеристики могут незначительно отличаться. Актуальные данные указаны на этикетке. Цена может отличаться в зависимости от региона или формата точки продажи (вендинг, микромаркет).Информация на этикетке может незначительно отличаться",Нежные бычки в сладко-пряном томатном соусе. Знакомая с детства закуска и отличный ингредиент для супов и бутербродов.,0,2025-06-13 10:53:02,"Рыба, икра и морепродукты#Рыбные консервы",4.8,2082,https://img.vkusvill.ru/pim/images/site/site_LargeWebP/adb60e7e-f346-478d-b4ff-e972202390a1.webp,bychki-obzharennye-v-tomatnom-souse-240-g-22743.html
https://vkusvill.ru/goods/skumbriya-atlantich-solenaya-kusochki-300-g-22297.html,"Скумбрия атлантич. соленая кусочки, 300 г",1.1833333333333333,0.0912863070539419,300.0,355.0,241.0,22.0,17.0,0,"скумбрия атлантическая, соль поваренная пищевая,    РК АКВАТОРИЯ ООО: скумбрия атлантическая, соль пищевая. Продукт может содержать компоненты, не используемые при производстве продукции (на предприятии используются): горчица, моллюски, ракообразные, молоко (лактоза), сельдерей, соя, яйца. Возможно наличие косточек, будьте осторожны.Товар от производителейДанный товар поставляют несколько производителей, внешний вид и характеристики могут незначительно отличаться. Актуальные данные указаны на этикетке. Цена может отличаться в зависимости от региона или формата точки продажи (вендинг, микромаркет).Информация на этикетке может незначительно отличаться","Ароматная, в меру жирная скумбрия, уже нарезанная на аккуратные кусочки. Идеальна в паре с картофелем и с ломтиком ржаного хлеба.",0,2025-06-13 10:53:08,"Вегетарианское и постное#Растительное и с содержанием рыбы, яиц и молока#Рыба соленая и деликатесы",4.5,7828,https://img.vkusvill.ru/pim/images/site/site_LargeWebP/98c96db8-1d7c-47b2-a595-c7472aca66cb.webp,skumbriya-atlantich-solenaya-kusochki-300-g-22297.html
