url,name,pri/we,pro/cal,weight,price,calories,proteins,fats,carbohydrates,content,description,availability,last_upd_time,category,average_rating,rating_count,imgUrl,html_path
https://vkusvill.ru/goods/myaso-kraba-kamchatskogo-salatnoe-varenoe-zam-250-g-39545.html,"Мясо краба камчатского салатное вареное зам., 250 г",5.912,0.25,250.0,1478.0,68.0,17.0,0,0,"мясо краба камчатского, вода питьевая (защитная глазурь не более 5 %).Товар от производителейДанный товар поставляют несколько производителей, внешний вид и характеристики могут незначительно отличаться. Актуальные данные указаны на этикетке. Цена может отличаться в зависимости от региона или формата точки продажи (вендинг, микромаркет).Информация на этикетке может незначительно отличаться","Белоснежное сочное мясо камчатского краба отличают гладкая текстура с плотными волокнами и превосходный сладковатый вкус. Из такого мяса можно приготовить кремовые супы, салаты, жюльены, фрикасе или начинку для роллов. Этот универсальный продукт хорош и в простой яичнице по-камчатски, и в гурманских закусках.",0,2025-06-13 10:52:58,"Рыба, икра и морепродукты#Морепродукты замороженные",4.4,113,https://img.vkusvill.ru/pim/images/site_LargeWebP/f9d3b29b-09ae-4aab-a5d8-677df0c376ec.webp?1728487284.0512,myaso-kraba-kamchatskogo-salatnoe-varenoe-zam-250-g-39545.html
https://vkusvill.ru/goods/kalmar-gigantskiy-naturalnyy-zh-b-185-g-85052.html,"Кальмар гигантский натуральный ж/б, 185 г",1.1945945945945946,0.24717514124293785,185.0,221.0,70.8,17.5,0.9,1.8,"кальмар (кусочки произвольной формы), соль поваренная пищевая.","Гигантский кальмар, нашинкованный без кожицы. Кусочки мягкие, мясистые, едва солоноватые. Идеальны для лёгкого белкового перекуса, бутербродов и салатов. Например, филе можно соединить со свежим огурчиком, сладким перцем и яйцом или с фунчозой и овощами.  Массовая доля основного продукта не менее 50%.",0,2025-06-13 10:53:22,"Рыба, икра и морепродукты#Рыбные консервы",4.3,87,https://img.vkusvill.ru/pim/images/site_LargeWebP/fea59fd0-ad55-4abc-8938-08d688d15d67.webp?1703965255.5236,kalmar-gigantskiy-naturalnyy-zh-b-185-g-85052.html
https://vkusvill.ru/goods/tunets-polosatyy-file-kusochki-naturalnye-200-g-62237.html,"Тунец полосатый филе-кусочки натуральные, 200 г",1.925,0.24615384615384617,200.0,385.0,65.0,16.0,0.2,0,"Тунец полосатый, вода питьевая, соль.Товар от производителейАктуальные данные указаны на этикетке. Цена может отличаться в зависимости от региона или формата точки продажи (вендинг, микромаркет).Информация на этикетке может незначительно отличаться","Крупные кусочки тунца в собственном соку, приправленные только щепоткой соли. Нежное, сочное, богатое белком филе отлично дополнит здоровый рацион. Можно приготовить сэндвичи на цельнозерновом хлебе, сытный салат с листовыми овощами, использовать для выпечки и закусок. Масса основного продукта — 100 г.",0,2025-06-13 10:52:57,"Рыба, икра и морепродукты#Рыбные консервы",4.9,1678,https://img.vkusvill.ru/pim/images/site_LargeWebP/99a13975-1675-4dc0-94cc-c2d6e5c916ce.webp?1703235804.1203,tunets-polosatyy-file-kusochki-naturalnye-200-g-62237.html
https://vkusvill.ru/goods/tunets-salatnyy-naturalnyy-170-g-68525.html,"Тунец салатный натуральный, 170 г",0.9882352941176471,0.24457831325301205,170.0,168.0,83.0,20.3,0.2,0,"Тунец полосатый (Katsuwonus pelamis), вода, соль поваренная пищевая.  Продукция производится на предприятии, где используются аллергены: злаки, содержащие глютен, моллюски, молоко (лактоза).","С салатным тунцом приготовление любимых блюд будет особенно удобным! Его отличает мелкая нарезка и натуральная заливка. С нежным измельчённым филе можно приготовить множество блюд: это идеальный ингредиент для салатов, бутербродов, омлетов и разнообразных закусок. Состав консервов очень лаконичен: в нём только сочный полосатый тунец, вода и соль.",0,2025-06-13 10:53:18,"Рыба, икра и морепродукты#Рыбные консервы",4.5,38,https://img.vkusvill.ru/pim/images/site_LargeWebP/acb26d6c-ef26-4a49-b502-36cbdbf3d1e2.webp?1725315919.6757,tunets-salatnyy-naturalnyy-170-g-68525.html
https://vkusvill.ru/goods/tunets-zheltoperyy-file-naturalnyy-st-b-190-g-14976.html,"Тунец (желтоперый) филе натуральный ст/б, 190 г",1.9210526315789473,0.24444444444444444,190.0,365.0,90.0,22.0,0.5,0,"тунец желтоперый, вода питьевая, соль пищевая.  ТПК ДАЛЬПРОМРЫБА ООО: тунец желтопёрый (кусочки-филе), вода питьевая, соль поваренная пищевая. Продукция производится на предприятии, где используются моллюски, глютен и молоко. Произведено из мороженого сырья.Товар от производителейДанный товар поставляют несколько производителей, внешний вид и характеристики могут незначительно отличаться. Актуальные данные указаны на этикетке. Цена может отличаться в зависимости от региона или формата точки продажи (вендинг, микромаркет).Информация на этикетке может незначительно отличаться","Ароматное филе тунца, нарезанное на крупные кусочки и слегка приправленное солью. Без консервантов и других добавок. Нежный вкус, слоистая текстура и минимальное количество жиров делают «морскую телятину» идеальным ингредиентом для здоровых салатов и закусок. Массовая доля основного продукта 95 г",0,2025-06-13 10:53:20,"Рыба, икра и морепродукты#Рыбные консервы",4.8,1190,https://img.vkusvill.ru/pim/images/site_LargeWebP/33699b37-564f-47d5-900f-91c0f728a77d.webp?1699230194.0676,tunets-zheltoperyy-file-naturalnyy-st-b-190-g-14976.html
https://vkusvill.ru/goods/piksha-file-spinka-bez-kozhi-zam-72813.html,Пикша филе спинка без кожи зам.,1.775,0.24355300859598855,1000.0,1775.0,69.8,17.0,0.2,0,"пикша, вода питьевая (защитная ледяная оболочка). Зона вылова FAO 27 Северо-восточная часть Атлантического океана.Товар от производителейДанный товар поставляют несколько производителей, внешний вид и характеристики могут незначительно отличаться. Актуальные данные указаны на этикетке. Цена может отличаться в зависимости от региона или формата точки продажи (вендинг, микромаркет).Информация на этикетке может незначительно отличаться","У пикши яркий вкус с мягкими молочными нотами и нежная текстура. Рыба идеально подходит для диетического рациона: содержание жиров в ней стремится к нулю. А чтобы мясо не получилось сухим, при запекании и тушении используйте томатный или сливочный соус. Если же в планах обжарка, поможет панировка, например сухарная или из яиц и рубленой зелени. Произведено в зоне вылова.",0,2025-06-13 10:52:56,"Рыба, икра и морепродукты#Рыба замороженная",4.9,698,https://img.vkusvill.ru/pim/images/site/site_LargeWebP/3a3225b7-df12-4db4-a600-603783987a70.webp,piksha-file-spinka-bez-kozhi-zam-72813.html
https://vkusvill.ru/goods/piksha-file-bez-kozhi-zam-23192.html,Пикша филе без кожи зам.,1.61,0.24225352112676055,1000.0,1610.0,71.0,17.2,0.2,0,"пикша, вода питьевая (защитная глазурь). Присутствуют мелкие реберные кости. Будьте осторожны!Товар от производителейДанный товар поставляют несколько производителей, внешний вид и характеристики могут незначительно отличаться. Актуальные данные указаны на этикетке. Цена может отличаться в зависимости от региона или формата точки продажи (вендинг, микромаркет).Информация на этикетке может незначительно отличаться","Нежное деликатесное филе морской пикши радует ярким рыбным вкусом с мягкими молочными нотами. Диетическое мясо пикши идеально подходит для запекания, обжаривания в хрустящем кляре, приготовления супов, начинок ароматных пирогов и гурманских паштетов. Попробуйте рыбное рагу в горшочках или пикшу, запечённую в листьях лука-порея, или рулетики из пикши с тушёными яблоками и сливочным соусом. Произведено в зоне вылова.",0,2025-06-13 10:53:03,"Рыба, икра и морепродукты#Рыба замороженная",4.8,131,https://img.vkusvill.ru/pim/images/site/site_LargeWebP/807a84d1-1f59-406f-8f79-130c4694ffbf.webp,piksha-file-bez-kozhi-zam-23192.html
https://vkusvill.ru/goods/kongrio-tushka-zam-1369.html,Конгрио тушка зам.,1.115,0.24203069657615112,1000.0,1115.0,84.7,20.5,0.3,0,"конгрио, вода (глазурь) не более 5%Товар от производителейАктуальные данные указаны на этикетке. Цена может отличаться в зависимости от региона или формата точки продажи (вендинг, микромаркет).Информация на этикетке может незначительно отличаться","Потрошёные тушки дикого конгрио, без головы. Свежевыловленную рыбу придают шоковой заморозке ещё на корабле. Это позволяет в полной мере сохранить её вкусовые качества. Конгрио — нежная маложирная рыба с мягким ароматом. Иногда её называют «креветочной» за схожую с этим морепродуктом сладость во вкусе. Готовить конгрио одно удовольствие, ведь можно выбрать любой способ термообработки — плотное белое мясо даже при варке и тушении сохраняет свою структуру. Раздел Рецепты на нашем сайте поможет в создании вкусного блюда. Просто введите в строке поиска «Чилийский суп из конгрио».",0,2025-06-13 10:53:27,"Рыба, икра и морепродукты#Рыба замороженная",4.8,106,https://img.vkusvill.ru/pim/images/site_LargeWebP/ac6997f5-fea7-4607-bc46-5eb21168f3c5.webp?1723706483.1432,kongrio-tushka-zam-1369.html
https://vkusvill.ru/goods/piksha-file-portsionnoe-zam-400-g-73734.html,"Пикша филе порционное зам., 400 г",1.145,0.23465211459754434,400.0,458.0,73.3,17.2,0.5,0,"Пикша атлантическая, вода питьевая (защитная глазурь не более 5%)Товар от производителейДанный товар поставляют несколько производителей, внешний вид и характеристики могут незначительно отличаться. Актуальные данные указаны на этикетке. Цена может отличаться в зависимости от региона или формата точки продажи (вендинг, микромаркет).Информация на этикетке может незначительно отличаться","Порционное филе оптимально готовить без предварительной разморозки: так рыба лучше сохранит свою структуру. Нежное деликатесное филе морской пикши радует ярким рыбным вкусом с мягкими молочными нотами. Диетическое мясо пикши идеально подходит для запекания, обжаривания в хрустящем кляре, приготовления супов, начинок ароматных пирогов и гурманских паштетов. Произведено в зоне вылова.",0,2025-06-13 10:53:29,"Рыба, икра и морепродукты#Рыба замороженная",4.8,2159,https://img.vkusvill.ru/pim/images/site/site_LargeWebP/6c31f22d-17f1-4b9a-8c0d-69989665a008.webp,piksha-file-portsionnoe-zam-400-g-73734.html
https://vkusvill.ru/goods/myaso-kraba-kamchatskogo-pervaya-falanga-500-g-56708.html,"Мясо краба камчатского первая фаланга, 500 г",13.07,0.23428571428571426,500.0,6535.0,70.0,16.4,0.6,0.2,"натуральное мясо краба варено-мороженное, вода питьевая, соль поваренная пищевая.Товар от производителейАктуальные данные указаны на этикетке. Цена может отличаться в зависимости от региона или формата точки продажи (вендинг, микромаркет).Информация на этикетке может незначительно отличаться","Изысканный деликатес, который подчеркнёт торжественность застолья. Мясо краба отличается нежнейшей текстурой и особыми вкусовыми качествами, лишь отдалённо напоминающими креветки. В составе только вода и небольшое количество соли, чтобы вы могли насладиться натуральным вкусом. Масса основного продукта без заливки 300 г. В продукте могут оставаться частички хитина — полупрозрачные пластинки, которые являются естественной составляющей панциря. Рекомендуется удалить их до приготовления салатов и закусок. Мясо может иметь сероватый оттенок, что обусловлено отсутствием отбеливателей и процессом стерилизации. Во время варки при высокой температуре белок частично темнеет. Это не влияет на вкус, качество и безопасность продукта.",0,2025-06-13 10:53:25,"Рыба, икра и морепродукты#Рыбные консервы",Ждёт оценку,7,https://img.vkusvill.ru/pim/images/site_LargeWebP/f2e73dff-de0e-42e0-bd38-e515fbc59f5a.webp?1708710556.5504,myaso-kraba-kamchatskogo-pervaya-falanga-500-g-56708.html
https://vkusvill.ru/goods/kalmar-tikhookean-file-lomtiki-goryachego-kopcheniya-80-g-100506.html,"Кальмар тихоокеан. филе-ломтики горячего копчения, 80 г",2.4375,0.23397761953204477,80.0,195.0,98.3,23.0,0.7,0,"Кальмар филе, соль пищевая, регулятор кислотности - лимонная кислота.  Продукция производится на предприятии, где используются аллергены: горчица, рыба, яйца.","Нежное и мягкое филе кальмара, подкопчённое на ароматной древесной щепе. Не содержит консервантов и жидкого дыма. Отлично подходит на роль питательной закуски и для приготовления сытных салатов. Например, копчёный кальмар хорошо сочетается со сладкой кукурузой, пекинской капустой, отварными яйцами, свежими огурцами и рассыпчатым рисом.",0,2025-06-13 10:53:29,"Вегетарианское и постное#Растительное и с содержанием рыбы, яиц и молока#Рыба соленая и деликатесы",4.6,2588,https://img.vkusvill.ru/pim/images/site_for_feed/7f18cddb-01df-4c05-a30d-047bd9a8f40f.jpg?1734137058.8591,kalmar-tikhookean-file-lomtiki-goryachego-kopcheniya-80-g-100506.html
https://vkusvill.ru/goods/tunets-skipdzhek-file-naturalnyy-140-g-94533.html,"Тунец (скипджек) филе натуральный, 140 г",1.4857142857142858,0.23255813953488372,140.0,208.0,103.2,24.0,0.8,0,"тунец Скипджек, вода питьевая, соль пищевая.","Кусочки полосатого тунца в собственном соку. Нежные, ароматные, без излишков соли. Готовый ингредиент для сытных салатов, пасты, сэндвичей и нарядных закусок.",0,2025-06-13 10:53:24,Консервация#Рыбные консервы и морская капуста,4.9,8572,https://img.vkusvill.ru/pim/images/site_LargeWebP/3610091a-8d6f-4b46-9e1a-dd69659b5234.webp?1717794184.2542,tunets-skipdzhek-file-naturalnyy-140-g-94533.html
https://vkusvill.ru/goods/kalmar-komandorskiy-s-kozhitsey-naturalnyy-185-g-107169.html,"Кальмар командорский с кожицей натуральный, 185 г",1.162162162162162,0.23102866779089376,185.0,215.0,59.3,13.7,0.5,0,"кальмар, соль пищевая. Масса кальмара не менее 93 г.","Консервы с чистым составом: только нежные кусочки кальмара и немного соли. Отлично сочетаются со сладкой кукурузой, пекинской капустой, отварными яйцами, свежими огурцами и рассыпчатым рисом. Предварительно удалять кожицу не нужно: тонкая сама по себе, она стала совсем незаметной благодаря ферментации солью и варке. А вот полупрозрачные пластинки точно стоит удалить — это твёрдый хитин, который является естественной составляющей организма головоногих.",0,2025-06-13 10:53:29,"Рыба, икра и морепродукты#Рыбные консервы",4.6,1619,https://img.vkusvill.ru/pim/images/site_LargeWebP/2db684d6-8be1-4f32-8423-73a52d8300f4.webp?1739576069.9072,kalmar-komandorskiy-s-kozhitsey-naturalnyy-185-g-107169.html
https://vkusvill.ru/goods/tunets-zheltoperyy-file-kusochki-naturalnyy-140-g-19652.html,"Тунец (желтоперый) филе-кусочки натуральный, 140 г",1.6428571428571428,0.23076923076923078,140.0,230.0,104.0,24.0,1.0,0,"тунец, вода, сольТовар от производителейАктуальные данные указаны на этикетке. Цена может отличаться в зависимости от региона или формата точки продажи (вендинг, микромаркет).Информация на этикетке может незначительно отличаться","Мясистые ломтики желтопёрого тунца, законсервированные с добавлением небольшого количества соли. Филе идеально подойдёт для быстрого приготовления любимых блюд: салатов, боулов, питательных бутербродов и изысканных закусок.Страна производства: Таиланд.",0,2025-06-13 10:52:57,"Рыба, икра и морепродукты#Рыбные консервы",4.9,8986,https://img.vkusvill.ru/pim/images/site_LargeWebP/5e983794-3974-4bf0-82f6-2bcdbce52f70.webp?1722993295.7933,tunets-zheltoperyy-file-kusochki-naturalnyy-140-g-19652.html
