url,name,proteins,fats,carbohydrates,calories,category,price,availability,average_rating,rating_count,imgUrl,content,weight,pro/cal,pri/we,html_path,last_upd_time,description,fetchErr
https://www.ozon.ru/product/salat-s-indeykoy-su-vid-i-tykvoy-180-g-ozon-fresh-1999288106/,"Салат с индейкой су-вид и тыквой 180 г, Ozon fresh",10,8,14,162,Ozon fresh#Готовая еда#Салаты и закуски#Ozon fresh,209,1,4.8,153,https://cdn1.ozone.ru/s3/multimedia-1-m/7503348730.jpg,"салат (Тыква свежая, филе грудки индейки охлажденное, огурец свежий, бобы эдамаме, капуста пекинская свежая, зелень шпината свежая, семена кунжута черного, паприка молотая, соль пищевая, перец чили молотый), соус (масло подсолнечное рафинированное, концентрат апельсиновый, сироп из топинамбура, мёд, сок лимона прямого отжима, сок апельсина прямого отжима, цедра апельсина, соль пищевая)",180,0.06172839506172839,1.1611111111111112,,2025-06-15 06:30:44,,
https://www.ozon.ru/product/konvertiki-s-krem-chizom-i-vishney-140-g-creative-kitchen-2086645512/,"Конвертики с крем - чизом и вишней 140 г, Creative Kitchen",4.30,12.60,19.60,209,Ozon fresh#Готовая еда#Завтраки#Creative Kitchen,160,1,5.0,27,https://cdn1.ozone.ru/s3/multimedia-1-5/7349624105.jpg,"конвертики (молоко питьевое м.д.ж. 3,2%, меланж яичный жидкий пастеризованный, мука пшеничная хлебопекарная в/с, масло подсолнечное рафинированное дезодорированное, сахар, соль пищевая), крем-чиз (сыр сливочный м.д.ж. 69% (молоко, сливки, соль), сахар, масло сладко-сливочное несоленое м.д.ж. 72,5%, ароматизатор натуральный ваниль, соль пищевая), наполнитель пастеризованный «Вишня» (вода питьевая, вишня, сахар, крахмал кукурузный, сок лимона концентрированный, сок моркови концентрированный, ароматизатор натуральный). Будьте внимательны! Возможно попадание косточки!",140,0.020574162679425835,1.1428571428571428,,2025-06-15 06:30:47,,
https://www.ozon.ru/product/shokoladnye-pankeyki-so-smetannym-kremom-i-vishney-165-g-mates-2086645547/,"Шоколадные панкейки со сметанным кремом и вишней 165 г, Mates",7,8.7,38,257.9,Ozon fresh#Готовая еда#Завтраки#Mátes,194,1,4.8,31,https://cdn1.ozone.ru/s3/multimedia-1-k/7512948776.jpg,"Мука пшеничная хлебопекакарная, сыр творожный (Cыворотка молочная подсырная, молоко цельное, соль, регулятор кислотности лимонная кислота), яйцо куриное, молоко пастеризованоое
м.д.ж.3,2%,сахар, соль пищевая, разрыхлитель (дигидропирофосфат натрия; Гидрокарбонат натрия; крахмал кукурузный), дрожжи свежие хлебопекарные, какао (100% какао-порошок алкализованный), ванильный экстракт. Вишня джем(вишня с/м, вода питьевая, сахар). Крем сметанный (сметана м.д.ж. 20%, сливки м.д.ж. 20%, сахарная пудра(сахар))",165,0.027142303218301668,1.1757575757575758,,2025-06-15 06:30:51,,
https://www.ozon.ru/product/antipasti-olivki-s-myagkim-syrom-v-masle-240-g-burenka-club-407797244/,"Антипасти оливки с мягким сыром в масле 240 г, BURENKA CLUB",1.5,15.9,5,170,Ozon fresh#Готовая еда#Салаты и закуски#BURЁNKA CLUB,350,1,4.7,582,https://cdn1.ozone.ru/s3/multimedia-1-5/7460286269.jpg,"оливки, сыр мягкий сливочный (молоко пастеризованное нормализованное, пастеризованные сливки, закваска - мезофильные молочнокислые микроорганизмы, молокосвертывающий фермент микробиального происхождения, соль пищевая, стабилизатор: камедь рожкового дерева, ксантановая камедь, каррагинан, сахар), заливочная жидкость - масло растительное, смесь специй, упаковочный газ (азот).",240,0.008823529411764706,1.4583333333333333,,2025-06-15 06:30:53,"Группа итальянских закусок антипасти. В антипасти BURЁNKA CLUB в качестве  наполнителя используется сливочный сыр, который готовится по традиционной  итальянской рецептуре, имеет жирность 70% и нежный сливочный вкус.  Оливки BURЁNKA CLUB - эти оливки выращены на солнечных остравах и собраны зелеными в октябре.",
https://www.ozon.ru/product/chiabatta-s-kuritsey-i-sousom-gurme-160-g-kulinarium-2086645430/,"Чиабатта с курицей и соусом Гурмэ 160 г, Кулинариум",11.50,12.10,39.60,313.30,Ozon fresh#Готовая еда#Стритфуд#КУЛИНАРИУМ,209,1,4.6,65,https://cdn1.ozone.ru/s3/multimedia-1-s/7512948136.jpg,,160,0.036706032556654965,1.30625,,2025-06-15 06:30:56,"Не упустите шанс побаловать себя и своих близких чем-то особенным! Закажите нашу чиабатту с курицей и соусом «Гурмэ» и откройте для себя новый уровень вкуса, который вас приятно удивит",
https://www.ozon.ru/product/pasta-karbonara-250-g-eattery-1737332668/,"Паста Карбонара 250 г, Eattery",7.80,13.70,17.30,224,Ozon fresh#Готовая еда#Вторые блюда и супы#Вторые блюда#Eattery,249,1,4.7,113,https://cdn1.ozone.ru/s3/multimedia-1-8/7183397408.jpg,"вода питьевая, паста спагетти (мука из твердых сортов пшеницы высшего сорта, вода), бекон, продукт мясной сырокопченый из свинины охлажденный (свинина, соль нитритная (соль, фиксатор окраски (нитрит натрия)), регулятор кислотности (пирофосфат натрия, трифосфат натрия, ацетат натрия), декстроза, антиокислитель (изоаскорбат натрия), перец черный, чеснок), сливки питьевые ультрапастеризованные с массовой долей жира 22,0% (сливки нормализованные), сливки питьевые ультрапастеризованные с массовой долей жира 10,0% (сливки нормализованные), сыр Пармезан 40% (молоко пастеризованное, соль, мезофильные и термофильные молочнокислые микроорганизмы, молокосвертывающий ферментный препарат микробного происхождения), яйца куриные пищевые С1, масло подсолнечное рафинированное, бульон сухой куриный (соль, усилители вкуса и аромата (Е621, Е635), мальтодекстрин, крахмал кукурузный (содержит сульфиты), сахар, загуститель Е1420, мясо курицы сушеное, ароматизаторы, олеин пальмовый, овощи сушеные (лук репчатый, зелень петрушки), молоко сухое обезжиренное, куркума, красители (Е150d, Е101, Е100), перец черный, антислеживающий агент Е551), соль поваренная пищевая самосадочная, сорт первый (хлористый натрий (NaCl), массовая доля не менее 97,5%)),  пряность перец черный молотый (перец черный). Содержит естественный пшеничный белок - глютен. Возможно наличие следов орехов, арахиса, сои, горчицы, кунжута, сельдерея, молока, яиц , моллюсков, ракоообразных и рыбы.",250,0.03482142857142857,0.996,,2025-06-15 06:31:00,,
https://www.ozon.ru/product/omlet-s-syrom-i-shpinatom-165-g-creative-kitchen-2086645443/,"Омлет с сыром и шпинатом 165 г, Creative Kitchen",7.2,14.4,3.2,171.2,Ozon fresh#Готовая еда#Завтраки#Creative Kitchen,195,1,4.9,59,https://cdn1.ozone.ru/s3/multimedia-1-v/7512947203.jpg,"меланж яичный пастеризованный охлаждённый, сметана м.д.ж. 20% (сливки нормализованные, закваска молочнокислых культур), молоко питьевое пастеризованное м.д.ж. 3,2% (молоко цельное, молоко обезжиренное), шпинат измельчённый замороженный, сыр моцарелла м.д.ж. 36% (молоко нормализованное пастеризованное, соль пищевая, бактериальная закваска мезофильных и термофильных микроорганизмов, молокосвертывающий фермент животного происхождения), масло подсолнечное рафинированное дезодорированное, крахмал кукурузный, соль пищевая, масло сливочное 82,5%, чеснок свежий, лимонный сок (лимон свежий).",165,0.042056074766355145,1.1818181818181819,,2025-06-15 06:31:02,,
https://www.ozon.ru/product/gribnoy-krem-sup-300-g-ozon-fresh-2086645529/,"Грибной крем-суп 300 г, Ozon fresh",9,12,18,216,Ozon fresh#Готовая еда#Вторые блюда и супы#Супы#Ozon fresh,131,1,4.8,81,https://cdn1.ozone.ru/s3/multimedia-1-y/7349623522.jpg,"ВОДА ПИТЬЕВАЯ, ШАМПИНЬОНЫ, ЛУК РЕПЧАТЫЙ, СЛИВКИ ПИТЬЕВЫЕ, МАСЛО ПОДСОЛНЕЧНОЕ, МУКА ПШЕНИЧНАЯ, СОЛЬ, ЧЕСНОК, ПЕРЕЦ МОЛОТЫЙ. НА ПРЕДПРИЯТИИ ПЕРЕРАБАТЫВАЮТСЯ: СОЯ, ГОРЧИЦА, ЗЛАКИ, СОДЕРЖАЩИЕ ГЛЮТЕН, ОРЕХИ, СОЯ, ЯЙЦА И ПРОДУКТЫ ИХ ПЕРЕРАБОТКИ",300,0.041666666666666664,0.43666666666666665,,2025-06-15 06:31:05,,
https://www.ozon.ru/product/zharenyy-ris-s-utkoy-270-g-duckit-1851845512/,"Жареный рис с уткой 270 г, Duckit",5,10.8,20.9,201.1,Ozon fresh#Готовая еда#Вторые блюда и супы#Вторые блюда#DUCKIT,379,1,4.7,120,https://cdn1.ozone.ru/s3/multimedia-1-e/7564359938.jpg,"Рис с овощами: (рис отварной: (крупа рисовая, вода питьевая, масло подсолнечное рафинированное дезодорированное, соль пищевая), овощи для жаренного риса:(морковь столовая свежая, лук репчатый свежий, перец сладкий свежий, соус чили гарлик (соленый перец, чеснок, сахар, уксус, вода, денатурированный крахмал, бензоат натрия, ледниковая уксусная кислота), соя пророщенная пищевая, соус соевый (вода, соевые бобы, пшеница,соль, сахар, регулятор кислотности- уксусная кислота, усилитель вкуса и аромата Е621, консерванты: бензоат натрия; сорбат калия), уксус рисовый (вода питьевая, крупа рисовая), масло подсолнечное рафинированное дезодорированное, масло соево-кунжутное рафинированное, услилитель вкуса - глутамат натрия), скрембл яичный (яйцо куриное столовое пищевое, масло подсолнечное рафинированное дезодорированное), соус Чихо для риса: (соус соевый (вода, соевые бобы, пшеница,соль, сахар, регулятор кислотности- уксусная кислота, усилитель вкуса и аромата Е621, консерванты: бензоат натрия; сорбат калия),соус устричный(водапитьевая,  сахар, соль, устричный экстракт (устрицы, вода, соль)10%, загуститель -  модифицированнный крахмал, усилитель вкуса и аромата глутамат натрия, краситель - сахарный колер (1), консервант - сорбат калия), сахар,бульон куриный сухой (соль, ароматизаторы (содержат яичные и молочные продукты), мальтодекстрин, крахмал кукурузный, экстракт дрожжей, сахар, растительное масло, концентрат овощных соков (лука, моркови, сельдерея, лука-порея), краситель сахарный колер (III), фарш куриный сухой), бульон куриный жидкий(Вода, пищевые добавки: глутамат натрия(Е621), дикрахмалфосфат крахмал(Е1442); динатрий рубинуклеотид (Е635), ксантановая камедье(Е415), бета-каротин(Е160а); (Е110), сорбат калия(Е202), бензоат натрия(Е211); Соль, Куриный жир, Куриный порошок, дрожжевой экстракт, пищевые ароматизаторы), масло соево-кунжутное рафинированное, услилитель вкуса - глутамат натрия ), утка по–пекински(мясо уток (тушки) замороженное, сахар, соль пищевая, приправа""5 специй"" (бадьян молотый, перец сычуанский молотый, анис молотый, лакрица молотая, корица молотая), соус ""Хойсин"" (сахар, паста из соевых бобов (вода, соль пищевая, соевые бобы, пшеничная мука в/с), вода, соевый соус (вода, соль пищевая, соевые бобы, пшеничная мука в/с), уксус рисовый (вода, крупа рисовая), кукурузный крахмал, чеснок свежий, перец чили , специи, пищевой краситель сахарный колер (I), семена кунжута белого, антиокислитель аскорбат натрия, консервант сорбат калия, пищевой краситель кармин), соус ""Устричный"" (вода, сахар, соль пищевая, устричный экстракт (устрицы, вода, соль пищевая), загуститель модифицированный кукурузный крахмал, усилитель вкуса и аромата глутамат натрия, пищевой краситель сахарный колер (I), консервант сорбат калия), корень имбиря свежий, лук репчатый свежий, чеснок свежий, лук порей свежий, бадьян молотый, сахар, уксус столовый 9%), кинха зелень свежая, кунжут, семена.",270,0.02486325211337643,1.4037037037037037,,2025-06-15 06:31:08,,
https://www.ozon.ru/product/borshch-so-svezhey-kapustoy-i-myasom-900-g-creative-kitchen-2086645440/,"Борщ со свежей капустой и мясом 900 г, Creative Kitchen",5.20,6,4.20,380,Ozon fresh#Готовая еда#Вторые блюда и супы#Супы#Creative Kitchen,342,1,4.9,77,https://cdn1.ozone.ru/s3/multimedia-1-1/7512948145.jpg,"вода питьевая, свекла столовая свежая, мясо цыплят-бройлеров, капуста белокочанная свежая, картофель свежий, мясо говядины, продукты томатные концентрированные - паста томатная 25% (томатная паста, вода питьевая), морковь столовая свежая, лук репчатый свежий, сахар, масло подсолнечное рафинированное дезодорированное, соль пищевая, уксус столовый 9%, чеснок свежий, перец чёрный горошек, перец душистый горошек, лавровый лист, перец чёрный молотый. Изготовлено из замороженного мясного сырья.",900,0.01368421052631579,0.38,,2025-06-15 06:31:11,,
https://www.ozon.ru/product/shashlyk-svinoy-180-g-grillway-1667993851/,"Шашлык свиной 180 г, GrillWay",26.10,32.50,0.90,400.50,Ozon fresh#Готовая еда#Вторые блюда и супы#Вторые блюда#Гриль Вэй,299,1,4.7,949,https://cdn1.ozone.ru/s3/multimedia-1-l/7436967285.jpg,"свинина, лук репчатый свежий, масло подсолнечное рафинированное дезодорированное, соль пищевая, паприка молотая, базилик сушеный, перец красный чили сушеный.",180,0.0651685393258427,1.6611111111111112,,2025-06-15 06:31:15,,
https://www.ozon.ru/product/chiken-dog-95-g-i-like-eat-2086645415/,"Чикен-Дог 95 г, I like eat",12,16,22,280,Ozon fresh#Готовая еда#Стритфуд#I like eat,123,1,4.7,75,https://cdn1.ozone.ru/s3/multimedia-1-5/7349626445.jpg,"Булочка для хот дога (мука пшеничная хлебопекарная высший сорт, вода питьевая, сахар, масло подсолнечное рафинированное дезодорированное, соль, дрожжи хлебопекарные сухие инстантные, глютен пшеничный, консервант Е282, регулятор кислотности Е500ii, ферментные препараты, антиокислитель аскорбиновая кислота), мясо кур, соус ( майонез (масло подсолнечное рафинированное дезодорированное, вода, сахар, желток яичный, соль, регулятор кислотности - уксусная кислота; загуститель - гуаровая камедь и ксантановая камедь; ароматизатор, консерванты (сорбат калия, бензоат натрия); краситель - каротины; антиокислитель Е385.), соус Баварский (масло подсолнечное рафинированное дезодорированное, вода питьевая, овощной наполнитель (томаты, базилик сушёный, порошок лука, чеснок сушёный, паприка, черный перец), сахар, желток яичный, загустители (Е1422, гуаровая камедь, ксантановая камедь), молочный белок, соль, ароматизаторы, регуляторы кислотности (лимонная кислота, Е260), усилитель вкуса и аромата - глутамат натрия, консерванты (сорбат калия, бензоат натрия)), морковь отварная, огурцы маринованные (огурцы, вода питьевая, соль поваренная пищевая, регулятор кислотности E260; пряности и специи: семя горчицы, семя укропа, лук, чеснок, перец черный, лавровый лист, куркума;  уплотнитель: хлорид кальция; консерванты: бензоат натрия, сорбат калия; стабилизатор: гуаровая камедь; подсластитель: сукралоза).
Продукт может содержать следы: орехов и продуктов их переработки; аспартама (содержит источник фенилаланина), горчицы , злаков, содержащих глютен, кунжута,  люпина, моллюсков, ракообразных, рыбы, сельдерея, сои, яиц и продуктов их переработки; молока и продуктов его переработки (в том числе лактозы).",95,0.04285714285714286,1.2947368421052632,,2025-06-15 06:31:17,,
https://www.ozon.ru/product/blinchiki-s-klubnichno-malinovoy-nachinkoy-2-sht-h-60-g-cook-chart-1695751417/,"Блинчики с клубнично-малиновой начинкой 2 шт х 60 г, Cook Chart",2.90,2,24.80,128.80,Ozon fresh#Готовая еда#Завтраки#Cook Chart,119,1,4.7,849,https://cdn1.ozone.ru/s3/multimedia-1-y/7436919490.jpg,"блинчики (молоко пастеризованное м.д.ж. 3,29, мука пшеничная хлебопекарная высшего сорта, меланж яичный жидкий пастеризованный, сахар, крахмал картофельный высшего сорта, масла подсолнечное рафинированное дезодорированное, соль пищевая. комплексная пищевая добавка (консерванты (2621, t: 282), регулятор кислотности ESZI, фермент животного происхождения (лизоцим)), разрыхлитель гидрокарбонат натрия (сода пищевая), уксус столовый 9%, комплексная пищевая добавка (фермент животного происхождения (лизоцим), лактоза, антиокислитель Е330)), начинка наполнитель пастеризованный (ягоды клубники замороженные, клубничный сок, сахар, вода питьевая, глюкозно- фруктовый сироп, крахмал кукурузный, стабилизатор пектины, ароматизатор натуральный «Клубника»), наполнитель пастеризованный (сахар, вода питьевая, малина (крошка) замороженная, крахмал кукурузный, ароматизатор натуральный «малина»), комплексная пищевая добавка (консерванты (t211, t.202), соль пищевая), комплексная пищевая добавка (фермент животного происхождения (лизоцим), лактоза, антиокислитель Е330))
На предприятии используются следующие аллергены: кунжут, орехи, соя и продукты их переработки.",120,0.022515527950310556,0.9916666666666667,,2025-06-15 06:31:19,,
