url,name,proteins,fats,carbohydrates,calories,category,price,availability,average_rating,rating_count,imgUrl,content,weight,pro/cal,pri/we,html_path,last_upd_time,description,fetchErr
https://www.ozon.ru/product/utka-po-pekinski-v-nabore-s-blinchikami-ogurtsami-i-sousom-hoysin-260-g-duckit-1851845486/,"Утка по-пекински в наборе с блинчиками, огурцами и соусом Хойсин 260 г, Duckit",8.1,8.1,18.1,177.7,Ozon fresh#Готовая еда#Вторые блюда и супы#Вторые блюда#DUCKIT,559,0,4.6,259,https://cdn1.ozone.ru/s3/multimedia-1-g/7581577444.jpg,"Утка по-пекински ( мясо уток (тушки),  сахар белый, соль пищевая,  приправа ""5 специй"" (бадьян молотый, перец сычуанский молотый, анис молотый, лакрица молотая, корица молотая), соус «Хойсин» (сахар белый, паста из соевых бобов (вода, соевые бобы, соль пищевая, мука пшеничная высший сорт), вода, соевый соус (вода, соевые бобы, соль пищевая, мука пшеничная высший сорт), уксус рисовый (вода, крупа рисовая), загуститель крахмал кукурузный, чеснок, пищевые красители (сахарный колер (I) простой, кармин), перец чили, специи, семена кунжута белого, антиокислитель аскорбат натрия, консервант сорбат калия), соус ""Устричный"" (вода, сахар белый, соль пищевая, устричный экстракт (устрицы, вода, соль пищевая), загуститель крахмал кукурузный модифицированный, усилитель вкуса и аромата глутамат натрия, пищевой краситель  сахарный колер (I), консервант сорбат калия), корень имбиря свежий, лук репчатый свежий, чеснок свежий, лук порей свежий, бадьян молотый, сахар, уксус столовый 9%,);

блинчики (мука  пшеничная высший сорт, загуститель крахмал кукурузный, вода питьевая, масло подсолнечное рафинированное дезодорированное,  масло кунжутное нерафинированное темное, соль пищевая); 
соус «Хойсин» (сахар белый, паста из соевых бобов (вода, соевые бобы, соль пищевая, мука пшеничная высший сорт), вода, соевый соус (вода, соевые бобы, соль пищевая, мука пшеничная высший сорт), уксус рисовый (вода, крупа рисовая), загуститель крахмал кукурузный, чеснок, пищевые красители (сахарный колер (I) простой, кармин), перец чили, специи, семена кунжута белого, антиокислитель аскорбат натрия, консервант сорбат калия), вода, сахар, чеснок свежий, масло подсолнечное рафинированное дезодорированное); 

огурцы свежие.",260,0.04558244231851435,2.15,,2025-06-15 06:23:42,,
https://www.ozon.ru/product/bliny-s-yablokom-i-koritsey-140-g-miratorg-2086645356/,"Блины с яблоком и корицей 140 г, Мираторг",4,5,17,130,Ozon fresh#Готовая еда#Завтраки#Мираторг,76,1,4.4,42,https://cdn1.ozone.ru/s3/multimedia-1-k/7512947984.jpg,,140,0.03076923076923077,0.5428571428571428,,2025-06-15 06:23:46,Натуральная начинка из спелых ароматных яблок и корицы прекрасно сочетается с ажурным блинчиком. Настоящий домашний вкус!,
https://www.ozon.ru/product/pasta-s-kuritsey-v-slivochnom-souse-230-g-ozon-fresh-1062699368/,"Паста с курицей в сливочном соусе 230 г, Ozon fresh",10,7,28,215,Ozon fresh#Готовая еда#Вторые блюда и супы#Вторые блюда#Ozon fresh,200,1,4.8,82,https://cdn1.ozone.ru/s3/multimedia-1-1/7512946957.jpg,"макаронные изделия (мука из твердых сортов пшеницы, вода питьевая), молоко питьевое ультрапастеризованное м.д.ж. 3,2% (молоко цельное, молоко обезжиренное), филе грудки куриное, соус сырный (вода питьевая, подсолнечное масло, загустители: крахмал кукурузный, ксантановая камедь; сахар, соль, яичный желток, сырный порошок, уксус, регулятор кислотности лимонная кислота, консервант сорбат калия, ароматизатор ""Сыр Гауда"", антиокислитель E385, красители: аннато, куркумин), сливки питьевые ультрапастеризованные м.д.ж. 22%, мука пшеничная хлебопекарная высшего сорта, масло сладкосливочное м.д.ж. 82,5% (пастеризованные сливки из коровьего молока), масло подсолнечное рафинированное дезодорированное, соль пищевая, концентрат пищевой (специи натуральные и овощи сушеные: лук, чеснок, томат, паприка, куркума, петрушка, перец черный, укроп, майоран, перец красный, чабер, тимьян, соль, мальтодекстрин, сахар, крахмал кукурузный, масло растительное подсолнечное, экстракт дрожжей, порошок сока лимона, ароматизатор), комплексная пищевая добавка (глюкоза, волокна подорожника, сахар, соль пищевая), специи сушёные молотые (кориандр, мускатный орех, перец чёрный).",230,0.046511627906976744,0.8695652173913043,,2025-06-15 06:23:51,,
https://www.ozon.ru/product/angus-burger-s-gorchichnym-sousom-160-g-miratorg-317062190/,"Ангус бургер с горчичным соусом 160 г, Мираторг",9.2,28.1,24.7,388.8,Ozon fresh#Готовая еда#Стритфуд#Мираторг,180,1,4.6,6793,https://cdn1.ozone.ru/s3/multimedia-1-o/7436912460.jpg,"Котлета из говядины: говядина, вода питьевая, жир-сырец говяжий, бульон мясной жидкий концентрированный говяжий, смесь масел растительных (подсолнечное рафинированное дезодорированное высший сорт вымороженное, подсолнечное рафинированное дезодорированное первый сорт), лук, клетчатка соевая, мука пшеничная текстурированная, пищевые волокна (пшеничные), соль, загустители (конжаковая камедь, Е407, альгинат натрия, гуаровая камедь, ксантановая камедь), ароматизатор (содержит усилитель вкуса и аромата Е621, антиокислитель аскорбиновая кислота), перец черный, ароматизатор коптильный, стабилизаторы (Е450(i), E450(v)), продукт переработки крови черный альбумин говяжий, антиокислитель аскорбиновая кислота; 
Булка: мука пшеничная, сахар, масло растительное подсолнечное рафинированное дезодорированное, дрожжи, соль, семя кунжута, комплексная пищевая добавка улучшитель хлебопекарный (стабилизатор карбонат кальция, мука (соевая, пшеничная), эмульгатор Е472е, антиокислитель аскорбиновая кислота, вещество для обработки муки Е920, ферментные препараты микробного происхождения (альфа-Амилаза, ксиланаза));
Соус горчичный: масло растительное подсолнечное рафинированное дезодорированное, вода питьевая, желток яичный пастеризованный, томаты, семена горчицы, соль, сахар, мед, горчичный порошок, сливки питьевые стерилизованные, зелень петрушки сушеная, регуляторы кислотности (уксусная кислота ледяная, молочная кислота, лимонная кислота), загустители (гуаровая камедь, ксантановая камедь, Е407), лимонный сок сухой, мальтодекстрин, куркума, консерванты (сорбат калия, бензоат натрия), ароматизаторы натуральные (содержат горчицу), краситель каротины, антиокислитель (пиросульфит калия, Е385), пряности (кориандр, перец душистый, гвоздика, корица, базилик, мускатный орех, майоран, зира), паприка молотая, экстракты специй (содержат сельдерей), декстроза; Овощи: томаты, огурцы маринованные (огурцы, вода питьевая, сахар, соль, регулятор кислотности  уксусная кислота ледяная, укроп сушеный).",190,0.023662551440329214,0.9473684210526315,,2025-06-15 06:23:53,,
https://www.ozon.ru/product/borshch-s-kuritsey-ozon-fresh-900-g-1742481513/,"Борщ с курицей Ozon fresh, 900 г",7.50,6,14,140,Ozon fresh#Готовая еда#Вторые блюда и супы#Супы#Ozon fresh,389,1,4.8,434,https://cdn1.ozone.ru/s3/multimedia-1-n/7229384039.jpg,"Вода, свекла, картофель, капуста белокочанная, филе куриное, лук репчатый, морковь, томатная паста, масло подсолнечное, уксус 9%, чеснок, соль, сахар, лавровый лист, черный перец.",900,0.05357142857142857,0.43222222222222223,,2025-06-15 06:23:58,,
https://www.ozon.ru/product/ovsyanoblin-s-kuritsey-i-tomatami-210-g-mates-1900128948/,"Овсяноблин с курицей и томатами 210 г, Mates",13,9,6,157,Ozon fresh#Готовая еда#Вторые блюда и супы#Вторые блюда#Mátes,399,1,4.6,215,https://cdn1.ozone.ru/s3/multimedia-1-f/7438528599.jpg,"Овсяные хлопья, вода питьевая, яйцо куриное, соль пищевая. Начинка: сыр моцарелла (молоко, соль, закваска, фермент животного происхождения, хлористый кальций, лимонная кислота), томаты свежие, куриная грудка жареная,творожный сыр (Cыворотка молочная подсырная, молоко цельное, соль, регулятор кислотности лимонная кислота), сливки м.д.ж. 20%,петрушка свежая, укроп свежий, кинза свежая, чеснок сухой.",210,0.08280254777070063,1.9,,2025-06-15 06:24:04,,
https://www.ozon.ru/product/salat-iz-svekly-kinoa-s-apelsinovoy-zapravkoy-170-g-ozon-fresh-1999288145/,"Салат из свеклы, киноа с апельсиновой заправкой 170 г, Ozon fresh",5,8,17,169,Ozon fresh#Готовая еда#Салаты и закуски#Ozon fresh,191,1,4.8,159,https://cdn1.ozone.ru/s3/multimedia-1-2/7503348710.jpg,"Свекла запеченная (свекла свежая очищенная), киноа отварное (вода питьевая, крупа киноа), сыр фета м.д.ж. 35% (молоко пастеризованное, соль, молокосвертывающий фермент животного происхождения, регулятор кислотности Е577), руккола свежая, тыквенные семечки, соус (масло подсолнечное рафинированное, концентрат апельсиновый, сок лимона прямого отжима, соль пищевая)",170,0.029585798816568046,1.1235294117647059,,2025-06-15 06:24:09,,
https://www.ozon.ru/product/poke-s-krevetkami-i-sousom-alterno-210-g-yumi-2086645362/,"Поке с креветками и соусом Альтерно 210 г, Йуми",14.3,25,20,362.2,Ozon fresh#Готовая еда#Салаты и закуски#ЙУМИ,350,1,4.8,21,https://cdn1.ozone.ru/s3/multimedia-1-j/7512948343.jpg,"ПОКЕ (КИНОА ОТВАРНОЕ С ТРАВАМИ (КИНОА ОТВАРНОЕ (ВОДА, КИНОА, МАСЛО ПОДСОЛНЕЧНОЕ РАФИНИРОВАННОЕ ДЕЗОДОРИРОВАННОЕ, СОЛЬ, ЧЕСНОК), ПЕТРУШКА)), САЛАТ АЙСБЕРГ, АНАНАС КОНСЕРВИРОВАННЫЙ (АНАНАСЫ, ВОДА, САХАР,  РЕГУЛЯТОР КИСЛОТНОСТИ-Е330),  КРЕВЕТКА ОТВАРНАЯ (КРЕВЕТКА БЕЛОНОГАЯ (ПРОИЗВЕДЕНО ИЗ ЗАМОРОЖЕННОГО СЫРЬЯ, ПРОДУКЦИЯ АКВАКУЛЬТУРЫ), ВОДА ПИТЬЕВАЯ, СОЛЬ), БОБЫ ЭДАММАМЕ, АРАХИС ОБЖАРЕННЫЙ ИЗМЕЛЬЧЁННЫЙ), СОУС АЛЬТЕРНО (МАЙОНЕЗ (ПОДСОЛНЕЧНОЕ И ОЛИВКОВОЕ МАСЛО РАФИНИРОВАННОЕ ДЕЗОДОРИРОВАННОЕ, ВОДА, САХАР, ЯИЧНЫЙ ЖЕЛТОК, СОЛЬ ПИЩЕВАЯ, ЛИМОННЫЙ СОК ПРЯМОГО ОТЖИМА, УКСУС СПИРТОВОЙ 20%, ГОРЧИЧНОЕ МАСЛО НЕРАФИНИРОВАННОЕ), УКСУС РИСОВЫЙ (ВОДА ПИТЬЕВАЯ, РИСОВЫЙ УКСУС, РЕГУЛЯТОР КИСЛОТНОСТИ- Е330, САХАР, СОЛЬ ПИЩЕВАЯ), СОЕВЫЙ СОУС (ВОДА, СОЕВЫЕ БОБЫ, ПШЕНИЦА, СОЛЬ, САХАР), РЫБНЫЙ СОУС (РЫБА, СОЛЬ, УСИЛИТЕЛЬ ВКУСА И АРОМАТА Е635, ПОДСЛАСТИТЕЛЬ Е950), МАСЛО КУНЖУТНОЕ РАФИНИРОВАННОЕ",210,0.0394809497515185,1.6666666666666667,,2025-06-15 06:24:15,,
https://www.ozon.ru/product/spagetti-boloneze-s-govyadinoy-creative-kitchen-220-g-1759174564/,"Спагетти Болоньезе с говядиной Creative Kitchen, 220 г",4.3,8.4,14.2,117.2,Ozon fresh#Готовая еда#Вторые блюда и супы#Вторые блюда#Creative Kitchen,269,1,4.8,335,https://cdn1.ozone.ru/s3/multimedia-1-q/7436982338.jpg,"макаронные изделия отварные (вода питьевая, макаронные изделия из твердых сортов пшеницы Группа А в/с (мука из твердой пшеницы в/с, вода питьевая), соль пищевая, масло подсолнечное рафинированное дезодорированное), томаты нарезанные кубиком (томаты, томатный сок, регулятор кислотности лимонная кислота), говядина замороженная, вода питьевая, лук репчатый свежий, сельдерей стебель свежий, томатная паста с массовой долей растворимых сухих веществ 25% (томатная паста, вода питьевая), чеснок свежий, сыр твердый м.д.ж. 40% (молоко нормализованное пастеризованное, закваска культур молочнокислых микроорганизмов, молокросвертывающий ферментный препарат микробного происхождения, соль пищевая, уплотнитель хлорид кальция), жир говяжий замороженный, масло подсолнечное рафинированное дезодорированное, сахар, соль пищевая, базилик свежий, орегано сушеный, базилик сушеный.",220,0.03668941979522184,1.2227272727272727,,2025-06-15 06:24:20,,
https://www.ozon.ru/product/udon-s-kuritsey-i-ovoshchami-v-ustrichnom-souse-250-g-eattery-1737332672/,"Удон с курицей и овощами в устричном соусе 250 г, Eattery",8.20,9.70,16.60,187,Ozon fresh#Готовая еда#Вторые блюда и супы#Вторые блюда#Eattery,265,1,4.9,166,https://cdn1.ozone.ru/s3/multimedia-1-6/7183397478.jpg,"удон с овощами в устричном соусе (лапша пшеничная удон (пшеничная мука, соль, вода), масло подсолнечное рафинированное, кабачки свежие, морковь свежая, соус соевый (вода, соевые бобы, пшеница, соль, сахар), лук репчатый свежий,  перец сладкий болгарский свежий, соус для курицы сладкий чили (сахар, вода, красный перец чили 16%, чеснок, соль, модифицированный кукурузный крахмал, регулятор кислотности (уксусная кислота)), стебель сельдерея свежий, устричный соус (вода, сахар, соль, устричный экстракт (устрицы, вода, соль), модифицированный кукурузный крахмал, пшеничная мука, краситель (сахарный колер 1 простой)), сахар белый свекловичный кристаллический (кристаллическая сахароза), масло кунжутное рафинированное, соль поваренная пищевая самосадочная, сорт первый (хлористый натрий (NaCl), массовая доля не менее 97,5%)), филе куриное  (полуфабрикат из мяса цыпленка-бройлера натуральный филе охлажденное, масло подсолнечное рафинированное), семена кунжута белого, лук зеленый свежий. Содержит естественный пшеничный белок - глютен. Возможно наличие следов орехов, арахиса, сои, горчицы, кунжута, сельдерея, молока, яиц , моллюсков, ракоообразных, рыбы.",250,0.04385026737967914,1.06,,2025-06-15 06:24:26,,
https://www.ozon.ru/product/zapekanka-200-g-creative-kitchen-1062697977/,"Запеканка 200 г, Creative Kitchen,",16.2,21.6,26.7,366,Ozon fresh#Готовая еда#Завтраки#Creative Kitchen,142,1,4.8,115,https://cdn1.ozone.ru/s3/multimedia-1-0/7512947532.jpg,,200,0.04426229508196721,0.71,,2025-06-15 06:24:31,"Запеканка Creative Kitchen, 2 шт, 200 г",
https://www.ozon.ru/product/zharkoe-po-domashnemu-245-g-lavkalavka-1261101688/,"Жаркое по-домашнему 245 г, LavkaLavka",6.70,11.90,10.60,179,Ozon fresh#Готовая еда#Вторые блюда и супы#Вторые блюда#LavkaLavka,280,1,4.7,978,https://cdn1.ozone.ru/s3/multimedia-1-j/7436912491.jpg,,245,0.037430167597765365,1.1428571428571428,,2025-06-15 06:24:38,"Жаркое по-домашнему. Все приготовлено в казане на огне, с добавлением лука и моркови. В конце добавили картофель, лавровый лист, розмарин и черный перец. Блюда приготовленные в казане отличаются очень тонким ароматом и вкусом. А мясо получилось таким нежным, прямо тает во рту. Готовые блюда ЛавкаЛавка могут оставаться свежими несколько месяцев, потому что сразу после приготовления проходят UHT обработку.
Технология UHT - ultra-high temperature processing – это высокотемпературная обработка, которая позволяет увеличить срок годности продукта без использования консервантов и стабилизаторов.
На нашем производстве она строго регламентирована по времени и не нарушает структуру продукта.
Для каждого блюда свой режим. Дольше всего в автоклаве выдерживаются мясные блюда – около 40 минут.
 
Таким образом, все питательные вещества остаются в продукте и сохраняется уникальный домашний вкус блюда.
Секрет этого особого вкуса в том, что мы готовим все блюда в чугунных казанах.
Форма казана способствует равномерному нагреву блюда, а приготовление на открытом огне лучше раскрывает вкус и аромат продуктов.
Рецепты авторские, их разрабатывает шеф-повар с огромным опытом Денис Смирнов.
Он лично контролирует закупку всех продуктов, и это важное условие создания вкусного и качественного блюда.
 
ЛавкаЛавка берёт на себя ежедневные хлопоты по приготовлению обедов и ужинов. Нашим покупателям остаётся только достать упаковку и разогреть вкусную еду.",
https://www.ozon.ru/product/salat-iz-sladkoy-pechenoy-svekly-s-keshyu-i-chernoslivom-200-g-ozon-fresh-2062876969/,"Салат из сладкой печеной свеклы с кешью и черносливом 200 г, Ozon fresh",1.9,20.3,11.8,237,Ozon fresh#Готовая еда#Салаты и закуски#Ozon fresh,229,1,4.7,105,https://cdn1.ozone.ru/s3/multimedia-1-2/7538557358.jpg,"шпинат свежий, капуста китайская, салат айсберг, свекла запеченная (свекла отварная, соус соевый (вода питьевая, соевые бобы, пшеничная мука, соль пищевая, сахар, подсластители: Е952, Е954, Е950, усилители вкуса и аромата: Е621, Е635, регулятор кислотности: кислота молочная, краситель: сахарный колер, консерванты: Е202, Е211), мед натуральный цветочный), чернослив, орех кешью, заправка (масло подсолнечное рафинированное дезодорированное, малина протертая с сахаром (малина с/м, сахар-песок), бальзамический уксус (винный уксус (вино, антиокислитель Е224), концентрированное виноградное сусло, краситель Е150d), соус табаско (пюре красного перца табаско, уксус спиртовой натуральный, соль, загуститель - ксантановая камедь), соль пищевая (соль пищевая выварочная, агент антислеживающий Е536))",200,0.008016877637130802,1.145,,2025-06-15 06:24:44,"Мягкая запеченная свекла, хрустящие кешью и сладкий чернослив в гармоничном дуэте. Натуральная сладость и польза в каждой ложке!",
