url,name,proteins,fats,carbohydrates,calories,category,price,availability,average_rating,rating_count,imgUrl,content,weight,pro/cal,pri/we,html_path,last_upd_time,description,fetchErr
https://www.ozon.ru/product/salat-bavarskiy-s-vetchinoy-200-g-kak-vkusno-2086645436/,"Салат Баварский с ветчиной 200 г, Как Вкусно",3,25,10,280,Ozon fresh#Готовая еда#Салаты и закуски#Как вкусно!,97,1,4.9,33,https://cdn1.ozone.ru/s3/multimedia-1-i/7512947622.jpg,"картофель отварной, майонез (масло подсолнечное рафинированное дезодорированное, вода, сахар-песок, желток яичный пастеризованный, соль, регулятор кислотности Е260, загустители (гуаровая камедь, ксантановая камедь), краситель каротины, консерванты (бензоат натрия, сорбат калия), антиокислитель E385), ветчина (свинина, вода, крахмал картофельный, нитритно-посолочная смесь (соль, фиксатор окраски - Е250), белок животный свиной, белок яичный сухой, загустители (E407, E412), сахар, регуляторы кислотности (E450i, E451ii, E262ii, E262i), белок молочный, ароматизаторы, усилитель вкуса и аромата Е621, краситель (E120)), морковь отварная, меланж, консервированная кукуруза (кукуруза, вода, сахар, соль), огурцы маринованные (огурцы, вода, соль, сахар, регулятор кислотности Е260, консерванты (E202, E211), специи, краситель Е100).",200,0.010714285714285714,0.485,,2025-06-15 06:15:24,,
https://www.ozon.ru/product/salat-tsezar-s-klassicheskoy-zapravkoy-190-g-belaya-dacha-877162051/,"Салат Цезарь с классической заправкой 190 г, Белая Дача",8,5.5,8.5,110,Ozon fresh#Готовая еда#Салаты и закуски#Белая Дача,389,1,4.8,4118,https://cdn1.ozone.ru/s3/multimedia-1-9/7436937897.jpg,,190,0.07272727272727272,2.0473684210526315,,2025-06-15 06:15:31,"Салат ""Цезарь"" с классической заправкой внутри - идеальный вариант для быстрого и лёгкого перекуса.

Белая Дача представляет новую серию
полноценных блюд — готовые салаты в удобных
раздельных упаковках, разработанные бренд-шефом Белая Дача Филиппом Ковальчуком.
Мы специально не стали смешивать продукты
в упаковке и не добавили заправку в момент
приготовления, чтобы гарантировать
безопасность и удобный срок хранения салатных
блюд. Каждый ингредиент наших салатов на 100% 
готов к столу: осталось только открыть, добавить
фирменный соус и перемешать.
Внутри салатного бокса есть биоразлагаемая вилка, а сама упаковка произведена из перерабатываемого пластика.",
https://www.ozon.ru/product/befstroganov-iz-govyadiny-s-kartofelnym-pyure-280-g-creative-kitchen-2086645476/,"Бефстроганов из говядины с картофельным пюре 280 г, Creative Kitchen",3.20,7,9.90,115.40,Ozon fresh#Готовая еда#Вторые блюда и супы#Вторые блюда#Creative Kitchen,181,1,4.8,114,https://cdn1.ozone.ru/s3/multimedia-1-b/7512946787.jpg,,280,0.02772963604852686,0.6464285714285715,,2025-06-15 06:15:38,"Бефстроганов из говядины Creative Kitchen с картофельным пюре, 280 г",
https://www.ozon.ru/product/onigiri-s-krevetkoy-110-g-i-like-eat-2086645457/,"Онигири с креветкой 110 г, I like eat",4,15,23,240,Ozon fresh#Готовая еда#Стритфуд#I like eat,125,1,4.5,62,https://cdn1.ozone.ru/s3/multimedia-1-l/7512948093.jpg,"Рис, соус соевый(вода, сахар, соевый соус концентрированный (обезжиренная соя, пшеница, подсластитель - сукралоза), соль, соус рисовый (глюкозный сироп, уксус рисовый), сухая стружка тунца, усилитель вкуса и аромата - глутамат натрия, краситель пищевой - сахарный колер Е150d, консерванты: бензоат натрия, сорбат калия. Может содержать следы горчицы, яиц, кунжута, арахиса и продуктов их переработки), майонез (масло подсолнечное рафинированное дезодорированное, вода, сахар, желток яичный, соль, регулятор кислотности Е260; загуститель - гуаровая камедь и ксантановая камедь; ароматизатор, консерванты (сорбат калия, бензоат натрия); краситель - каротины.), креветка, крем кулинарный (молоко обезжиренное, растительные масла, стабилизаторы: Е1442, Е331ii; соль, кукурузный крахмал, загустители: пектины, Е407, Е466; консервант - сорбат калия, эмульгатор - Е435, антиокислитель — Е385, ароматизатор, закваска молочнокислых мезофильно-термофильных культур), меланж, уксус рисовый (спиртовой уксус, рисовый уксус, вода, сахар, соль, патока), соус гриль (вода, масло подсолнечное рафинированное дезодорированное, паста с заменителем молочного жира ""Старокрестьянская"" (молоко восстановленное из сухого обезжиренного молока, масло пальмовое, заменитель молочного жира (натуральные и модифицированные рафинированные дезодорированные масла, эмульгатор Е471), заменитель молочного жира (рафинированные дезодорированные растительные масла в натуральном и модифицированном виде, антиокислитель Е306), загуститель Е 1442, желатин, молочный белок, стабилизаторы Е 412, Е340ii, эмульгатор Е471, ароматизатор, консервант Е202 с использованием закваски молочнокислых микроорганизмов), томатная паста, загустители (Е1422, гуаровая камедь, ксантановая камедь), ароматизаторы, сахар, желток яичный, соль, мускатный орех, перец черный, перец чили, регуляторы кислотности (Е260, молочная кислота, лимонная кислота), горчичный порошок, консерванты (сорбат калия, бензоат натрия), красители (Е150d, Е160С)), сыр(пастеризованное коровье молоко, соль, мезофильные и термофильные молочнокислые микроорганизмы, молокосвертывающий ферментный препарат животного происхождения, уплотнитель хлорид кальция, пищевой натуральный краситель Аннато), имбирь (имбирь, вода, соль, регуляторы кислотности - уксусная кислота Е260, лимонная кислота Е330, подсластители - сахарин Е954, аспартам (Е951 - содержит источник фенилаланина), усилитель вкуса и аромата - глутамат натрия Е621, консервант - сорбат калия Е202, краситель (Е129 - содержит краситель, который может оказывать отрицательное влияние на активность и внимание детей)),водоросли нори, сахар, соль, масло подсолнечное рафинированное дезодорированное. Упаковочный газ (азот, диоксид углерода).",110,0.016666666666666666,1.1363636363636365,,2025-06-15 06:15:44,,
https://www.ozon.ru/product/sup-pyure-syrnyy-s-krevetkami-azbuka-vkusa-270-g-711533852/,"Суп-пюре сырный с креветками Азбука вкуса, 270 г",5.3,7.5,8.3,121.9,Ozon fresh#Готовая еда#Вторые блюда и супы#Супы#Азбука Вкуса,313,1,5.0,245,https://cdn1.ozone.ru/s3/multimedia-1-l/7446965133.jpg,"Молоко, вода,  картофель, морковь, креветки белоногие очищенные (креветки (Litopenaeus vannamei), сыр плавленый ""Дружба"" (сыр, масло сливочное, вода питьевая, сухое обезжиренное молоко, загустители (Е1422,каррагинан,, ксантановая камедь, камедь целлюлозы,Е1450), эмульгатор Е 331, соль пищевая, регулятор кислотности лимонная кислота, консервант сорбат калия, ароматизатор), сливки (нормализованные сливки), лук репчатый, сыр полутвердый(нормализованная молочная смесь (цельное молоко, восстановленное обезжиренное молоко из сухого молока, сливки), соль, уплотнитель хлорид кальция, ферментный препарат животного происхождения лизоцим, молокосвертыващий ферментный препарат микробного происхождения, мезофильная бактериальная заквасочная культура, натуральный краситель аннато), масло подсолнечное рафинированное, соль, чеснок.",270,0.043478260869565216,1.1592592592592592,,2025-06-15 06:15:49,"В холодное время года крем-супы идеальны для рациона! Попробуйте наш сырный суп-пюре — блюдо для настоящих гурманов. Нежнейшие креветки — главный ингредиент этого сырного шедевра, который привносит оригинальность. Полутвёрдый сыр придаёт супу богатый аромат, а плавленый — сливочный вкус.",
https://www.ozon.ru/product/funchoza-s-govyadinoy-i-ovoshchami-v-ustrichnom-souse-250-g-ozon-fresh-2086645560/,"Фунчоза с говядиной и овощами в устричном соусе 250 г, Ozon fresh",6,3.1,12,100,Ozon fresh#Готовая еда#Вторые блюда и супы#Вторые блюда#Ozon fresh,167,1,4.7,64,https://cdn1.ozone.ru/s3/multimedia-1-e/7512948266.jpg,"фунчоза отварная (вода, фунчоза (крахмал гороха, крахмал зеленых бобов, питьевая вода)), перец болгарский красный, морковь свежая, фасоль стручковая, лук репчатый, говядина су-вид (говядин, вода, соль), устричный соус премиум (устрица гигантская (crassostrea gigas) подкопченная, вода питьевая, соль, сахар, кукурузный крахмал, уксусная кислота), сладкий чили соус (сахар, вода, перец чили, соль, чеснок, кукурузный крахмал, регулятор кислотности уксусная кислота ледяная, загуститель ксантановая камедь), соевый соус (вода, соевая мука ORGANIC, соль, пшеница, соевые бобы, дрожжевой экстракт), масло подсолнечное рафинированное дезодорированное, семя кунжута белое чищенное обжаренное, крахмал кукурузный",250,0.06,0.668,,2025-06-15 06:15:57,,
https://www.ozon.ru/product/pasta-fettuchine-s-dobavleniem-yaytsa-solo-fresco-250-g-1080135710/,"Паста феттучине с добавлением яйца Solo Fresco, 250 г",11,3,56,300,"Ozon fresh#Бакалея#Макароны, крупы, мука#Макаронные изделия#SOLOFRESCO",175,1,4.9,1144,https://cdn1.ozone.ru/s3/multimedia-1-o/7388180808.jpg,,250,0.03666666666666667,0.7,,2025-06-15 06:16:04,"Фетучини — это спагетти, изготовленные из твердых сортов пшеницы. После варки они всегда остаются упругими, жесткими, прекрасно удерживают соус и их легко есть. Относятся к семейству длинных макаронных изделий, скрученных в гнезда. В переводе с итальянского “фетучини” означает “ленточка”. 
Создателем этого вида пасты является Альфредо ди Лелио. Прекрасная романтическая история гласит, что после рождения сына у его жены пропал аппетит, и чтобы порадовать супругу Альфредо придумал блюдо из интересных “ленточек” в нежном соусе, которые по сей день широко распространены по всему миру.  
Фетучини очень универсальны в приготовлении и подаются с различными соусами, особенно рекомендуются в рецептах с томатным соусом и мясным рагу. А также прекрасно подходят для приготовления рецептов на основе морепродуктов, особенно с моллюсками.",
https://www.ozon.ru/product/borshch-s-govyadinoy-300-g-ozon-fresh-2086645523/,"Борщ с говядиной 300 г, Ozon fresh",7.50,6,14,140,Ozon fresh#Готовая еда#Вторые блюда и супы#Супы#Ozon fresh,125,1,4.7,150,https://cdn1.ozone.ru/s3/multimedia-1-h/7512947945.jpg,"ВОДА, СВЕКЛА, КАРТОФЕЛЬ, КАПУСТА БЕЛОКАЧАННАЯ, ГОВЯДИНА, ЛУК РЕПЧАТЫЙ, МОРКОВЬ, ТОМАТНАЯ ПАСТА, МАСЛО ПОДСОЛНЕЧНОЕ, КОНЦЕНТРАТЫ  СУХИЕ (СОЛЬ, СВЕКЛА, УСИЛИТЕЛИ ВКУСА И АРОМАТА (ГЛУТАМАТ НАТРИЯ 1-ЗАМЕЩЕННЫЙ, 5'-ГУАНИЛАТ НАТРИЯ 2-ЗАМЕЩЕННЫЙ, 5'-ИНОЗИНАТ НАТРИЯ 2-ЗАМЕЩЕННЫЙ), МАЛЬТОДЕКСТРИН, САХАР, РАСТИТЕЛЬНЫЙ ЖИР, АРОМАТИЗАТОРЫ (СОДЕРЖАТ МОЛОЧНЫЕ И ЯИЧНЫЕ ПРОДУКТЫ), КУРКУМА, КРАСИТЕЛЬ (САХАРНЫЙ КОЛЕР III), ЭКСТРАКТ ДРОЖЖЕЙ, ФАРШ ГОВЯЖИЙ СУХОЙ, ФАРШ КУРИНЫЙ СУХОЙ, РЕГУЛЯТОР КИСЛОТНОСТИ (ЛИМОННАЯ КИСЛОТА), ЧЕСНОК, МАЙОРАН, ЛАВРОВЫЙ ЛИСТ, ПЕРЕЦ ЧЕРНЫЙ), УКСУС, ЧЕСНОК. НА ПРЕДПРИЯТИИ ПЕРЕРАБАТЫВАЮТСЯ: СОЯ, ЗЛАКИ, СОДЕРЖАЩИЕ ГЛЮТЕН, МОЛОКО, ГОРЧИЦА, ЯИЦА, ОРЕХИ И ПРОДУКТЫ ИХ ПЕРЕРАБОТКИ",300,0.05357142857142857,0.4166666666666667,,2025-06-15 06:16:08,,
https://www.ozon.ru/product/salat-metelka-s-tykvennymi-s-semechkami-100-g-azbuka-vkusa-1998034223/,"Салат Метёлка с тыквенными с семечками 100 г, Азбука Вкуса",1.9,8.9,6.9,115.3,Ozon fresh#Готовая еда#Салаты и закуски#Азбука Вкуса,172,1,4.8,113,https://cdn1.ozone.ru/s3/multimedia-1-a/7439484790.jpg,,100,0.01647875108412836,1.72,,2025-06-15 06:16:14,"Яркий фитнес-салат для людей, следящих за своим весом и здоровьем. Мы готовим его из свежих овощей и фруктов: яркой свеклы, хрустящей моркови, пикантного корня сельдерея и сочных яблок. Салат дополнен ароматной заправкой из оливкового масла и лимонного сока с добавлением петрушки и тыквенных семечек. Получите максимальный заряд витаминов и вкуса!",
https://www.ozon.ru/product/salat-seld-pod-shuboy-400-g-creative-kitchen-2086645455/,"Салат Сельдь под шубой 400 г, Creative Kitchen",5.3,11.2,6.6,148.4,Ozon fresh#Готовая еда#Салаты и закуски#Creative Kitchen,197,1,4.4,125,https://cdn1.ozone.ru/s3/multimedia-1-y/7512948214.jpg,,400,0.03571428571428571,0.4925,,2025-06-15 06:16:21,Знаменитый салат из отборной сельди по классической рецептуре.,
https://www.ozon.ru/product/grechotto-so-slivkami-gribami-i-syrom-200-g-creative-kitchen-1062699026/,"Гречотто со сливками, грибами и сыром 200 г, Creative Kitchen",3.8,5.6,13.9,121.2,Ozon fresh#Готовая еда#Вторые блюда и супы#Вторые блюда#Creative Kitchen,110,1,4.8,140,https://cdn1.ozone.ru/s3/multimedia-1-1/7512947461.jpg,,200,0.03135313531353135,0.55,,2025-06-15 06:16:27,Гречка с кусочками обжаренных шампиньонов и сыра в нежном сливочном соусе,
https://www.ozon.ru/product/humus-chili-pikantnyy-300-g-sababa-167101119/,"Хумус Чили, пикантный 300 г, Sababa",7.7,29.3,10.1,333,Ozon fresh#Готовая еда#Салаты и закуски#Sababa,322,1,4.9,1116,https://cdn1.ozone.ru/s3/multimedia-1-v/7436969599.jpg,,300,0.023123123123123125,1.0733333333333333,,2025-06-15 06:16:34,"Признанный средиземноморский деликатес. Отлично сочетается с блюдами на гриле, овощами и соленьями. Идеальная заправка для сэндвичей, брускетта и бутербродов.",
https://www.ozon.ru/product/vareniki-s-kartofelem-i-lukom-so-smetanoy-200-g-creative-kitchen-2086645379/,"Вареники с картофелем и луком со сметаной 200 г, Creative Kitchen",3.20,5.80,20.60,147.40,Ozon fresh#Готовая еда#Вторые блюда и супы#Вторые блюда#Creative Kitchen,110,1,4.9,173,https://cdn1.ozone.ru/s3/multimedia-1-u/7512948030.jpg,"тесто (мука пшеничная хлебопекарная высшего сорта, вода питьевая, меланж яичный жидкий, масло подсолнечное рафинированное дезодорированное, соль пищевая, глютен пшеничный, комплексная пищевая добавка (растительные волокна (из подорожника), мука пшеничная термостабильная, антиокислитель аскорбиновая кислота, ферменты (грибная глюкозооксидаза, грибная ксиланаза, бактериальная ксиланаза, грибная липаза), начинка (картофель свежий, лук репчатый свежий, масло подсолнечное рафинированное дезодорированное, соль пищевая, перец черный молотый), сметана (сливки, закваска молочнокислых микроорганизмов).",200,0.02170963364993216,0.55,,2025-06-15 06:16:41,,
https://www.ozon.ru/product/chiabatta-s-vetchinoy-i-gorchichnym-sousom-190-g-miratorg-1062697979/,"Чиабатта с ветчиной и горчичным соусом 190 г, Мираторг",8,14,28,393,Ozon fresh#Готовая еда#Стритфуд#Мираторг,139,1,4.8,62,https://cdn1.ozone.ru/s3/multimedia-1-n/7512946907.jpg,"чиабатта (мука пшеничная хлебопекарная высшего сорта, вода питьевая, соль, масло подсолнечное рафинированное дезодорированное, комплексная пищевая добавка (эмульгатор эфиры глицерина и диацетилвинной и жирных кислот, антиокислитель (аскорбиновая кислота), ферментный препарат микробного происхождения), дрожжевые культуры); окорок свиной варено-копченый (свинина, вода питьевая, посолочно-нитритная смесь (соль, фиксатор окраски (нитрит натрия)), стабилизаторы (пирофосфат калия), сахар, пряности (перец черный, перец душистый), усилитель вкуса и аромата (глутамат натрия 1-замещенный), антиокислитель (аскорбиновая кислота, L-), регуляторы кислотности (ацетат натрия)); соус (масло подсолнечное рафинированное, вода питьевая, горчица столовая, кетчуп(вода питьевая, паста томатная, сахар, уксусная кислота, соль, экстракты специй), яичный желток, сахар, соль, регуляторы кислотности (лимонная кислота, уксусная кислота), стабилизатор (ксантановая камедь), краситель (бета-каротин), ароматизатор натуральный пищевой); огурцы маринованные (огурцы, вода питьевая, уксус, сахар, соль пищевая, перец черный горошек).

На предприятии используются продукты переработки: молока, глютена, сельдерея, орехов, кунжута, горчицы, сои, яиц, сульфитов, рыбы, моллюсков и ракообразных.",190,0.020356234096692113,0.7315789473684211,,2025-06-15 06:16:48,,
https://www.ozon.ru/product/konvertiki-s-krem-chizom-i-vishney-140-g-creative-kitchen-1604929455/,"Конвертики с крем - чизом и вишней 140 г, Creative Kitchen",4.30,12.60,19.60,209,Ozon fresh#Готовая еда#Завтраки#Creative Kitchen,229,1,4.9,555,https://cdn1.ozone.ru/s3/multimedia-1-y/7579208338.jpg,"конвертики (молоко питьевое м.д.ж. 3,2%, меланж яичный жидкий пастеризованный, мука пшеничная хлебопекарная в/с, масло подсолнечное рафинированное дезодорированное, сахар, соль пищевая), крем-чиз (сыр сливочный м.д.ж. 69% (молоко, сливки, соль), сахар, масло сладко-сливочное несоленое м.д.ж. 72,5%, ароматизатор натуральный ваниль, соль пищевая), наполнитель пастеризованный «Вишня» (вода питьевая, вишня, сахар, крахмал кукурузный, сок лимона концентрированный, сок моркови концентрированный, ароматизатор натуральный). Будьте внимательны! Возможно попадание косточки!",140,0.020574162679425835,1.6357142857142857,,2025-06-15 06:16:55,,
